adeaa0ffdb	4919df8827	Mon Nov 28 14:32:16 2022 -0500	bazel: fix incorrect reference in Swift test rule (#268)
4919df8827	16433d4be4	Mon Nov 28 14:32:16 2022 -0500	swift: fix naming of trailer removal functions (#266)
16433d4be4	fd034cb8c1	Mon Nov 28 14:32:16 2022 -0500	swift: fix RetryPolicy equatability & add tests (#267)
701111262d	7c70b83cbb	Mon Nov 28 14:32:16 2022 -0500	perf: update iOS docs after libevent fix (#227)
f906f6a4ce	5ce3f63081	Mon Nov 28 14:32:16 2022 -0500	docs: fix link CPU/battery analysis (#223)
9977f869ba	0e334bf19e	Mon Nov 28 14:32:15 2022 -0500	ios: add launch screens to fix sizing (#204)
11424c3f61	13229c81d7	Mon Nov 28 14:32:15 2022 -0500	swift: fix demo when building on device (#163)
13229c81d7	3c95888a2b	Mon Nov 28 14:32:15 2022 -0500	objc: fix demo when building on device (#162)
3c95888a2b	af7365bfda	Mon Nov 28 14:32:15 2022 -0500	demo: fix incorrectly named swift file (#161)
3e79ecec51	34752ae434	Mon Nov 28 14:32:15 2022 -0500	comment: small typo fix (#157)
1c256a7e84	be3c3b2438	Mon Nov 28 14:32:15 2022 -0500	java: fix src name dependency rename (#156)
6dab720177	a751005420	Mon Nov 28 14:32:15 2022 -0500	lint: fix format checker script (#150)
4f3ab7c030	43f1171b66	Mon Nov 28 14:32:15 2022 -0500	docs: remove macOS Android bug reference (#139)
f1c11f264b	7cca6320f2	Mon Nov 28 14:32:15 2022 -0500	docs: fix copyright (#126)
3455fb609e	7de831404e	Mon Nov 28 14:32:14 2022 -0500	Misc doc fixes (#90)
dbe7e48ba6	9d38105ae3	Mon Nov 28 14:32:14 2022 -0500	docs: fix pull request template (#70)
7f4831425f	b46685e5d4	Mon Nov 28 14:32:14 2022 -0500	upstream: update upstream to include pre-push fix (#69)
187659eb45	7dac770975	Mon Nov 28 14:32:14 2022 -0500	docs: fix incorrect project title & repo links (#57)
3e161df4bf	b34aa2cd28	Mon Nov 28 17:33:33 2022 +0000	[balsa] Fix 304WithBody test and add HTTP1 codec 304 test. (#24132)
bba0a84834	92d3e7304d	Fri Nov 25 15:57:05 2022 -0500	mobile: fix a typo (#24187)
3e6e6c85a0	389bbd8748	Wed Nov 23 18:01:12 2022 +0000	Fix typo (#24160)
389bbd8748	bfa8b05fa0	Wed Nov 23 17:58:48 2022 +0000	utility: fix broken URL in checkTransportVersion() utility method (#24166)
972c897f83	76fb1f77d1	Wed Nov 23 12:15:18 2022 -0500	mobile: fixing up workflows to be less enthusiastic (#24178)
6abd77ef63	f83a934815	Tue Nov 22 20:41:35 2022 +0000	build: repo merge fix ups (#24148)
48803f946a	2a445d7737	Tue Nov 22 13:27:12 2022 -0500	ci: Fix /dev/stderr err (#24107)
2a445d7737	978a5f937a	Tue Nov 22 17:59:59 2022 +0000	mobile: Fix dangling link (#24143)
8b1791f547	adae4baaf4	Tue Nov 22 08:31:23 2022 +0000	Fix typo in http3_upstream.md (#24138)
d72fb7c8b7	8a26244b28	Mon Nov 21 19:56:05 2022 +0000	test: fixing lds flake (#24071)
e368c3e5e6	49d03632c4	Thu Nov 17 07:21:50 2022 -0800	quic: fix dangling delayed close (#23961)
d020dab075	3e555b1439	Tue Nov 15 15:06:30 2022 -0500	Add cache_file_fixed_block as first piece of filesystem_cache (#23847)
7663ed0f23	0fc8c50d4b	Tue Nov 15 10:33:32 2022 -0500	build: fix build breakage due to merge issue (#23999)
e711d101ec	f688df7cab	Tue Nov 15 10:26:10 2022 -0500	build: More sizeopt fixes (#23996)
736fc7cecc	951141d642	Tue Nov 15 08:55:37 2022 -0500	build: fixing brokend dead strip (#23943)
ab656012d5	3b8beabfca	Mon Nov 14 15:23:12 2022 -0500	[balsa] Fix BalsaParser::isHttp11(). (#23915)
41bdb01d13	8d5aa992d9	Tue Nov 8 08:51:48 2022 -0500	Fix simple_http_cache updateHeaders for vary (#23717)
4e4e184e5a	ce8129cdf6	Mon Nov 7 20:20:03 2022 +0000	Fix bug in stream_info mock (#23870)
65f000334a	5781cadbd3	Mon Nov 7 14:04:39 2022 +0000	dubbo: fix compilation error. (#23841)
77709fee8c	9ae348cc43	Sat Nov 5 12:58:25 2022 -0400	Fix undefined behavior (#23849)
1ff73200a2	e21db7dc31	Fri Nov 4 10:50:56 2022 -0400	fix doc link (#23829)
4b7e144fa9	51a76ca5b9	Fri Nov 4 10:46:37 2022 -0400	header-parser: fix config regex infinite loop (#23541)
9c1980af8b	b65a09354b	Thu Nov 3 14:22:09 2022 -0600	googleurl: further fixes (#23820)
74753956f6	35bf11a0f1	Thu Nov 3 13:36:04 2022 -0400	http: fixed Utility::PercentEncoding::encode() to treat all values as unsigned (#23781)
943f7201af	c5199512e9	Wed Nov 2 10:58:14 2022 -0700	Fix sip_proxy build (#23798)
9db77e66e2	b56aa06144	Wed Nov 2 11:04:07 2022 -0400	fixing OSS filter_fuzz_test OOM issue when thread_count is 800 million. (#23782)
d94c2a788d	e5120b4bd2	Wed Nov 2 09:08:38 2022 +0000	fix comments (#23788)
94b0d9e242	8516069023	Tue Nov 1 18:28:53 2022 -0700	bazel: fix URL version variable usage (#23780)
36fc1ccc1d	ef687b0250	Tue Nov 1 11:23:51 2022 +0000	tools, github: Pick authorization prefix based on provided token (#23766)
fd12444788	ceb45a32da	Mon Oct 31 09:00:20 2022 -0600	Fix premature termination of transaction client (#23710)
1f176807e4	f52f99e861	Mon Oct 31 09:41:38 2022 -0400	docs: Fixing ECDS documentation (#23636)
b3e59bda3e	ff63710555	Fri Oct 28 13:04:21 2022 -0700	bazel: fix more config_setting visibility (#23709)
2e3e6c5eb9	9a17c84810	Fri Oct 28 13:17:28 2022 -0400	Fix uninitialized value in the retry policy mock (#23463)
9a17c84810	6338eb0fcf	Fri Oct 28 09:49:00 2022 -0700	Fix oauth2 intergration test flake (#23734)
2e50e1f5da	a366d4c761	Fri Oct 28 13:02:21 2022 +0000	docs: fix typo in flow_control.md (#23733)
3c645fa924	cfc2c3eaf7	Thu Oct 27 13:49:34 2022 -0400	build: fix char signed vs unsigned warning (#23675)
82667905a9	03fc613b01	Wed Oct 26 23:28:35 2022 -0400	docs: fix a typo in ext_authz docs (#23697)
d57e496f61	b792ba5da5	Mon Oct 24 22:09:58 2022 +0800	minor: minor fix for typo error (#23634)
051c119bd0	7e9afc8bf7	Mon Oct 24 21:22:40 2022 +0800	ocsp: rotate certs of test data to fix flaky tests (#23635)
78a2145d83	2f6f60d611	Fri Oct 21 08:43:29 2022 -0600	router: fix `regex_rewrite` for redirects matched on prefix (#23587)
8fe659ceb0	39611d5ead	Thu Oct 20 14:00:07 2022 -0700	grpc_transcoder: fix a bug with http2 when request body is Http.Body (#23450)
369de3e09c	2ea8132255	Mon Oct 17 09:58:26 2022 +0100	minor fix comment (#23494)
2ea8132255	adf97d39fb	Mon Oct 17 09:57:13 2022 +0100	doc: fix FAQ doc for route match (#23513)
adf97d39fb	1d7ca78a31	Sat Oct 15 11:12:59 2022 +0100	Docs: Fix broken link in HTTP3 arch overview (#23509)
1d7ca78a31	347ba8bd99	Fri Oct 14 22:21:41 2022 +0100	changelog: Fix duplicate entries (#23502)
f8ab8769e3	0a195ac896	Fri Oct 14 10:17:17 2022 -0400	Adds a debug log to help diagnose an issue. (#23476)
0a195ac896	66cee7751f	Fri Oct 14 09:13:01 2022 -0400	http conn man: fix memory leak with watermark buffer (#23401)
5c3a222d0b	f0d5a20595	Fri Oct 14 01:07:27 2022 +0000	tracing: fixing a regression in router initiated spans (#23490)
be5b2f2d5e	aea29851ce	Thu Oct 13 14:37:58 2022 +0100	grpc_transcoder: fix a bug with wrong binding type (#23403)
67b3848fbd	9244c13f9b	Thu Oct 13 14:39:02 2022 +0900	Fix msan failure in the GrpcJsonTranscoderFilterTest.ResponseBodyExceedsBufferLimit (#23457)
e0b5903fd5	f3c6c6d250	Wed Oct 12 18:13:31 2022 +0800	fix typo in envoy/http/filter.h (#23423)
fbcf4266a5	e2aa62acad	Tue Oct 11 08:47:26 2022 -0400	config: Improve debug logs for resuming xds (#23399)
ff49762696	9e9589037e	Mon Oct 10 22:17:27 2022 -0400	fix sendLocalResponse in wasm (#23049)
7a142b8ceb	e5ec3dad31	Mon Oct 10 09:15:47 2022 +0100	docs: fix confusing statements (#23421)
5f92a0495d	3fee4d00ac	Thu Oct 6 09:06:12 2022 -0700	Forward fix ahead of protobuf upgrade (#23376)
3fee4d00ac	0a0fc44f86	Thu Oct 6 09:02:34 2022 -0700	test: fixing access log function (#23380)
61d1b7876e	538c0bb9bc	Mon Oct 3 21:03:08 2022 +0000	tls: fix error-reporting in doSynchronousVerifyCertChain (#23319)
4386b950d3	5e3c87af37	Thu Sep 29 10:01:51 2022 -0400	jwt_authn: fix a bug: a negative exp integer used as a large positive value (#23285)
5e3c87af37	965a658894	Thu Sep 29 09:57:31 2022 -0400	router: Fix the Null-dereference READ issue in header parser (#23282)
48a0623f98	5a14b1a5b4	Wed Sep 28 18:52:56 2022 +0100	bazel: fix typo in repositories.bzl (#23279)
e79db9c3b8	66bb3745a5	Wed Sep 28 09:06:36 2022 -0600	Thrift: fix header_to_metadata proto annotation (#23268)
4fe08ffc07	ad800292a6	Tue Sep 27 09:52:46 2022 -0400	ci: Fix dep checker permissions (#23247)
64a3ce5cc5	023a4d3ff7	Fri Sep 23 09:34:21 2022 -0600	grpc_stats: fix a typo (#23212)
daa265c19b	dcf385c90a	Fri Sep 23 11:37:27 2022 +0000	docs: fix listener filter order in best practice envoy config  (#23217)
b1f5e92d85	ac5792e1da	Fri Sep 23 11:13:47 2022 +0100	deps: fix mismatch release date in OpenCensus Proto (#23220)
d0a5c3bb1e	be8b0dddbe	Thu Sep 22 13:35:13 2022 +0900	grpc_json_transcoder: improve debug logs (#23150)
ca4a119e4a	502f16e979	Wed Sep 21 13:13:16 2022 -0400	redis: fix flake in QUIT test (#23184)
502f16e979	61a2f782fa	Wed Sep 21 13:06:33 2022 -0400	route: Use `prefix_rewrite_` directly (#23196)
cc415a04d1	de531af69a	Wed Sep 21 12:19:59 2022 +0000	docs only: fix spelling error (#23194)
1d6777e8d9	c3a9f0ac64	Tue Sep 20 16:50:18 2022 -0600	http: fixing a bug where internal redirects aren't served on drained connections (#23168)
fd93cb3b29	35334fe0ad	Tue Sep 20 09:24:26 2022 -0400	router: Fix invalid ASSERT for regex path matcher (#23169)
35334fe0ad	06625e63d1	Tue Sep 20 21:10:13 2022 +0900	grpc_json_transcoder: bug fix to allow async continuation of trailers (#23147)
1fabd6decb	ef42382cbc	Mon Sep 19 23:39:14 2022 +0000	http: fixing UPSTREAM_REMOTE_ADDRESS for happy eyeballs, proxied connections (#23139)
860c6078b4	94c4585079	Mon Sep 19 16:27:46 2022 -0400	test: fix a race in http2 flood integration test (#23094)
6db14743de	a8c6db9912	Mon Sep 19 15:43:52 2022 -0400	router: fix interaction between custom request headers, weighted clusters, and cluster_header (#23042)
36fdc75f90	62defb9856	Mon Sep 19 13:01:51 2022 -0400	route: Add path_matcher + prefix_rewrite validation (#23160)
4c0e53d8ce	2ce5e5f40c	Sun Sep 18 23:00:53 2022 -0400	docs: Fix link to AttributeContext.HttpRequest.body (#23151)
aa2ef9240a	878f6d6c84	Fri Sep 16 09:51:08 2022 -0400	fix typo (#23143)
0b10b055a6	390b5c13dd	Wed Sep 14 16:30:14 2022 -0400	proxy: fix alpn proxy with HTTP3 (#23079)
390b5c13dd	6398e1f135	Wed Sep 14 16:24:05 2022 -0400	http: fixing the EM build broken by a namespacing problem (#23108)
0061134ec5	7ce3f4ced4	Wed Sep 14 08:06:18 2022 -0700	Local Rate Limit: Fix tag extraction to work with filter stat_prefix (#23088)
7ce3f4ced4	a33ac3e383	Wed Sep 14 08:05:25 2022 -0700	stats: fix tag extraction for `worker_id` to avoid double counting (#23081)
a33ac3e383	0202852eb0	Wed Sep 14 08:26:48 2022 -0600	original_dst: fix leak of hosts in pools (#22371)
1e70a12cbd	5f6fe3ead9	Wed Sep 14 08:38:12 2022 -0400	test: fix a race in ResetLargeResponseUponReceivingHeaders (#22980)
85e804ba21	127d7f06de	Mon Sep 12 11:36:49 2022 -0700	bazel: fix -no_deduplicate for test targets
2052d2157c	a2a787cb87	Fri Sep 9 12:19:23 2022 -0400	fuzz: fix http health-check when connection is closed (#23041)
4ec9648538	b5b2915262	Thu Sep 8 09:45:50 2022 +0000	minor fix: include/envoy is moved to envoy/ (#23030)
c5f2ee30c4	f51f70f733	Wed Sep 7 09:13:18 2022 -0400	router: fix upstream trace spans not containing gRPC annotations (#22242)
4549e5149b	7e7e353719	Tue Sep 6 09:43:58 2022 -0600	redis: enhance redis cluster debug logs (#22992)
c1744d490c	2078368b4c	Tue Sep 6 10:01:34 2022 -0400	docs: fix incorrect punctuation (#22985)
e2423a32b6	8537d2a292	Tue Sep 6 06:35:42 2022 -0700	connect: fixing a bug with virtual hosts / happy eyeballs and testing ALPN (#22977)
1bd6739d7f	17ac023206	Thu Sep 1 10:53:33 2022 -0400	http: fixing auto_rewrite for upstream filters (#22923)
696180a5af	ef7b96fcd9	Tue Aug 30 09:03:45 2022 -0600	test: fix a race in tcp_tunneling_integration_test (#22883)
a88f60e6a4	7468195637	Tue Aug 23 12:08:22 2022 -0400	http: fix bad merge (#22815)
fc484f5a60	92c0a895af	Sat Aug 20 11:39:28 2022 +0100	ci: Fix python version (#22769)
459c56f386	dc42d9817b	Thu Aug 18 11:54:48 2022 +0100	Fix exclude bug in check_visibility (#22728)
39da536e44	bb58560426	Wed Aug 17 16:12:40 2022 -0400	fix typo (#22735)
9dee1f0524	39c47173d2	Mon Aug 15 09:27:39 2022 -0400	Fix URL parsing to handle schemes allowed by RFC 3986 (#22650)
9730d717d2	faa51b63ec	Thu Aug 11 15:19:37 2022 -0700	thrift: debug windows integration test (#22611)
9204609a89	eb352bb05d	Thu Aug 11 09:07:37 2022 -0700	wasm: fix wasm callouts with xff (#22604)
eb352bb05d	b437307136	Thu Aug 11 15:17:45 2022 +0000	[balsa] Fix header size limit error messages. (#22447)
b437307136	768d0bdc25	Thu Aug 11 09:13:14 2022 -0600	fix lua respond without headers (#22577)
9e7fba8f90	ff11af7a9a	Wed Aug 10 17:59:57 2022 +0000	Fix msan errors (#22641)
851458668a	01fb798af4	Wed Aug 10 09:30:29 2022 -0400	docs: fix typo (#22633)
0e1b182dd5	aab8ef5aaa	Tue Aug 9 09:59:29 2022 -0700	matcher: fix missing HTTP support in IP matcher (#22619)
dfdc8251e2	b5c396a419	Mon Aug 8 22:00:10 2022 +0000	docs: clarifying bugfix / announce policy (#22613)
b5c396a419	4350d44f78	Mon Aug 8 20:27:32 2022 +0000	Fixed heap monitor: discount pageheap free bytes (#22585)
4350d44f78	55ee9c70fd	Mon Aug 8 09:25:51 2022 -0700	fix typo (#22597)
c0ad7ce9ea	5db068d1fb	Mon Aug 8 09:22:19 2022 -0700	sandbox: fixing wasm example making port config explict to match envoy config (#22590)
856c167fbe	3e33879ac0	Thu Aug 4 12:52:17 2022 -0400	[balsa] Fix Http1ServerConnectionImplTest.Http11InvalidTrailerPost. (#22524)
9c8082c489	ea675ee1a0	Wed Aug 3 14:57:34 2022 +0100	deps: Fix dependency checker (return code) + date fixes (#22504)
fd3119bb9b	1942f8d5bd	Wed Aug 3 10:21:03 2022 +0100	examples: fix gzip decompression (#21818)
1c13b65fd7	5054314b36	Tue Aug 2 17:17:03 2022 +0000	build: fix `-Wnonnull` errors (#22511)
5054314b36	1919ff0245	Tue Aug 2 09:34:55 2022 -0700	tcp_stats: fix when kernel doesn't provide all stats (#22433)
1b5540f550	608ed3b65f	Tue Aug 2 09:27:39 2022 -0400	Fix brittle tests that depend on the contents of Protobuf JSON error messages (#22458)
a0ecaa316f	cd841f923b	Mon Aug 1 20:07:02 2022 +0000	doc: CONTRIBUTING.md: typo fix (#22480)
f2666f54b8	11469dc966	Thu Jul 28 16:10:26 2022 -0700	wasm: fix crash in gRPC/HTTP handlers calling proxy_done (#22415)
2bfe7db446	7f6736b892	Thu Jul 28 16:53:54 2022 -0400	Fix code for C++20 compliance (#22448)
1fcca0c2ab	f63bd9264b	Wed Jul 27 21:00:07 2022 -0700	docs: fix typo in matching API (#22437)
f63bd9264b	86eef10a93	Wed Jul 27 23:51:26 2022 -0400	check_format: Fix related test (#22426)
f659056a94	c9582ef8bd	Wed Jul 27 14:35:51 2022 +0000	test: fixing a flake (#22414)
14567bf0d1	25654b97cd	Wed Jul 27 00:29:59 2022 -0400	contrib-sip-proxy: Fix Issues of request_active_ counter and mismatched tra context (#22320)
a06001ce26	f20f8dccf5	Tue Jul 26 17:35:21 2022 +0000	utility: fix percent decoding of parameters (#22354)
f2fa461af8	41da908b80	Tue Jul 26 11:30:34 2022 -0400	listener: fix flaky listener integration test (#22383)
e1d9cd2220	753e4c5405	Tue Jul 26 10:58:44 2022 +0800	http inspector: fix incorrect protocol detection (#22102)
6c75133dac	36e1878e73	Sun Jul 24 14:21:36 2022 -0400	hcm: fix switch-case scopes in config (#22366)
e17f0a0a6e	f19812e15d	Fri Jul 22 17:53:46 2022 +0100	changelog: fix misplaced log (#22364)
f19812e15d	79205cdde2	Fri Jul 22 07:10:57 2022 -0700	test: fixing a flake (#22328)
622032419e	8a67cf1416	Fri Jul 22 12:11:23 2022 +0800	tracer: fix the coredump when instances of skywalking type tracer wer (#22244)
f015029b92	b75e0b51e0	Thu Jul 21 10:43:19 2022 -0700	bazel: fix android armeabi-v7a constraint
0f055dca35	52c07347fd	Wed Jul 20 14:28:56 2022 +0000	examples: Fix websocket test name (#22322)
bd450d0c8e	158a407a46	Wed Jul 20 09:30:20 2022 +0000	ci: fix typo in README.md (#22319)
7af7608b02	e56f9ae50a	Tue Jul 19 09:22:08 2022 -0600	sip proxy: fix coredump (#22098)
f61d984c5a	094659f739	Tue Jul 19 10:31:20 2022 +0000	docker: Fix/workaround docker buildx bug (#22262)
c2dab84423	2ee5600abd	Tue Jul 19 08:52:55 2022 +0000	docs: Fix the documentation of tcp_proxy.tunneling_config.hostname (#22264)
07cdc7a6b8	c6670adf22	Tue Jul 19 00:53:40 2022 -0400	check_format: Fix regexes (#22114)
dcf52ad8e8	bfe3ce5a8b	Fri Jul 15 10:59:35 2022 -0600	wasm: fix V8 build on older versions of Linux. (#22228)
a60d834857	f1d8b96fe1	Fri Jul 15 08:49:26 2022 -0600	docs: Fix wonky line selection/highlights (#22197)
be79479426	cf68c67d77	Fri Jul 15 14:30:39 2022 +0100	check_format: Fix file content iteration (#22129)
cf68c67d77	cc607f21ee	Fri Jul 15 08:59:47 2022 -0400	changelogs: Fix sorting (#22224)
c0e819181b	025a0a8617	Thu Jul 14 17:46:41 2022 +0000	examples: Improve waits/fix flakes (#22126)
4926713f8b	bddfcacace	Thu Jul 14 11:25:57 2022 -0400	docs: Minor fix for local docs build (#22172)
181bd2ad6b	1028df2a4a	Thu Jul 14 15:18:42 2022 +0100	docs: Fix example composition build instructions (#22132)
6785cf3a49	d9030e3d49	Thu Jul 14 13:58:57 2022 +0000	docs: Fix the sample description for the composite filter (#22202)
772c8141d2	09549da904	Wed Jul 13 15:42:10 2022 -0400	Fixing a cosmetic clangTidy issue (#22136)
07ecace31d	d4bf478745	Tue Jul 12 23:10:32 2022 -0400	api_proto_plugin: Remove debugging code (#21969)
d4bf478745	00151803a0	Tue Jul 12 16:51:03 2022 +0000	[balsa] Fix Http1ClientConnectionImplTest.HeadRequest. (#22105)
dad6de4df7	8848073091	Tue Jul 12 10:28:34 2022 -0400	[balsa] Fix Http1ClientConnectionImplTest.NoContentLengthResponse. (#22041)
ef9d6de712	8ef5da2cee	Mon Jul 11 16:25:46 2022 +0100	Fix typo in docs for wasm proxy configuration (#22030)
f2c832b965	d3fbd8907e	Mon Jul 11 09:37:07 2022 -0400	uds: fixing a regression with tls uds upstreams (#22057)
c58ccaf8e9	2a5e73c75c	Fri Jul 8 14:23:45 2022 -0400	Bug fix: fix connection handler test bug.  (#22076)
823dc2eb8f	89b1460a2c	Fri Jul 8 06:27:07 2022 +0100	examples: Cleanups/fixes for docker deps and builds (#21962)
c61bc0e6ad	4052fbda93	Thu Jul 7 22:01:03 2022 +0100	bazel/ci: Fix data and strategy for RBE (#21986)
66cd39d675	b0c93859f6	Thu Jul 7 10:02:03 2022 -0500	internal address: fix assertion in config_dump?include_eds (#21955)
bf6e74afc1	e19476d629	Thu Jul 7 13:22:46 2022 +0000	fix rate limit example docs (#22053)
e19476d629	c103845992	Thu Jul 7 06:56:55 2022 +0100	docs: Fix backticks in api protos (#22026)
c103845992	3af90c11e4	Wed Jul 6 18:51:03 2022 -0500	protoprint: Cleanups/fixes (#22004)
79b328ea87	3d5054705a	Fri Jul 1 14:23:38 2022 -0700	internal listener: fix assertion in passthrough state (#21954)
49837e0b29	259d76ef89	Thu Jun 30 23:31:07 2022 +0000	ci: Cache fixes/cleanups (#21971)
f40aba4c3e	a507723130	Wed Jun 29 16:25:15 2022 -0700	remove debug prints (#21927)
8f0b10a9c7	6e1db9a795	Wed Jun 29 19:44:58 2022 +0000	test: fixing waitforaccesslogs (#21809)
fbf0c93fb2	e8d44ce9e6	Tue Jun 28 16:18:05 2022 +0000	tooling: Cleanups/fixes for format errors (#21896)
97dfffde06	aa8da5554a	Mon Jun 27 23:41:15 2022 -0700	cleanup: Fix `protoprint` test data (#21901)
3e3721fd6c	f14eee844d	Mon Jun 27 16:21:44 2022 -0600	Fix race in file_system_buffer filter (destroy filter vs open file) (#21860)
326b205af6	5e5ea148a2	Fri Jun 24 09:42:11 2022 -0700	Fix flaky async_file_manager test (#21858)
28d4286a22	4809663c73	Fri Jun 24 01:22:45 2022 +0000	test: fix flake in overload_integration_test (#21861)
37cb3b15ab	28a1676f9b	Thu Jun 23 18:38:49 2022 +0000	Redis Proxy: Fix tag extraction to work with filter stat_prefix (#21785)
671be15259	f7a8db0599	Thu Jun 23 01:43:58 2022 +0000	Fix log_records entry in OTEL access logger test (#21842)
0eb30d355e	ad97eb76b3	Wed Jun 22 07:23:07 2022 -0700	contrib-sipproxy: fix sip reg affinity issue (#21793)
6a0265bc2b	dc13401811	Wed Jun 22 13:48:02 2022 +0000	format: Run format check before running fix (#21824)
154a7a865c	207d059cc2	Wed Jun 22 19:47:13 2022 +0800	fix dubbo outlier detection due to not considering LocalConnectionFailure (#21635)
a38c8f4a26	3cf06f89ed	Tue Jun 21 13:54:27 2022 -0700	[contrib-sipproxy] fix the issue of top-uri (#21729)
3cf06f89ed	c0eafc6ddf	Tue Jun 21 16:53:25 2022 -0400	Fix djb2 case insensitive hash function (#21787)
02d6af1ae8	f1236bf273	Tue Jun 21 07:03:29 2022 +0100	ci: Fix CLANG_FORMAT version (#21778)
bc63067af6	44634cc608	Mon Jun 20 12:03:11 2022 +0100	fix typo (#21766)
8259b33fea	2aa40dc042	Thu Jun 16 11:39:49 2022 -0400	proto: fixing a few more warnings (#21722)
7b937e8cd5	ac8e5b593b	Thu Jun 16 08:31:10 2022 -0400	route: add stats prefix for route (#21302)
ac8e5b593b	6f7e347203	Thu Jun 16 11:25:23 2022 +0100	bazel/README.md: fix a typo (#21709)
66bafbeb92	8f42dc604c	Wed Jun 15 20:43:28 2022 +0000	Thrift Proxy: Fix tag extraction to work with filter stat_prefix (#21687)
ce40137d73	1f90c7f2fd	Wed Jun 15 11:18:43 2022 -0400	logging: fix `--log-format-escaped` to only log one newline per log line (#21632)
57917286c6	ab58c543bc	Wed Jun 15 07:31:38 2022 +0100	examples: Improve debugging output (#21658)
cff92a6755	a734340d6d	Tue Jun 14 22:41:39 2022 -0400	protodoc: Fix aspect and speedup api/rst build (#21576)
3733c4fa76	c92c032662	Mon Jun 13 15:27:23 2022 -0400	fuzz test: Fix clearing buffers (#21680)
c92c032662	911a87020b	Mon Jun 13 19:14:07 2022 +0800	async: fix UB with uninitialized parent context (#21666)
911a87020b	d22c252d88	Mon Jun 13 02:46:48 2022 +0000	fix local_ratelimit example readme doc (#21654)
fcc1a15fad	71f7f2c54b	Thu Jun 9 13:22:17 2022 -0400	sip-proxy fix only first record-route add ep (#21599)
11114916a4	e0c52894b0	Thu Jun 9 14:57:33 2022 +0000	healthcheck: fix grpc inline removal crashes (#749)
adc26b9b2b	10533ddaee	Thu Jun 9 14:57:33 2022 +0000	internal redirect: fix a lifetime bug (#785)
ac02715d68	f8f8628f4e	Wed Jun 8 16:03:06 2022 -0400	http: fixing up CONNECT to be RFC compliant (#21440)
7cfa415f1e	0f9121e778	Tue Jun 7 02:02:37 2022 -0700	skywalking: fix to avoid tracing all requests (#21451)
2d97efcdfc	75aa3fbac7	Fri Jun 3 23:39:42 2022 +0000	Add a trace log in fixed heap monitor for debugging. (#21566)
37e687188a	90f477dc1a	Thu Jun 2 13:27:56 2022 -0700	test: fix h1 persistant capture fuzz test flakiness (#21552)
cfb7b64116	43a9644284	Tue May 31 11:23:04 2022 -0400	cryptomb: fix poll delay being set to zero if it is shorter than 1 ms in the config (#21392)
006bbc3614	ef71623921	Mon May 30 20:38:41 2022 -0600	tls: fix daysUntilFirstCertExpires() return nil when expired (#21428)
572d2d56e8	46660223ba	Mon May 30 07:44:47 2022 +0000	Fix a small typo (#21498)
dc071169d3	cf840b8c48	Wed May 25 08:56:30 2022 -0400	changelogs: Fix `RUNTIME_GUARDS` format (#21438)
d81a796c8a	b424d38322	Mon May 23 09:52:16 2022 -0700	wasm: fix potential crash of extensions for failed remote code fetch (#20843)
a9b756d50c	82743490bc	Mon May 23 08:38:21 2022 -0400	upstream: fixing logical/strict DNS clusters for IPv6 (#21359)
c4ecdd0758	2f99e0c9f8	Sat May 21 16:15:44 2022 -0400	listener: fix stat tag extraction to work with listener stat_prefix (#17686)
c0d77b3a4c	0d08d60310	Thu May 19 16:21:26 2022 -0400	Fuzzer: Fix OOM that can occur in codec_impl_fuzz_test. (#21376)
13829e8a1f	5f0dd056d3	Thu May 19 09:21:06 2022 -0600	alpn: disabling an envoy_bug while 21345 is investigated (#21356)
53b5bc8d14	f84dc815ef	Wed May 18 10:49:27 2022 +0100	Fix sphinx link syntax in connection pool documentation. (#21343)
168c3aea0f	f57ca7b665	Mon May 16 20:37:00 2022 +0000	Fixing comipling issue related to any.proto type_url. (#21322)
f57ca7b665	7d4670ca32	Mon May 16 14:29:06 2022 -0600	Fix stack-use-after-scope in OSS-fuzzer test (#21299)
f1a3fd1c54	e64f94e2ce	Mon May 16 10:40:35 2022 -0700	matching: fix unmatched response trailers input (#21301)
e64f94e2ce	48da7463b3	Mon May 16 17:34:35 2022 +0000	docs: fix admission control sample usage (#21250)
6df56d0778	6cc4d1aa7b	Mon May 16 04:34:53 2022 +0000	Add remote address into debug log for TLS error (#21280)
e970521b86	9476543914	Sun May 15 21:16:44 2022 -0600	accesslog: fix docs in retry policy (#21281)
003947cd2f	afabff514a	Fri May 13 17:13:01 2022 +0000	matcher: fix bad type URL for response trailers (#21230)
a683723630	da36b02146	Thu May 12 18:23:35 2022 +0000	runtime: fix borked runtime guard, removing runtime singleton (#21254)
741b8c08d3	b88641b356	Thu May 12 11:03:19 2022 -0600	docs: Add a link to the Fix Lead Checklist from SECURITY.md (#21268)
7fefd09341	c8bc07f70d	Wed May 11 20:23:54 2022 -0700	tls: fix daysUntilFirstCertExpires (#20581)
be64077ebd	a8ce235714	Wed May 11 10:26:08 2022 -0600	ext_proc: Fix flaky test by improving integration framework (#20705)
b44271ceb9	88e3ae3cf8	Mon May 9 21:44:18 2022 +0000	Fix MemorySanitizer reports in tests (#21176)
bdfc63ca29	b72c11b0b8	Mon May 9 18:01:15 2022 +0000	connect: adding tests and code fixes for cluster-wide CONNECT termina (#21168)
b72c11b0b8	e88bd553bd	Mon May 9 09:28:11 2022 -0700	admin: fix problem with large /stats requests via adminRequest API (#21191)
0d3bf4198e	21a0fd6a06	Fri May 6 23:00:44 2022 +0000	fix admin docs (#21186)
3de59b3390	26bd3ed71e	Fri May 6 13:56:52 2022 -0700	codeowners: fix up ownership and drop non-existing modules (#21157)
e6dc83bd66	0782a9e073	Thu May 5 11:25:46 2022 -0700	remote address action support prefix len (#20856)
0782a9e073	bd69ad46f3	Thu May 5 12:42:42 2022 -0400	config: fixing example config (#21164)
9347baffa1	1938af1d5c	Thu May 5 11:58:53 2022 +0000	add stat_prefix for local_ratelimit route specific config example (#21036)
730df5c6cc	31b13d613e	Wed May 4 22:36:36 2022 +0000	upstream: Fix a bug in trace output from the ring hash lb (#21153)
5afc6faf0b	a41b254a4e	Tue May 3 09:02:55 2022 -0400	process wide: fix concurrent callers (#21120)
a477786206	2f7f14bb40	Mon May 2 11:46:08 2022 -0700	Fix clang-tidy (#21111)
5f7098749f	6abcebc93f	Mon May 2 11:30:24 2022 -0600	docs: fix a typo in bazel/PPROF.md (#21109)
88ec0fd555	6549e791fa	Fri Apr 29 09:58:58 2022 -0400	thrift proxy: fix function spelling in the tests of thrift proxy (#21082)
c02d6b624b	3dc4ebf32e	Thu Apr 28 23:57:39 2022 +0000	fix flaky test (#21078)
25c3da2262	48cc862e6c	Thu Apr 28 13:35:58 2022 -0400	deps: Update yaml_cpp deps to fix CRNL and emit issue. (#20886)
a8ecd834f9	1b64e70e02	Thu Apr 28 09:08:37 2022 -0400	Fix clang-tidy and pre for upgrade of absl and protobuf (#21045)
