630acea36b	d9e1493148	Sun Dec 8 09:00:03 2019 -0800	rbac: fix rbac principal match condition (#9268)
8cf1e4d59a	4e2f2022af	Wed Dec 4 09:32:00 2019 -0800	build: fix envoy_build_sha.sh error message (#9214)
6c2beaa25c	14acb3e819	Tue Dec 3 09:27:21 2019 -0500	bug fix (#9195)
14acb3e819	3d09ef5cbc	Tue Dec 3 09:23:07 2019 -0500	lb: fix docstring typo (#9197)
18911483b5	85bba59c1a	Mon Dec 2 09:11:39 2019 -0500	cleanup: fixed typo mistake (#9176)
faae6e3ca5	e06171283c	Fri Nov 29 13:12:26 2019 -0800	cluster manager: add more debug logging (#9157)
1f833534ac	fb628ce254	Wed Nov 27 13:10:19 2019 -0800	ci: fix clang-tidy (#9140)
fb628ce254	dd9f2d4503	Wed Nov 27 09:59:57 2019 -0800	router: fix VHDS subscription creation bug (#8650)
7cbe9fd764	504b8b1665	Tue Nov 26 16:56:21 2019 -0800	udp proxy: fix test flake (#9152)
67a760b5d8	bfc458414b	Mon Nov 25 16:40:51 2019 -0800	internal redirect: fix a potential crash that can be triggered when internal redirect is enabled (#9130)
bfc458414b	647c1eeba8	Mon Nov 25 13:47:22 2019 -0800	test: fix flakey listener_impl_test (#9132)
bb76ead628	883a074f67	Sun Nov 24 12:16:06 2019 -0800	test flake: fix proxy protocol test (#9103)
4cd080d11b	76f172f7a9	Sun Nov 24 12:10:20 2019 -0800	fix unstable test case UdpListenerImplTest.SendData (#9119)
cddf4acdd5	40970bd6ed	Fri Nov 22 09:45:43 2019 -0800	test flake: fix header casing integration test (#9104)
40970bd6ed	fb82359717	Fri Nov 22 09:00:00 2019 -0800	thrift-proxy: fix crash (#9089)
fb82359717	37885bb570	Thu Nov 21 23:45:14 2019 -0800	build: several fix for C++17 compatibility (#9102)
b8e7d8dbfa	27856582db	Wed Nov 20 08:00:00 2019 -0800	ext_authz: Fix spelling mistake in type definition (#9066)
27856582db	61201908c1	Wed Nov 20 07:58:55 2019 -0800	docs/best_practices/edge: fix `use_proxy_proto` location (#9082)
bde534bf4b	d5f3efdaac	Thu Nov 14 20:47:36 2019 -0800	wasm: fix V8 running under ASan without setup_clang. (#9036)
c85f65a114	f7cb0ea15c	Thu Nov 14 17:53:17 2019 -0800	check_and_fix_format.sh: spell fix: faild > failed (#9017)
3b27ef5b06	80aedc1c4a	Thu Nov 14 17:15:36 2019 -0500	format: allow envoy bazel prefix to be overriden in BUILD fixer (#9028)
9fa42e53cf	fe0dd79a8e	Thu Nov 14 09:57:06 2019 +0700	ext_authz: Fix missing body in CheckRequest for HTTP/2 (#8877)
bde6273b9b	a7e4f51efd	Wed Nov 13 11:12:48 2019 -0800	Fix udp_listener_impl_test that fails to build with gcc (#9005)
a7e4f51efd	3cedd7aed4	Wed Nov 13 13:36:42 2019 -0500	Fixed BUILDIFIER_PATH and BUILDOZER_PATH env var expansion in check_format.py and envoy_build_fixer.py scripts (#8798)
8dfd76acb7	a37522cf3f	Tue Nov 12 12:30:13 2019 -0800	fix flaky tests in redis integration test (#8943)
44131635c2	bc427e27a3	Tue Nov 12 14:35:12 2019 -0500	tools: fixing bugs in deprecate_version.py (#8846)
74e1927331	bef44ab406	Mon Nov 11 22:57:22 2019 -0500	build: fix bazelrc (#8980)
bef44ab406	46d420dcc7	Mon Nov 11 22:45:09 2019 -0500	fix gRPC crash due to uncaught exception (#8958)
2d859aab9b	0e64a6c166	Mon Nov 11 08:32:44 2019 -0800	Fix TSAN warning from unlocked cross-thread read. (#8957)
4bcf677c9c	2c830f1aac	Sun Nov 10 21:03:16 2019 -0500	ci: fix master clang-tidy run (#8965)
a745d543ab	6e5cf6fb3e	Fri Nov 8 11:18:27 2019 -0800	Fix #8672 placed in the wrong version_history section (#8942)
466c00b47c	b99339e161	Thu Nov 7 15:01:10 2019 -0800	docs: fix badly formatted links in .proto files (#8938)
619eb5735f	424ed90bad	Wed Nov 6 09:46:54 2019 -0800	Fix compilation in http_integration.cc (#8896)
b0a7a65d47	8b27ef7d7d	Wed Nov 6 11:01:48 2019 -0500	fuzz: fix false positive in new_buffer_fuzz_test. (#8903)
be5e7a565b	c1d71051eb	Tue Nov 5 21:06:35 2019 -0800	wasm: fix V8 running under UBSan with vptr checks. (#8905)
9dd7af988d	c9784d48db	Mon Nov 4 09:34:19 2019 -0800	tls: fix cert expiry wraparound (#8583)
6ba4832ead	174ba21bb8	Fri Nov 1 15:29:21 2019 -0700	bazelci: fix (#8832)
7d9d95f891	6a5e23c5ea	Thu Oct 31 16:30:59 2019 -0700	[router] Fix byte size logging in HTTP gRPC upstream logs (#8836)
c5afab290a	badfb6e254	Thu Oct 31 12:52:00 2019 -0700	docs: fix broken links in fault-injection, lua, and mysql examples (#8812)
75b78d8134	c44ac4b0a7	Wed Oct 30 21:32:45 2019 -0700	ci: try fix format in CI (#8814)
f4453a7caa	f19276fe8e	Wed Oct 30 15:49:49 2019 -0700	fix format on master (#8815)
308a891c72	0ccfc3a8a5	Wed Oct 30 12:34:22 2019 -0700	docs: fix the broken link to the Redis proxy filter (#8810)
524549f2c5	bf37452667	Tue Oct 29 11:30:54 2019 -0700	docs: fix rate limit filter name (#8796)
bf37452667	035b49cfa0	Tue Oct 29 12:57:09 2019 -0400	zlib: consume dev branch with timeouts/crashes fixes (#8788)
53d030ba6c	80657f8806	Mon Oct 28 17:56:21 2019 -0400	reverse_bridge: fix null dereference when upstream content type is missing (#8789)
92c085afae	a55621cb23	Fri Oct 25 11:51:34 2019 -0700	metrics service: fix spelling (#8757)
63455de2ee	a62ebafd9e	Fri Oct 25 15:09:40 2019 +0800	thrift: add option to strip service prefix from method name (#8741)
97193c292b	b420217acf	Thu Oct 24 10:14:11 2019 -0700	misc: fix azp badge (#8753)
8d4d03c8a2	7846427d7a	Thu Oct 24 10:51:22 2019 +0800	build: fix spell checker on macOS (#8744)
19f787110f	8438e37b05	Wed Oct 23 22:17:48 2019 +0800	http: fix ssl_redirect on external (#8664)
ec648d8c0d	0702204e07	Tue Oct 22 21:56:19 2019 -0700	fix draining listener removal logs (#8733)
0702204e07	e7c7ca4c09	Tue Oct 22 21:55:45 2019 -0700	dubbo: fix router doc (#8734)
9b62fca0b8	9ad274d465	Tue Oct 22 20:17:51 2019 -0700	thrift: fix filter names in docs (#8726)
68ca6746d1	dc9857db10	Tue Oct 22 12:01:50 2019 +0800	Fix PGV location references and TODOs. (#8708)
53a33526bb	de70fe54cd	Tue Oct 22 09:52:49 2019 +0800	ci: fix bazel.asan target. (#8706)
b331807fcf	e6a52ce9fd	Mon Oct 21 12:44:47 2019 -0700	upstream: fix bounds in refresh rate (#8694)
e6a52ce9fd	2b99b59789	Mon Oct 21 12:43:01 2019 -0700	fuzz: fix move max alloc handling in buffer_fuzz_test. (#8693)
42521f015e	7e4a01a00b	Fri Oct 18 19:37:00 2019 -0700	docs: fixed wrong reference in the (#8665)
906c759538	44a4f1c68c	Fri Oct 18 19:32:27 2019 -0700	build: run tools/proto_format.sh on master to fix build (#8671)
848121582d	87d496d3e6	Fri Oct 18 07:34:27 2019 -0400	fuzz: fix adding headers in fuzz tests (#8653)
87d496d3e6	2fe5b8a402	Fri Oct 18 12:14:10 2019 +0800	fix flake in http_subset_integration_test (#8655)
700a281a55	587e07974e	Fri Oct 11 17:04:05 2019 -0400	Fully qualify calls to the statPrefixJoin() function. Otherwise build fails when the stats macros are used outside of the Envoy namespace. (#8569)
293e98086e	d3b7ffd918	Thu Oct 10 14:36:01 2019 -0400	stats: fix leak-into-pool for getDynamic("") (#8566)
3874800f5a	2cd917e12e	Tue Oct 8 21:25:57 2019 -0600	docs: fix links to internal sections (#8539)
2cd917e12e	7e77c5ede0	Tue Oct 8 13:26:00 2019 -0700	fix compile_time_options by setting idle_timeout in common_http_protocol_options (#8536)
7e77c5ede0	99fcced784	Tue Oct 8 13:05:14 2019 -0600	fix three clang-tidy master errors (#8532)
48c7c20389	8bc33f2a5a	Tue Oct 8 13:04:46 2019 -0400	Fix version_history.rst format issue.
8bc33f2a5a	0d5c2750ab	Tue Oct 8 12:37:30 2019 -0400	Fix format for CVE fixes on master.
0d5c2750ab	5374571d2d	Tue Oct 8 12:34:13 2019 -0400	Fix clang-tidy error in "many cookie" tests".
d6950726bd	632a677484	Mon Oct 7 19:43:49 2019 -0700	csrf filter: fix casing of additional origins method (#8511)
fcb3cf19e6	8fa1319f96	Thu Oct 3 20:47:02 2019 -0700	Fix hot restart bug due to passed an fd without bind (#8426)
8fa1319f96	f046e3725c	Thu Oct 3 23:43:31 2019 -0400	docs: misc fixes (#8483)
37f6d7548d	d7ae85b746	Thu Oct 3 14:40:28 2019 -0400	stats: Ensure sanity of stats prefixes (#8445)
34d49ff10a	3801c6846a	Thu Oct 3 11:01:10 2019 -0700	initialize dispatch_buffered_data_ to fix msan error (#8474)
7e1ad9ccd4	525755354c	Thu Oct 3 07:19:39 2019 -0700	test: fix and add mock ProtoBufferEq matchers (#8459)
5d5dda9fbf	e279cc8748	Wed Oct 2 15:39:43 2019 -0700	fix msan (#8456)
b0ab9fb8bb	3068ba961c	Thu Sep 26 15:56:25 2019 -0700	http: fixing a resumption bug in pipelining (#8352)
eadd63f7be	60707bdc37	Thu Sep 26 15:31:16 2019 -0700	fuzz: fix oss-fuzz build (#8401)
f0a75a9a76	c0e2c815cb	Thu Sep 26 09:03:49 2019 -0400	fix enum style violations (#8390)
c0e2c815cb	7f8d9447b9	Wed Sep 25 22:46:06 2019 -0700	debug: add envoy version stamp to backtrace (#8358)
7f8d9447b9	0b365df3d0	Wed Sep 25 22:43:24 2019 -0700	Fix jwks_fetcher crash with missing cluster (#8370)
324059ad35	1fc6a7e16a	Wed Sep 25 21:48:40 2019 -0700	ci: fix tcpdump not found (#8379)
ccb303f6f1	7eb6a5b7e7	Tue Sep 24 12:52:05 2019 -0700	Fix grpc transcoding content type not matching response body (#8312)
e07dc53782	7d8e9de637	Tue Sep 24 10:42:46 2019 -0400	api: fixing format build (#8345)
74ced53020	bbae4a7366	Mon Sep 23 14:09:59 2019 -0700	ci: add protoxform as a check/fix_format step. (#8331)
35b459f064	3c4e5bfde3	Thu Sep 19 11:15:17 2019 -0700	doc: fix formatting of regexes, disconnected comment (#8285)
3c4e5bfde3	b7233cb3ea	Thu Sep 19 11:12:21 2019 -0700	add debug log (#8294)
b7233cb3ea	219e8b9180	Thu Sep 19 11:10:47 2019 -0700	docs: fix email cc typo (#8296)
069f50c78b	c62625bdfe	Wed Sep 18 02:17:38 2019 -0700	tests: fix negative private key sync test. (#8264)
a381bc4c82	81460d8482	Tue Sep 17 15:34:29 2019 -0400	upstream: fix the header file path typo (#8266)
0ee3cc3749	c9703f96ff	Wed Sep 11 10:12:05 2019 -0700	fix link to runtime docs (#8204)
eb11fdede8	a758e8cdc5	Wed Sep 11 09:53:09 2019 -0700	tracing: fix random sample fraction percent (#8205)
99e3c658ed	6f273c2163	Sun Sep 8 10:35:29 2019 -0400	fix build (#8177)
cc03f7972a	838eb20c67	Fri Sep 6 15:28:39 2019 -0700	fix windows implementation of PlatformImpl (#8169)
22e4827109	d21d92ca21	Thu Sep 5 16:27:14 2019 -0700	thrift_proxy: fix crash on invalid transport/protocol (#8143)
0ef3137269	085d72b490	Tue Sep 3 13:50:52 2019 -0700	dubbo: Fix heartbeat packet parsing error (#8103)
1339ed2d49	911f3b0a08	Mon Sep 2 22:27:50 2019 -0400	upstream: fix invalid access of ClusterMap iterator during warming cluster modification (#8106)
0b0aa3f81e	6c6e18e588	Fri Aug 30 09:00:00 2019 -0700	Route Checker tool Fix code coverage bug in proto based schema (#8101)
9ac491af4a	0fde42edab	Thu Aug 29 09:12:05 2019 -0400	test: fix ups for various deprecated fields (#8068)
0fde42edab	7f060b63fe	Wed Aug 28 19:13:17 2019 -0700	Fixes gcc 8.3.1 build failure due to FilterChainBenchmarkFixture::SetUp hiding base-class virtual functions (#8071)
f80188ebc4	f8e42ae345	Wed Aug 28 08:40:38 2019 -0700	api: Fix duplicate java_outer_classname declarations (#8059)
d99e7f6a8d	6dd0ee161a	Tue Aug 27 16:41:20 2019 -0700	bazel: patch gRPC to fix Envoy builds with glibc v2.30 (#7971)
fdd0e01630	5c2b34bdef	Mon Aug 26 14:12:01 2019 -0400	test: adding debug hints for integration test config failures (#8038)
5c2b34bdef	fc32b645a6	Mon Aug 26 11:03:45 2019 -0700	admin: fix /server_info hot restart version (#8022)
fd19af83fb	640b5a436d	Fri Aug 23 15:41:03 2019 -0400	build: some missing dep fixups for Google import. (#8026)
faad477782	7f970608bb	Thu Aug 22 21:07:42 2019 -0700	redis: fix onHostHealthUpdate got called before the cluster is resolved. (#8018)
225ad90b55	69f805c2fc	Thu Aug 22 20:06:11 2019 -0700	Fix version history (#8021)
9421bddb21	c6b190ba83	Tue Aug 20 11:14:38 2019 -0700	Fix the alignement in optval of setsockopt when compiled with libc++. (#7958)
5aede462bb	d2e2cd6fa3	Tue Aug 20 13:13:50 2019 -0400	fuzz: codec impl timeout fix + speed ups (#7963)
869981ff23	6858df7eef	Mon Aug 19 14:11:46 2019 -0700	test: fix data races in FakeStream. (#7929)
817b2e3668	1c27f545c1	Fri Aug 16 15:13:24 2019 -0700	cleanup: fix words in assertion message. (#7950)
5a7bab734f	b9fe0b9337	Thu Aug 15 17:05:02 2019 -0700	redis: fix merge race (#7943)
15d54866d6	882a306776	Thu Aug 15 12:23:28 2019 -0700	fix misspelled words in client.py help message (#7933)
e1d713efc1	4d2ca4d31e	Wed Aug 14 10:34:37 2019 -0600	cleanup: conn_manager.cc err message word fix (#7901)
1cf877d7d5	93f87c3d16	Mon Aug 12 12:57:36 2019 -0600	build: miscellaneous hygiene fixes (#7888)
feb56a1f8e	7a21becb10	Wed Aug 7 09:54:24 2019 -0700	ip tagging: fix old TODO (#7834)
7e21623831	6ddfb94655	Tue Aug 6 21:34:37 2019 -0700	fix portFromUrl when double protocol is provided (#7838)
41c4244d11	7e5e0b510b	Tue Aug 6 19:30:42 2019 -0400	fix respect_dns_ttl bug (#7815)
c906df39d1	01bf1c373a	Mon Aug 5 09:27:08 2019 -0700	docs: fix incorrect comment (#7827)
f3121b0d02	2ca5b268b3	Sat Aug 3 08:01:53 2019 -0700	docs: fix minor style issue in tracing.rst (#7821)
662eccc240	0957e9cb96	Sat Aug 3 07:57:15 2019 -0700	Fix comment (#7816)
fc8d6f5fe4	b1fcf27fbe	Thu Aug 1 20:15:13 2019 -0700	fuzz: remove header prefix from Bootstrap (#7803)
95a2b2681a	cd8574de78	Thu Aug 1 20:13:18 2019 -0700	docs: fix custom header example (#7806)
cd8574de78	dd501103fd	Thu Aug 1 18:25:53 2019 -0700	ci: partially revert #7786 to fix post submit (#7807)
80df09408b	68d14ec241	Thu Aug 1 17:45:53 2019 -0400	docs: RBE, Docker sandbox and bazel fixes (#7657)
9123183afe	b02c73f3eb	Thu Aug 1 07:19:49 2019 -0700	fix server state stat (#7798)
c586af9d3f	3eedc793f1	Wed Jul 31 17:57:32 2019 -0400	docs: fix missing ref in xDS docs and runTime case (#7784)
bdd6788f1e	e1a33da233	Wed Jul 31 09:52:48 2019 +0700	Fix missing annotation in http_uri.proto (#7769)
c4994020c2	e2ca70a77f	Tue Jul 30 13:01:43 2019 -0700	fix clang-tidy errors in null stats (#7760)
e0552cc11f	3eaf53fe0d	Mon Jul 29 16:41:32 2019 -0400	test: fix RuntimeFromNonWorkerThreads (#7746)
3eaf53fe0d	33f3757210	Mon Jul 29 16:27:10 2019 -0400	http: fixing a bug in commonContinue (#7720)
ca4185536d	cd474639b5	Fri Jul 26 08:58:54 2019 -0700	tests: fix an assert in codec_impl_fuzz_test. (#7734)
e97e42f046	a48143e131	Tue Jul 23 15:01:35 2019 -0700	ci: fix 'six' Python library download URL (#7682)
defd9333f1	0979ccb9fa	Tue Jul 23 11:04:37 2019 -0700	Fix msan use-of-unitialized-value (#7697)
0c2b54851d	96f7c64d9b	Mon Jul 22 20:14:48 2019 -0700	bazelci: fix again (#7685)
96f7c64d9b	79bc784da9	Mon Jul 22 20:14:21 2019 -0700	fix static initialization fiasco (#7684)
09139a01a9	7e74865882	Sun Jul 21 14:23:06 2019 -0700	clang-tidy: fix existing errors on master branch (#7664)
875960fecb	c2967a82c9	Fri Jul 19 11:15:55 2019 -0700	bazelci: fix failures in ubuntu 18.04 (#7648)
ad9926fb29	ef11902b3d	Wed Jul 17 14:51:18 2019 -0400	load balancer: fix?: panic mode is disabled only when healthy_panic_threshold is 0% (#7478)
5e95cc3e54	a8e1364685	Wed Jul 17 08:11:57 2019 -0700	clang-tidy: bugprone-unused-raii (#7605)
1179d6e1aa	ea3ebca3b6	Wed Jul 17 01:14:57 2019 -0700	fix coverage publish script (#7608)
79c165f2d9	cd620ad122	Tue Jul 16 08:48:09 2019 -0700	dispatcher: fix comment. (#7597)
49635f47a4	101f8157fe	Mon Jul 15 17:12:42 2019 -0700	dubbo: clang-tidy fix (#7587)
9e3871ade7	32bfd01da2	Sun Jul 14 20:39:03 2019 -0700	forward proxy: fix test flake (#7575)
fcec70fc3a	74e348720a	Fri Jul 12 08:34:02 2019 -0400	Allow /dev/fd/<fd> paths for config files. Fixes #7258 (#7279)
feaada367d	00a6251eae	Thu Jul 11 13:23:38 2019 -0700	Fix crash in request hedging handling. (#7530)
3094b9e1ef	ea41ce1fa0	Thu Jul 11 11:53:53 2019 -0400	Bump c-ARES version to include important fixes. (#7539)
08dc244288	165290e19d	Wed Jul 10 17:19:15 2019 -0400	fuzz: fix filesystem bug, use std::__fs::filesystem (#7507)
8017bf28b7	0d26d05fe3	Wed Jul 10 13:06:24 2019 -0400	http: allowing altering the x-envoy header prefix (#7458)
0d26d05fe3	79b071cc1b	Wed Jul 10 08:37:52 2019 -0700	Add socket option names for debugging. (#7457)
655c984864	ba0b5a760a	Tue Jul 9 16:52:15 2019 -0400	docs: fix priority level algorithm in load balancing (#7489)
3d6d6fa675	34dbd5c544	Mon Jul 8 20:49:47 2019 -0700	lds: fix listener removal crash before server start (#7461)
34dbd5c544	8580957458	Mon Jul 8 20:48:42 2019 -0700	Fix redis_cluster_test for multiple DNS resolution scenario. (#7495)
19b1a6fde0	3c2d0eaaa3	Mon Jul 8 13:29:12 2019 -0700	Fix deprecation warning (#7490)
3b1983fe51	a12b9194d0	Mon Jul 8 16:04:46 2019 -0400	http: fixing a bug with HTTP1.0 HTTP1.1 pipelining (#7464)
f683743ca6	91b4c9c013	Mon Jul 8 09:44:36 2019 -0700	Fix clang-tidy (#7475)
d2bed97c60	7394ff1f77	Fri Jul 5 16:03:55 2019 -0700	Fix segfault in grpc upstream log reporting. (#7473)
d5b3981d3b	fa2b8194c4	Wed Jul 3 10:50:13 2019 -0700	docs: Add path prefix to grpc json transcoder example (#7450)
eac402e10c	b3abbb0f00	Wed Jul 3 09:44:58 2019 -0700	Small fixes on utility.cc (#7455)
fd7b4e8828	a255cf0b1c	Tue Jul 2 13:13:55 2019 -0700	fix check_format.py to report insufficient owners (#7438)
b0bb785ff7	ac21376c65	Tue Jul 2 08:09:49 2019 -0700	Fix a crashing bug in redis cluster when the dns resolution is empty. (#7392)
f36973d057	ae02dc6bdd	Mon Jul 1 08:26:21 2019 -0700	check_format: allow paths to be excluded from build_fixer (#7412)
e868a35dc8	815c506c96	Tue Jun 25 16:18:13 2019 -0400	docs: fix typo in http_connection_management.rst introduced in PR #7230 (#7394)
62cf5d8abf	ad57ed8511	Mon Jun 24 16:04:56 2019 -0400	fuzz: fix filesystem crash (#7360)
b1a1f6b6e2	47925a53e6	Sat Jun 22 10:31:56 2019 -0700	admin: fix compilation error (#7366)
47925a53e6	ccf66c692c	Sat Jun 22 10:30:06 2019 -0700	api: fix ruby package naming conflicts (#7369)
0ce2190b0b	3c42cf460a	Thu Jun 20 22:35:54 2019 -0700	fix clang reference string in check_format.py (#7350)
e085962324	49b5a91532	Thu Jun 20 11:41:31 2019 -0700	fuzz: fix oss-fuzz build failure  (#7339)
139cca5f6f	07da3346be	Tue Jun 18 20:19:00 2019 -0700	clang-tidy fixes (#7318)
b53cb3734d	6a6e43a942	Tue Jun 18 08:42:06 2019 -0400	Fix macOS CI with Bazel 0.27 (#7305)
c1b98bbb93	54e22406c3	Mon Jun 17 12:15:45 2019 -0400	docs: fix requirements for csrf sandbox (#7296)
54e22406c3	2f569b9a8d	Fri Jun 14 15:12:21 2019 -0700	stats: further hot restart gauge merging fixes (#7282)
2f569b9a8d	f1597d08e2	Fri Jun 14 13:38:40 2019 -0700	docs: further arch overview fixes from feedback (#7286)
6ac9a4e3c0	baa9d2d3d2	Fri Jun 14 11:18:36 2019 -0400	subsets fix comment (#7277)
9c80afd6d4	ea63c3a911	Thu Jun 13 20:31:58 2019 -0700	format: fix the ability to find buildifier in non-standard path. (#7270)
715a448156	294d0d7366	Thu Jun 13 14:19:00 2019 -0700	fuzz: fix abrt from missing mock action (#7259)
ff960238f9	4461f43111	Tue Jun 11 23:46:47 2019 -0400	fuzz: fix invalid headers in utility fuzz test (#7235)
76b944b2b8	3e0ee3c152	Tue Jun 11 13:30:51 2019 -0400	test: fix build failures by ignoring corpus generation on ppc build and clean headers (#7222)
ed3274f9a5	9d2e0b1d04	Tue Jun 11 07:51:12 2019 -0700	http: fix 2 cases where HCM/codec stream state diverge (#7212)
077a6a9f71	0497ce9f20	Mon Jun 10 14:10:34 2019 -0400	test: fixing a simtime bug with enabled (#7197)
ea7243e5a5	e756799378	Sat Jun 8 12:46:28 2019 -0700	build: curl upgrade and centos build fix (#7209)
e756799378	324d5b6fe7	Sat Jun 8 12:46:03 2019 -0700	tools: add .java to list of linted suffixes (#7210)
e76b48d371	1e34a2e29c	Fri Jun 7 13:03:06 2019 -0700	Trivial and inconsequential fix of rvalue parameter (#7207)
1e1e6d44e0	449d315f27	Fri Jun 7 14:57:05 2019 -0400	fuzz: fix invalid headers introduced by formatters (#7163)
9d47062517	99286cf434	Thu Jun 6 20:40:46 2019 -0700	fix regression in router that can cause a crash on response timeout (#7192)
49b2e21ab4	0f7983c859	Wed Jun 5 16:16:32 2019 -0400	docs: fix protodoc depset calculation (#7167)
c61661a814	094496fdfd	Wed Jun 5 10:32:51 2019 -0700	docs: adding test debug instructions (#7175)
9bdf99060f	1fdaf8e74f	Tue Jun 4 10:07:30 2019 -0700	fuzz: fix unitialized ptr to downstreamSslConnectionInfo in TestStreamInfo and add mock (#7155)
699e5102af	bf1d29d501	Tue Jun 4 08:24:21 2019 -0700	[docs] minor fixes to clang-format docs (#7150)
bf1d29d501	82ccd55729	Mon Jun 3 19:01:01 2019 -0400	config: fix EDS for empty update (#7143)
cd9e7ae2fb	fbe1d8a2e7	Mon Jun 3 16:38:56 2019 -0600	Fix server lifecycle notifier when callback list is empty (#7103)
79bdfaf0e4	de96526a67	Mon Jun 3 15:59:31 2019 -0400	Fix typo in test_common/utility.h (#7142)
be6a483e2b	4b2b946b93	Fri May 31 17:35:42 2019 -0400	timer: fix oss-fuzz issue #11852 (#6982)
4b2b946b93	08fe25e8a2	Fri May 31 17:33:58 2019 -0400	cleanup: fix typo and remove extra dup words. (#7125)
08fe25e8a2	0739cd6c9e	Fri May 31 17:29:52 2019 -0400	bazel: cc_wrapper.py fixes due to bazel flag defaults changing (#7098)
c22655c4b6	0e12efc140	Fri May 31 09:55:01 2019 -0400	router_check_tool: fix ASSERT in path_rewrite test (#7106)
1065ee418e	491c3cc1b4	Thu May 30 08:52:04 2019 -0400	http2: fixing a (known) potential stall in the filter chain for H2 (#7093)
cbcb07295b	3b1ac126e9	Wed May 29 20:27:13 2019 -0600	Fix bug where removes don't update CDS/LDS local version. (#7102)
26cfd5297b	47d3a5294a	Tue May 28 20:21:26 2019 -0600	fix flake in ads_integration_test (#7091)
ec38ecb88f	47a39f2aa4	Tue May 28 11:37:52 2019 -0400	build: fix Google benchmark 1.5 reference. (#7090)
b0c7a4b9ea	8e2a1f49d8	Mon May 27 21:09:14 2019 -0600	docs: fix error link of ListenerFilter (#7001)
b2fd5e257a	7bfad9155e	Fri May 24 08:13:12 2019 -0600	Fix docs (#7067)
accc6cd2d3	cfff658c1e	Thu May 23 08:57:58 2019 -0600	Fix typo in comment for rds.RouteConfiguration.validate_clusters (#7056)
2893aa0f88	efc8c93860	Thu May 23 08:40:51 2019 -0600	tests: fix tsan test flake (#7052)
efc8c93860	77d8e59943	Thu May 23 08:36:46 2019 -0600	upstream: fix HostUtility::healthFlagsToString (#7051)
a8ac482188	89689fc3a3	Wed May 22 13:06:12 2019 -0700	docs: fix csrf filter source origin note (#7041)
89689fc3a3	bc054bf34e	Wed May 22 12:57:58 2019 -0700	Fix common typo: grcp -> grpc (#7040)
457a732c0a	cab4ce6920	Wed May 22 07:34:38 2019 -0700	coverage: fix some misc coverage (#7033)
813dc94547	cc98ec6c8c	Tue May 21 12:58:32 2019 -0700	fix syntax of gcov exclusion zone. (#7023)
4bb3fbf70d	e4d2bf442b	Tue May 21 10:19:39 2019 -0400	health check: fix more fallout from inline deletion change (#6988)
e4d2bf442b	75d9b99b3f	Mon May 20 20:33:41 2019 -0700	Max heap fix (#7016)
ca396a598b	94da964e2c	Sun May 19 13:13:26 2019 -0700	fix to build kafka extension under python3 (#6998)
fa0b52a874	1525f258c3	Fri May 17 17:30:16 2019 -0400	Fix for an intermittently failing integration test (#6978)
034b23e956	829b905ca0	Fri May 17 09:09:28 2019 -0700	api: Fix link to xDS proto overview in api docs (#6966)
04f0cc9e54	dd16cb9dd8	Thu May 16 09:06:08 2019 -0400	test: adding some debug logs to diagnose hang (#6875)
f37612f6a3	5e6fd4f62c	Wed May 15 19:55:48 2019 -0700	http: fixing more absl::optional bugs in route cache (#6958)
8ff23eb9af	2932ab4670	Wed May 15 18:05:41 2019 -0400	Fix conflicting hot restart select on macOS (#6945)
2932ab4670	6dd4b6f831	Wed May 15 16:56:09 2019 -0400	test: fixing a deadlock in simtime (#6956)
6dd4b6f831	4b0b6540a1	Tue May 14 17:01:48 2019 -0700	health check: fix additional regression from #6765 (#6942)
cc0f6dbfff	e5a3e3cbdf	Tue May 14 13:40:19 2019 -0500	 types: fixing some type problems when compiling against other targets (#6928)
3ca9dcb5a9	1d22e8f054	Mon May 13 09:17:29 2019 -0700	source and test: fix comparisons of different signedness. (#6890)
c833df918a	bdb178669d	Fri May 10 01:04:01 2019 -0700	fix explicit constructor in copy-initialization (#6884)
f0f22f0280	7f66ca016e	Wed May 8 15:42:31 2019 -0700	http: minor perf fix, not copying strings (#6861)
438dd908d0	2d5be1a8c2	Mon May 6 14:52:41 2019 -0400	http: fixing a stats/logs bug for overly large responses (#6789)
8c8b068c51	98bce8c0f5	Sat May 4 12:27:13 2019 -0400	minor maglev doc fix (#6807)
3e1aa6dbbe	281fa1a79c	Thu May 2 21:51:24 2019 -0400	http: fixing a bug in the router filter when logging response headers to upstream access logs (#6785)
281fa1a79c	1f1b7946b7	Thu May 2 16:47:17 2019 -0700	Modify log level to debug (#6778)
a5afe42a72	8c39944206	Thu May 2 16:46:19 2019 -0700	[tools] fix clang-8 reference (#6792)
f35eea732c	16dd476b54	Thu May 2 08:47:59 2019 -0400	build/alts: fixes needed for .bzl and to bump gRPC to 1.20. (#6773)
5867e33124	b6c23c5c9f	Wed May 1 12:27:13 2019 -0400	security: clarify security release window from fix patch availability. (#6715)
0111d66a9f	7ddd7657a1	Wed Apr 24 16:35:31 2019 -0700	event: fix race condition in DispatcherImpl (#6701)
1687ac981d	bc6780cb4e	Tue Apr 23 15:52:04 2019 -0700	docs: fix link in pull request template (#6679)
60241e37f0	32e4d28666	Mon Apr 22 10:13:46 2019 -0600	fix version history order (#6671)
8ceb9c7e01	3abb7d051c	Fri Apr 19 18:57:32 2019 -0700	docs: add aspell to mac dependencies to fix check format script (#6661)
3abb7d051c	7a8f4b06f1	Fri Apr 19 15:27:02 2019 -0400	config: fix delta xDS's use of (un)subscribe fields, more explicit protocol spec (#6545)
109d23a664	40503920d9	Thu Apr 18 14:37:30 2019 -0400	event: update libevent dependency to fix race condition (#6637)
bad70bf162	5ea1a0c1cb	Wed Apr 17 14:43:31 2019 -0400	event: fix DispatcherImplTest::InitializeStats flake (#6619)
71634517d5	21fd119771	Tue Apr 16 08:54:01 2019 -0700	redis: prefixed routing (#6413)
ae70dbec56	1e61a3f95f	Sat Apr 13 18:01:38 2019 -0700	redis: fix asking output for ask redirection support (#6543)
d324731132	0693184245	Fri Apr 12 10:53:29 2019 -0700	thrift_proxy: fix crash when remote closes the connection (#6549)
6d1e3af228	19894aca58	Wed Apr 10 11:13:54 2019 -0400	runtime: fixing a stat bug (#6538)
d44c93a3fc	8e03f31f02	Tue Apr 9 15:19:56 2019 -0700	clang-tidy fixes (#6523)
fe14b11b81	9e22bab376	Tue Apr 9 06:53:29 2019 -0700	tests: fix a compilation error. (#6521)
9e22bab376	fa69fad0de	Tue Apr 9 09:03:01 2019 -0400	test: fix use-of-uninitialized-value bug in unit test (#6515)
c398e4e6ab	7c627275f9	Sat Apr 6 10:58:00 2019 -0700	fix(tracing): allow 256 chars in path tag (#6492)
d8e0f9c1cd	2f097ddc8b	Wed Apr 3 10:18:44 2019 +0900	api: fix bazel query again (#6463)
83def90e43	1e174fff8d	Mon Apr 1 10:31:20 2019 -0700	fix null pointer access when http 1.0 request is rejected (#6417)
af7c845fc5	43ffbeee88	Fri Mar 29 13:11:00 2019 -0400	router: support prefix wildcards in virtual hosts domains (#6303)
c949a8144c	845f8378cf	Thu Mar 28 17:31:56 2019 +0900	docs: more snapping fixes (#6404)
