a17de97	2392671 2d353b3	Wed May 24 08:57:58 2023 -0700	Merge pull request #341 from nick-potenski/fix-integer-overflow
2d353b3	52948c1	Tue Apr 18 10:16:53 2023 -0500	Fix incorrect comparison
eb6dac3	08a7727	Fri Jul 8 21:31:08 2022 +0000	Remove Subtract() and fix comments.
7c97b77	f01ea59	Tue May 3 22:18:41 2022 -0700	Update using.md to fix doc references.
6a78330	034a392	Fri Dec 17 21:28:02 2021 -0800	Fixed Fission test to not use /tmp.
ab61a09	6096286	Thu Dec 16 08:08:00 2021 -0800	remove debug print
765d61d	8ec824e	Mon Nov 15 19:38:55 2021 -0800	Fixed Windows compile errors.
472f139	60209eb 24334e4	Sun Nov 14 18:05:45 2021 -0800	Merge pull request #289 from MehdiChinoune/mingw-fixes
969039d	0fc917a	Sun Nov 14 17:59:12 2021 -0800	Removed debug printf().
24334e4	60209eb	Sun Nov 14 20:43:46 2021 +0100	Fix building on mingw-w64
9f5fddc	90bac14 cc46dac	Mon Aug 9 12:11:07 2021 -0700	Merge pull request #281 from haberman/fuzz-fix
cc46dac	c582cf3	Mon Aug 9 11:42:15 2021 -0700	[pe] Fixed bug on i386 where size_t addition could overflow.
c582cf3	90bac14	Mon Aug 9 11:13:52 2021 -0700	Fixed DWARF bug reading CU name that isn\'t a string.
ae6e9f2	8d4ca4b	Sat Aug 7 19:11:58 2021 -0700	Fixed a bug in the refactoring.
378563d	3df4757	Sat Aug 7 10:25:40 2021 -0700	Fixed broken doc link in the README.
3df4757	6e5d791 bf00c5e	Fri Aug 6 22:36:40 2021 -0700	Merge pull request #277 from haberman/fuzz-fix
bf00c5e	6e5d791	Fri Aug 6 22:05:12 2021 -0700	Fixed bug found by fuzzing.
6e5d791	7fc4a0e 46ab6ab	Fri Aug 6 20:09:00 2021 -0700	Merge pull request #276 from haberman/fuzz-fix
7fc4a0e	00295d9 3e5fe54	Fri Aug 6 19:32:02 2021 -0700	Merge pull request #275 from haberman/fuzz-fix
3e5fe54	00295d9	Fri Aug 6 19:18:02 2021 -0700	Fixed the 32-bit build and a memory leak.
5cc5459	7bf1f36 ec8df8e	Fri Aug 6 11:29:33 2021 -0700	Merge pull request #273 from haberman/fuzz-fix
ec8df8e	7bf1f36	Fri Aug 6 10:57:08 2021 -0700	Skip compressed debug info if uncompressed size is implausibly large.
7bf1f36	0a10880 a8c720e	Fri Aug 6 10:03:06 2021 -0700	Merge pull request #272 from haberman/fuzz-fix
a8c720e	06250f3	Fri Aug 6 09:49:58 2021 -0700	Fixed a bug found by fuzzing.
06250f3	0a5dc68 170bd7c	Thu Aug 5 19:52:24 2021 -0700	Merge pull request #270 from haberman/fix32
170bd7c	0a5dc68	Thu Aug 5 18:14:02 2021 -0700	Fix a warning in the 32-bit build.
0a5dc68	395bdb5 c172ca6	Thu Aug 5 16:59:24 2021 -0700	Merge pull request #269 from haberman/fuzz-fix
c172ca6	395bdb5	Thu Aug 5 14:26:28 2021 -0700	Fixed a bug found by fuzzing.
38347f5	030ece9	Tue Aug 3 09:44:37 2021 -0700	A few fixes to make all the tests pass.
e2b0b38	a3a6ded	Sun Aug 1 16:51:22 2021 -0700	Added a new test for the previous fix.
881ea00	f550bbc	Sat May 22 15:53:37 2021 -0700	Fixed a bug shows in fuzz tests, now all tests pass.
7c0cc1e	718d448	Sun May 2 23:37:56 2021 +0200	Fix msvc build,
d889bd0	7b97d44	Sun May 2 11:49:06 2021 -0700	Fixed typo, osx should be xcode11, not xcode1.
7b97d44	52492bc	Sun May 2 11:46:44 2021 -0700	Fixed fallback path for CheckedAdd().
2e21625	efc1c61 176b1bb	Sat May 1 11:48:45 2021 -0700	Merge pull request #230 from aarzilli/zdebug
176b1bb	efc1c61	Wed Apr 21 15:10:45 2021 +0200	Support zlib-gnu compressed debug symbols
beb602b	c41086c 108d754	Thu Feb 11 09:10:39 2021 -0800	Merge pull request #225 from tweksteen/fix_224
108d754	c41086c	Mon Jan 25 15:33:09 2021 +0100	Fix parsing of archives
5826f16	74b5fd6 93c3f47	Tue Oct 13 20:48:56 2020 -0700	Merge pull request #215 from haberman/coverage-fixes
93c3f47	932061a	Tue Oct 13 20:30:43 2020 -0700	Fixed tests.
900b3c8	aab72b3	Tue Oct 13 18:31:19 2020 -0700	Fixed coverage bug in DWARF DIE reading.
8f6f935	ba7f1cc	Sun May 24 21:53:11 2020 +0200	Fix disabling Google Test target installation.
8708274	9b4e6bb	Sat May 23 21:36:23 2020 -0700	Fix for ABSL CMake build.
4a12907	3ffe040	Sat May 23 20:52:45 2020 -0700	Fixed the build for the new ABSL version.
da6a58a	cd9c1af	Thu May 7 19:33:55 2020 +0100	Fix typo.
cd9c1af	3004e19	Thu May 7 17:58:58 2020 +0100	Fix formatting.
3004e19	20e3a6f	Thu May 7 17:56:30 2020 +0100	Allow WebAssembly files with `--debug-file`.
c947501	cb1e322	Thu May 7 11:40:55 2020 +0100	bloaty: fix assert failure using `--source-filter` with many input files
cb1e322	4a32547	Thu May 7 10:07:32 2020 +0100	bloaty: fix error when when multiple `--debug-file` arguments specified
4a32547	d9c90b1	Thu May 7 09:30:45 2020 +0100	bloaty: fix signed integer overflow due to use of (s)size_t types
1fb15ad	1b5f8fc	Thu Mar 12 14:26:40 2020 +0800	fix compile errors
1b5f8fc	08f59b2 e4b2e4e	Thu Feb 20 11:49:25 2020 -0800	Merge pull request #182 from haberman/ppc64-bug
e4b2e4e	08f59b2	Mon Feb 17 19:19:15 2020 -0800	Fixed note parser for big-endian machines.
7a4fef7	f8e2914	Thu Sep 5 09:23:03 2019 -0700	Fixed bug found by fuzzing.
d35fb81	c16913d	Sun Sep 1 14:13:19 2019 -0700	Fix for overflow check.
0e1a6a1	63eec60	Sun Sep 1 12:10:25 2019 -0700	Fixed bug found by fuzzing.
63eec60	cc5840a	Sun Sep 1 11:48:24 2019 -0700	Fixed overflow found by fuzzing.
8971de7	175515b	Sat Jun 8 07:59:46 2019 -0700	A few README.md fixes, and added --help for --domain=DOMAIN.
c313bb7	e88a0e5	Wed Jun 5 15:31:34 2019 -0700	Fixed DWARF check to allow DWARF 4.
c8b00ab	7772d14	Tue Jun 4 11:34:20 2019 -0700	Fixed rela entries for object files.
220f15f	5d89883	Tue May 7 18:42:08 2019 -0700	Fix pass-by-value in AddInternal and AddSizes
5d89883	df8a3fa 53c9171	Mon Apr 29 16:42:38 2019 -0700	Merge pull request #160 from haberman/hdrfix
a2cb129	5816223	Sun Apr 7 22:04:51 2019 +0100	Fix memcpy warning
f114b59	8cb4f77	Tue Aug 7 14:04:13 2018 -0700	Fixed existence test for "tests" subdir.
5c5f270	53e24f4	Mon Aug 6 23:55:10 2018 -0700	Fixed a few more warnings.
53e24f4	68b1a10	Mon Aug 6 23:45:03 2018 -0700	Fixed unused variable warnings.
385decb	41afdc5	Mon Aug 6 19:32:12 2018 -0700	Fixed a peculiarity with ref_addr: depends on DWARF version.
2b0b2a8	3a2acfa	Sun Jul 22 12:08:18 2018 -0700	Fixed WebAssembly function indexes to respect imports.
3028ca5	c92ce3d	Sun Jul 22 06:36:44 2018 -0700	Fixed bug found by fuzzing.
c92ce3d	f37541d 1c10c64	Sat Jul 21 17:45:17 2018 -0700	Merge pull request #133 from haberman/macho-separate-debug
96f93a0	054788b aebbda8	Fri May 25 10:29:58 2018 -0700	Merge pull request #123 from haberman/fuzz-fixes
3c8bee2	b06e4d4	Tue May 22 09:25:52 2018 -0700	Fixed a bunch of substr() -> StrictSubstr().
b06e4d4	054788b	Tue May 22 09:16:56 2018 -0700	Fixed bug found by fuzzing.
4854fb4	46858d0 978a2c4	Mon May 21 11:41:46 2018 -0700	Merge pull request #122 from haberman/fuzz-fixes
978a2c4	82d358e	Mon May 21 10:43:43 2018 -0700	Fixed bug found by fuzzing.
82d358e	46858d0	Mon May 21 10:24:47 2018 -0700	Fixed bug found by fuzzing.
46858d0	c7ab0fb 584fe46	Sat May 19 10:33:03 2018 -0700	Merge pull request #121 from haberman/fuzz-fixes
584fe46	5286be1	Sat May 19 10:04:47 2018 -0700	Fixed bug found by fuzzing.
5286be1	c2ba7f9	Sat May 19 09:48:28 2018 -0700	Fixed bug found by fuzzing.
c2ba7f9	c7ab0fb	Sat May 19 09:29:20 2018 -0700	Fixed bug found by fuzzing.
a0a2c28	d8ae4a9 7864a56	Fri Apr 27 10:21:39 2018 -0700	Merge pull request #114 from dutor/fix-compile-error
7864a56	d8ae4a9	Fri Apr 27 05:40:51 2018 +0000	Fixed compile errors on PRIx64 format
0a6de20	c3d3609	Thu Apr 5 13:40:57 2018 -0700	Fixed "extends beyond base map" errors.
c3d3609	e19f7f8 c73db3b	Fri Mar 30 15:50:35 2018 -0700	Merge pull request #109 from haberman/debug-print
14aa1ec	e19f7f8	Fri Mar 30 15:21:05 2018 -0700	Added options for debug-printing a VM address or file offset.
ab9534f	a68fed2	Wed Feb 21 17:26:01 2018 -0800	DWARF fix, sometimes integers come in with a fixed form.
61401f3	7e8e9a3	Mon Feb 19 14:28:12 2018 -0800	Fix for unused variable in opt build.
7e8e9a3	18384d6	Mon Feb 19 13:51:29 2018 -0800	Fixed bug found by fuzzing.
18384d6	a950a61	Mon Feb 19 13:36:36 2018 -0800	Fixed bug found by fuzzing.
a950a61	bec5ee3	Mon Feb 19 13:29:23 2018 -0800	Fixed divide-by-zero found by fuzzing.
bec5ee3	c7c1984	Mon Feb 19 13:29:08 2018 -0800	Fixed bug found by fuzzing.
c7c1984	36c411c	Mon Feb 19 13:27:56 2018 -0800	Fixed overflow found by fuzzing.
36c411c	8a341b4	Mon Feb 19 12:02:56 2018 -0800	Fixed hang found by fuzzing.
8a341b4	390d20a	Mon Feb 19 00:22:46 2018 -0800	Fixed bug found by fuzzing.
390d20a	ddd14cf	Sun Feb 18 18:45:43 2018 -0800	Fixed a couple of compile warnings/errors.
d308322	0120168	Thu Jan 25 16:57:59 2018 -0800	Fixed bug where "-n 0" didn\'t work properly.
4b455c5	a6732b3	Tue Jan 23 12:53:34 2018 -0800	Fixed "-d compileunits" in the case of dead DIEs.
3d6611b	05da8ab	Tue Jan 2 01:03:16 2018 -0800	Fixed macOS by adding proper catchall.
6d0dd19	234b7ed	Thu Dec 28 13:50:38 2017 -0800	Fixed another bug with adding ranges not in the base map.
05da8ab	27b714a	Fri Dec 22 17:00:00 2017 -0800	Added some debugging and fixed some bugs.
27b714a	97223c3	Fri Dec 22 13:18:04 2017 -0800	Some more bugfixes.
4886724	1e49be4	Thu Dec 21 12:49:36 2017 -0800	Fixed a bunch of bugs.
dd9768d	fcc344b	Wed Nov 29 12:02:03 2017 -0800	Fixed separate debug files to not be included in size totals.
fcc344b	5d35363	Wed Nov 29 12:01:49 2017 -0800	Added compileunits coverage for .debug_types.
5d35363	51515e4	Wed Nov 29 00:48:56 2017 -0800	Added a "rawranges" source for debugging unlabeled ranges.
340c0a7	62a99ec a50b560	Tue Nov 28 09:46:20 2017 -0800	Merge pull request #95 from haberman/fixseparatedebug
a50b560	62a99ec	Tue Nov 28 09:36:47 2017 -0800	Fixed a few bugs with total file size, and added tests to verify.
b187142	ade6142	Mon Nov 27 15:44:26 2017 -0800	Added docs for debugging with separate files.
f97c836	62e10b6	Sun Nov 26 23:48:25 2017 -0800	Added compileunits coverage for .debug_abbrev, .debug_pubtypes, and .debug_ranges.
62e10b6	5f47f6b	Sun Nov 26 17:25:00 2017 -0800	Added compileunits coverage for .debug_line.
5f47f6b	107d51f	Sun Nov 26 17:01:40 2017 -0800	Added compileunits coverage for .debug_pubnames.
107d51f	de83498	Sun Nov 26 15:56:29 2017 -0800	Added compileunit coverage for .debug_loc.
de83498	465e296	Sun Nov 26 15:00:41 2017 -0800	Added compileunits coverage for .debug_info.
ade6142	17b8d2b 2d6f68e	Fri Nov 24 18:33:15 2017 -0800	Merge pull request #94 from haberman/separatedebug
2d6f68e	eee36a1	Fri Nov 24 09:35:06 2017 -0800	Added support for seperate debug files.
ded1082	f89fb55	Tue Nov 21 20:18:04 2017 -0800	Fixed bug found by fuzzing.
f89fb55	3b38924	Tue Nov 21 16:52:20 2017 -0800	Fix for reading 32-bit DWARF addresses.
532e903	03d8d94	Tue Nov 21 15:30:31 2017 -0800	Removed debugging output.
03d8d94	38a880d	Tue Nov 21 15:19:31 2017 -0800	Fixed a diff mode bug and updated docs for newer output.
64aba78	e1e9ece	Tue Nov 21 14:40:16 2017 -0800	Fixed bugs: CSV output and -d inputfiles.
e1e9ece	d0c8500	Tue Nov 21 12:25:41 2017 -0800	Fixed bug: we should expand non-zero parent rows.
f99d5e0	48dc207	Mon Nov 20 15:03:54 2017 -0800	Fixed a bug discovered by fuzzing.
d2e2271	cb080b6	Sun Nov 19 19:49:31 2017 -0800	Fixed parsing bug found by fuzzing.
d3ec348	4fd5e46	Sun Nov 19 19:33:26 2017 -0800	Fixed bug found by fuzzing.
86d97a7	f260626	Mon Nov 13 08:48:59 2017 -0800	Fixed bug found by fuzzing, by multiplying in uint64 domain.
6ed54d7	012452d	Sun Nov 12 23:32:31 2017 -0800	Another Mach-O header file self-contained fix.
b8b6381	760fda3	Sat Nov 11 08:04:03 2017 -0800	Fixed diff mode output.
926f1f9	9561369	Fri Nov 10 13:37:02 2017 -0800	Fixed -vv.
45cddc5	cd98a0c c8f38fd	Thu Nov 9 17:15:31 2017 -0800	Merge pull request #80 from haberman/intfix
cd98a0c	27a4f25 bd5630b	Thu Nov 9 16:52:00 2017 -0800	Merge pull request #79 from haberman/intfix
bd5630b	27a4f25	Thu Nov 9 16:46:48 2017 -0800	Fixed integer overflow checking code.
0cbb504	832bbbf	Tue Nov 7 15:45:40 2017 -0800	Fixed forward declaration.
76e9f80	ac1bd15	Mon Oct 30 08:42:31 2017 -0700	Fixed crash found by fuzzing.
2855e09	4bcc24f	Sat Oct 14 17:20:00 2017 -0700	Fixed some bugs in option parsing.
4b91952	e8dc373	Fri Oct 13 16:32:47 2017 -0700	Fixed CSV output when no -d option is specified.
e8dc373	7d71bc3	Fri Oct 13 09:29:50 2017 -0700	One more small fix: avoid overflow when negating.
7d71bc3	88600d3	Fri Oct 13 00:37:55 2017 -0700	Simplified LEB128 parsing code, which fixed a bug.
de0c25e	2b46b86	Thu Oct 12 16:33:30 2017 -0700	Fixed a bug found by fuzzing, and added UBSAN option.
2b46b86	a7fa43b	Thu Oct 12 16:04:43 2017 -0700	Fixed a bug found by fuzz testing.
9fc5602	0ff9115	Thu Oct 12 15:14:34 2017 -0700	Fixed a few remaining bugs.
de58550	5b19685	Thu Oct 12 12:36:31 2017 -0700	Fixed a few bugs and removed debug printing.
9a2a69e	beeab79	Tue Oct 10 11:37:01 2017 -0700	Fix DWARF parsing bug found by fuzzing.
beeab79	3453cb7	Tue Oct 10 11:24:54 2017 -0700	Fix integer overflow found by fuzz testing.
3453cb7	fbabb83	Tue Oct 10 09:37:18 2017 -0700	Fixed DWARF parsing bug found by fuzzing.
fbabb83	eda651b	Tue Oct 10 09:26:27 2017 -0700	Fixed DWARF parsing bug found by fuzzing.
eda651b	df48cbe	Tue Oct 10 09:20:48 2017 -0700	Fix DWARF parsing bug found by fuzzing.
df48cbe	ebdba80	Tue Oct 10 08:53:56 2017 -0700	Fixed bug found by fuzzing.
ebdba80	710702f	Mon Oct 9 21:07:23 2017 -0700	Bugfix in NameStripper.
3c10eb9	76982aa	Sun Oct 8 16:36:49 2017 -0700	Removed debugging output.
69539f6	e47b21b	Sun Oct 8 15:12:22 2017 -0700	Added fuzzing support, and fixed related bugs.
9d9d743	7a6de8f	Thu Oct 5 15:13:38 2017 -0700	A few more fixes.
7a6de8f	0d81942	Thu Oct 5 15:07:24 2017 -0700	Fixes from inside Google.
d9d3ecb	31ce34a	Wed Oct 4 17:53:07 2017 -0700	Fix references for real.
31ce34a	47fcddc	Wed Oct 4 17:50:45 2017 -0700	Fix app reference.
82f9cf5	9572093	Mon Mar 20 20:52:42 2017 +0000	CONTRIBUTING: fix CLA links
95d0975	6399f78	Mon Feb 20 10:40:30 2017 +0300	Fix code style
35b6d10	5bf3040	Sun Feb 12 12:33:38 2017 +0300	Fix comparison of integers of different signs
9fb4a5c	eee9ca7	Wed Nov 16 11:18:40 2016 -0500	bloaty: Fix regexp name munging.
7fd69b8	263f2ef	Mon Nov 14 10:25:04 2016 -0800	Updated RE2 to pick up size_t fixes.
a591e9d	429b4cc 28826f4	Fri Nov 11 00:10:33 2016 -0800	Merge pull request #18 from google/dwarf-fix2
28826f4	cacd500	Fri Nov 11 00:04:21 2016 -0800	Fix to "inlines" source: don\'t include region starting at zero.
429b4cc	261f9c9 cacd500	Thu Nov 10 23:48:49 2016 -0800	Merge pull request #17 from google/dwarf-fix2
261f9c9	515bed5 0c85f9f	Thu Nov 10 23:28:36 2016 -0800	Merge pull request #16 from google/dwarf-fixes
0c85f9f	515bed5	Thu Nov 10 23:17:44 2016 -0800	Fixed some bugs in DWARF parsing and expanded `-d compileunits` coverage.
d2af2c8	f9b2bb6	Wed Nov 9 18:26:59 2016 -0800	Fixed #9 by handling section over and underflow.
0687e83	83fe66b	Wed Nov 9 20:34:28 2016 +0000	Fixes issue #10
cf8a125	ff42b14	Tue Nov 8 14:11:40 2016 +0300	fix FreeBSD build
d541212	922a12b	Mon Nov 7 10:11:42 2016 -0800	Fixed Makefile to automatically initialize submodules.
17e4ea2	450ff73	Mon Nov 7 00:22:54 2016 -0800	Fixed the compile on Mac OS X.
450ff73	1ceb776	Sun Nov 6 23:53:50 2016 -0800	Enabled tests in Makefile and fixed building them.
1ceb776	c495cda	Sun Nov 6 23:05:02 2016 -0800	Fixed some warnings raised by GCC.
fadb276	5e1b868	Wed Jul 27 11:05:26 2016 -0700	Some Mach-O/ELF bugfixes.
