a352584	29d65e0	Sat Apr 15 15:40:21 2023 +0100	Fix typo in ChangeLog and increase size of buffer in pcre2test to avoid compiler warning.
a8558f2	2c08b61	Tue Apr 11 12:55:01 2023 +0000	Fix wrong test
2c08b61	6454934	Tue Apr 11 12:42:36 2023 +0000	Fix an invalid match of ascii word classes when invalid utf is enabled
f5cfe2a	47f86d5	Tue Mar 7 17:28:33 2023 +0000	Re-arrange code to avoid jump into a block that bypassed its initialization in the debugging printint module.
8c9a529	26d5cd9	Mon Feb 6 17:08:09 2023 +0000	Fix \\b and \\B with PCRE2_EXTRA_ASCII_BSW in the interpreters
fc56fd7	a608946	Thu Feb 2 17:19:45 2023 +0000	Further ASCII tests and minor bugfix plus ChangeLog update
fcceddc	69d6b24	Wed Jan 25 12:49:36 2023 +0000	Fix minor typo
69d6b24	fa5ec50	Wed Jan 25 09:37:30 2023 +0000	Fix minor memory check bug in pcre2test
3fdb19c	d73a949	Thu Jan 19 09:29:49 2023 +0000	Fix inadvertent missing test update
7846880	5d8a8bb	Thu Dec 1 10:40:01 2022 +0100	jit: fix pcre2_jit_free_unused_memory() if sljit not using allocator (#165)
3a1ad41	8e254fa	Thu Aug 11 18:13:18 2022 +0100	Remove the previous change to the GitHub action which tried running the pcre2grep test under bash because this didn\'t fix what went wrong with the locale test for Alpine Linux. Looks like Alpine doesn\'t have locale support, so try skipping the test (well, in practice mocking up the output) when there is no locale suport.
1f5e47b	95e7696	Wed Aug 10 16:22:12 2022 +0100	Fixed missing/misplaced PCRE2_CALL_CONVENTION macros in functions prototypes (#139)
95e7696	1692936	Wed Aug 10 16:08:34 2022 +0100	Improve LCOV coverage statistics and fix bugs that showed up in pcre2grep while doing this.
1343bdf	d90fb23	Wed Jul 27 18:00:40 2022 +0100	Fix overlooked comment edit
4851890	3e52db5	Thu Jul 14 05:25:39 2022 +0200	Fixed an issue in the backtracking optimization of character repeats in JIT (#135)
3e52db5	4804b00	Fri Jul 8 10:01:46 2022 +0100	doc: fix various typos (#132)
5271b53	45af120	Wed Jun 8 17:05:24 2022 +0100	Fix compiler warning in pcre2test
45af120	187b7ba	Wed May 18 12:16:00 2022 +0200	Fixed race condition that occurs when initializing the executable_allocator_is_working variable in the pcre2_jit_compile function (#91)
15a82c3	51a5fcd	Sat Apr 30 09:46:50 2022 +0100	doc: mostly wording issues, but more importantly a fixed group link (#114)
c630e86	77ce1ff	Sun Apr 24 16:16:49 2022 +0100	Fix integer promotion causing a warning in MSVC (#111)
fedf4d9	8ebf9ef	Fri Apr 22 17:51:31 2022 +0100	Fix recent documentation error
d07c967	4279abb	Thu Apr 14 19:09:40 2022 +0000	Fix recursion issue in JIT
03654e7	d4fa336	Sat Mar 26 08:03:11 2022 +0000	Fixed an issue affecting recursions in JIT
d4fa336	50a51cb	Thu Mar 24 05:34:42 2022 +0000	Fix incorrect value reading in JIT.
50a51cb	f7a7341	Wed Mar 23 07:53:58 2022 +0000	Fixed a unicode properrty matching issue in JIT
111cd47	fdd9479	Wed Jan 26 12:15:11 2022 +0000	Fix typo `with-match-limit_depth` -> `with-match-limit-depth` (#83)
fdd9479	419e3c6	Wed Jan 26 08:37:18 2022 +0000	Fix incorrect compiling when [Aa] etc. are quantified
e85a81e	504ff06	Fri Jan 14 12:37:24 2022 +0000	Correct CMakeLists.txt for MSVC debugger file names
504ff06	360a84e	Fri Jan 14 12:24:23 2022 +0000	Fix overrun bug in recent property name parsing change
06d3a66	87571b5	Tue Jan 11 09:21:27 2022 +0000	Fix bug in modifier listing
534b476	31fb2e5	Tue Jan 4 16:59:03 2022 +0000	RunGrepTest: Fix tests 132 and 133 when srcdir is relative (#71)
435140a	c24047f	Mon Jan 3 15:49:26 2022 +0000	Fix script extension support on jit (#69)
af2637e	98e7d70	Mon Dec 27 11:57:28 2021 +0000	Fix parameter types in the pcre2serialize man page (#63)
4514ddd	944f0e1	Wed Dec 22 16:55:30 2021 +0000	Split generated tables from fixed tables
1c41a5b	4243515	Tue Dec 14 15:52:24 2021 +0000	Fix minor issues raised by Clang sanitize
587b942	c8d31f1	Sat Nov 27 16:27:49 2021 +0000	doc: formatting/typo fixes to documentation (#47)
adf76fa	d144199	Fri Nov 26 17:31:35 2021 +0000	pcre2grep: fix build for Hurd (#52)
1ed34b9	f19e846	Tue Nov 9 17:12:50 2021 +0000	Update version to 10.40-RC1 and fix consequent version test issue.
f19e846	7db8784	Tue Nov 9 17:12:13 2021 +0000	Update ChangeLog for GitHub #35 fix.
072717a	35fee41	Sat Oct 30 11:25:12 2021 +0100	Fix very minor typos in documentation: redundant spaces.
128c503	bf2c8cc	Fri Oct 29 16:07:53 2021 +0100	fix building on ancient compilers (#32)
c99f073	794470b	Fri Oct 29 12:33:20 2021 +0100	Documentation minor text fixes.
179c5d2	e7af7ef ec0755b	Mon Oct 18 17:07:18 2021 +0100	Merge pull request #27 from ltrzesniewski/fix-convert-doc
ec0755b	dc5f966	Sun Oct 17 19:29:44 2021 +0200	Fix option name in pcre2convert docs
e7af7ef	0612ed7 51ec2c9	Wed Oct 6 11:55:58 2021 +0100	Merge pull request #22 from PhilipHazel/early_fail_fix
51ec2c9	0612ed7	Tue Oct 5 16:41:13 2021 +0000	Fix incorrect detection of alternatives in first character search.
507e4dc	dc5f966	Tue Sep 14 16:10:20 2021 +0100	Fix incorrect loop counter reset when setting lookbehind lengths (ClusterFuzz 38653).
15b692f	4ccef16	Fri Aug 27 09:14:11 2021 +0100	Fix typo.
d70da76	a5389db	Mon Jun 14 10:53:18 2021 +0000	Fix some documentation typos.
a5389db	3d80cf5	Fri Jun 4 12:55:49 2021 +0000	Fix invalid single character repetition issues in JIT.
2c4d394	b6acebe	Thu Feb 18 09:46:08 2021 +0000	Fix \\K within recursion bug in interpreter.
2502984	4cfa216	Sun Feb 7 16:43:00 2021 +0000	Fix RunGrepTest\'s handling of binary zeros on Solaris by using /usr/xpg4/bin/tr instead of tr if /usr/xpg4/bin/tr exists.
8144ae0	166e576	Mon Feb 1 17:56:12 2021 +0000	Fix some numerical checking bugs, Bugzilla 2690.
166e576	c246f53	Thu Jan 14 17:14:58 2021 +0000	Another CMake patch for Windows, fixes #2688.
027c937	7eb23f4	Mon Jan 4 17:17:48 2021 +0000	Update RunGrepTest to use tr for handling binary zeros instead of sed, which it is hoped with increase portability. Bugzilla #2681.
6a9900c	9e15c97	Thu Dec 3 15:41:54 2020 +0000	Fixed a Windows CMake testing issue, as advised by Daniel Richard G.
9e15c97	d19789c	Sun Nov 22 15:16:05 2020 +0000	Fix bug in RunTest: not reporting failure in test 2, and fix bugs in RunTest and RunTest.bat causing test 2 to fail when not building in source directory.
d19789c	000bbf2	Fri Nov 13 08:04:06 2020 +0000	Fix ARM64 compilation warning in JIT.
2451870	37b76d8	Tue Oct 27 08:16:04 2020 +0000	Fixed a word boundary check bug in JIT when partial matching is enabled.
92554d1	6d4936d	Fri Oct 9 15:25:27 2020 +0000	Fix binary zero issue (Bugzilla #2628) in RunGrepTest.
fff544a	deffc39	Tue Oct 6 08:04:40 2020 +0000	Fix potential memory leak in error situation in recent new code.
3bdc76e	f8cbb1f	Sat Sep 19 03:49:32 2020 +0000	Fixed a bug in character set matching when JIT is enabled.
f8cbb1f	0cf247f	Tue Sep 15 14:36:23 2020 +0000	Fix Bugzilla #2642: no match bug in 8-bit mode for caseless invalid utf matching.
a2f0fd0	5652d41	Mon Sep 14 15:39:39 2020 +0000	Update pcre2test to check delimiters after #perltest and fix some in test 1.
5652d41	384620a	Sun Sep 13 15:56:32 2020 +0000	Fix delimiters in tests 1 and 4 for correct Perl behaviour (Bugzilla #2641). Also move \\K in lookaround tests to test 2 (Perl no longer supports).
3d31769	0ad89ab	Wed Jul 15 04:35:32 2020 +0000	Fix an early fail optimization issue and a buffer overread in JIT.
0ad89ab	ed489f9	Mon Jun 29 15:35:49 2020 +0000	Fix read overflow for invalid VERSION test with one fractional digit at the end of a pattern. Fixes ClusterFuzz 23779.
ed489f9	3faff02	Mon Jun 22 15:51:19 2020 +0000	Fix Windows debug builds (Bugzilla #2600) using CMake.
b55dba8	fda3221	Fri Jun 5 15:58:28 2020 +0000	Allow spaces in directory name in CMake build (fixes #2588).
e44976f	e0c6029	Mon Jun 1 16:36:00 2020 +0000	Patch for CMakeLists.txt by Wolfgang Stoeggl fixes several things; see Bugzilla #2584/
e0c6029	5dfe817	Fri May 29 14:20:23 2020 +0000	Fix inifinite loop when a single byte newline is searched in JIT.
5dfe817	e73119c	Tue May 26 15:18:35 2020 +0000	Fix previous commit: include CET_CFLAGS in 16-bit and 32-bit builds under AutoTools.
d4e4533	ce558bb	Fri Apr 24 16:05:36 2020 +0000	Fix documentation typos and upgrade documentation checking script.
ca55d0b	8b3f8af	Thu Apr 23 15:41:23 2020 +0000	Avoid using [-1] as a suffix in pcre2test as it can provoke a compiler warning.
f988433	8057c3c	Tue Mar 24 17:25:58 2020 +0000	Fix resource leak in pcre2test introduced by recent patch.
0d0d954	21c40e6	Fri Mar 6 09:23:10 2020 +0000	Fix issues in the early fail optimization.
3155a69	305e273	Wed Feb 26 16:53:39 2020 +0000	Fix bugs in new UCP casing code for back references and characters with more than 2 cases.
68f9c49	3be5380	Tue Feb 25 16:47:36 2020 +0000	Fix bug introduced in recent UCP changes (writing outside starting code unit bitmap for non-UTF caseless character U+00DF).
3be5380	4e8f13c	Mon Feb 24 17:29:00 2020 +0000	Fix bad lookbehind compilation when preceded by a DEFINE group.
f50ee03	a3057bb	Mon Feb 24 15:39:56 2020 +0000	Fix bug in UTF-16 checker returning wrong offset for missing low surrogate.
c21bd97	eedd9d8	Thu Feb 20 07:42:47 2020 +0000	Fix a crash which occurs when the character type of an invalid UTF character is decoded in JIT.
a57787b	29c0d64	Sun Feb 16 17:46:40 2020 +0000	Fix problems with new PCRE2_SUBSTITUTE_MATCHED code.
697cf5f	d71dc30	Mon Feb 10 10:18:01 2020 +0000	Fix control verb chain restoration issue in JIT.
d71dc30	ed8a314	Fri Jan 31 10:09:38 2020 +0000	Fix compiler warning on ARM64 with JIT.
3a6b494	9e960f5	Sun Jan 26 15:31:27 2020 +0000	Fix bug in processing (?(DEFINE)...) within lookbehind assertions.
bf4cd82	03720de	Sat Jan 11 15:28:15 2020 +0000	Fix *THEN verbs in lookahead assertions in JIT.
6707614	279128c	Sun Dec 29 11:50:37 2019 +0000	Fix typo!
880aac5	2632526	Sat Dec 7 16:00:53 2019 +0000	Fix the too early access of the fields of a compiled pattern in JIT.
2632526	f5286d8	Fri Nov 29 11:03:10 2019 +0000	Fix ARMv5 JIT improper handling of labels right after a constant pool.
af45f41	26fc863	Tue Nov 19 12:25:32 2019 +0000	Fixed the incorrect computation of jump sizes on x86 CPUs in JIT.
3c86981	6f41a5a	Sat Nov 16 17:30:07 2019 +0000	Fix sometimes failing caseless non-ASCII matching in assertion.
6f41a5a	9323fa3	Tue Nov 12 13:10:44 2019 +0000	ARM64 first character fixes by Sebastian Pop.
1838261	ae9208a	Wed Nov 6 14:00:21 2019 +0000	JIT ARM64 fixes by Sebastian Pop.
7ecc9cd	f768448	Wed Oct 16 17:12:13 2019 +0000	Fix error offset bug introduced at 1176.
90ae0ae	2a0faa2	Tue Oct 15 15:23:31 2019 +0000	Fix minor test issues and tidies/updates for 10.34-RC1 testing release.
97acc05	70b0deb	Sun Oct 6 03:36:20 2019 +0000	Fix use after free and compilation error in JIT.
3787601	e69a614	Thu Sep 26 16:10:30 2019 +0000	Fix typo.
78fae97	bf15267	Tue Sep 10 13:22:08 2019 +0000	Mend bug introduced in previous patch. Fixes crash detected by ClusterFuzz 17101.
7bbdc58	963b570	Fri Sep 6 16:08:45 2019 +0000	Fix pessimizing optimization of start-of-match code units in the interpreters.
45b219e	1e5e9aa	Mon Aug 26 16:28:26 2019 +0000	Fix bug introduced in commit 1133. Lookbehinds that follow a condition were not always properly handled.
71eb916	ce751bf	Sat Aug 10 11:34:50 2019 +0000	Fix allusedtext bug, rightmost consulted character incorrect in negative lookaheads.
59c7c5d	81ad928	Sat Aug 3 08:30:40 2019 +0000	Fix incorrect computation of group length when one branch exceeded 65535.
630e4bb	c0ed5a3	Thu Aug 1 16:42:36 2019 +0000	Fix typo in test data comment.
9319b5b	fe2df37	Sun Jul 28 15:58:24 2019 +0000	Correct tables argument data type for pcre2_set_character_tables() and fix documentation for pcre2_maketables().
f7e2116	c84a06c	Mon Jul 22 11:05:19 2019 +0000	Documentation typo fixes.
c84a06c	344056b	Sun Jul 21 16:48:13 2019 +0000	Update definition of partial match and fix \\z and \\Z (as documented).
c30815f	f5b35e7	Thu Jul 18 17:20:29 2019 +0000	Fix bug in recent patch for lookbehinds within lookaheads. Fixes ClusterFuzz 15933.
046c5cd	66811c6	Tue Jul 16 15:06:21 2019 +0000	Fix lookbehind within lookahead within lookbehind misbehaviour bug.
66811c6	4677b1b	Mon Jul 15 16:04:13 2019 +0000	Fix oversights in recent non-atomic assertions patch. Fixes ClusterFuzz 15837.
2e06fdc	a5c6010	Thu Jul 4 17:01:53 2019 +0000	Check for integer overflow when computing lookbehind lengths. Fixes Clusterfuzz issue 13656.
4866bd3	c0d0ee5	Fri Jun 28 16:58:08 2019 +0000	Fix bugs in recent patch for setting the maximum lookbehind.
c0d0ee5	434e3f7	Wed Jun 26 16:13:28 2019 +0000	Fix partial matching bug in pcre2_dfa_match().
ef79b97	3b2fa4d	Tue Jun 18 16:07:43 2019 +0000	Fix minimum length bug for patterns containing (*ACCEPT).
0d1ab85	300bf6e	Sat Jun 15 15:51:07 2019 +0000	Fix pcre2grep -o bug when ovector overflows; add option to adjust the limit; raise the default limit; give error if -o requests an uncaptured parens.
300bf6e	49f174e	Fri Jun 14 15:44:57 2019 +0000	Another fix to the recent (*ACCEPT) patch. Fixes clusterfuzz 15242.
f0c06ee	306f2b9	Tue Jun 11 07:37:29 2019 +0000	Fix minor oversight in previous patch. Fixes clusterfuzz 15199.
5850cc5	16c046c	Sat May 25 16:31:38 2019 +0000	Fix previous patch for non-JIT compilation.
342c16e	e118e60	Mon May 13 16:38:18 2019 +0000	Forgot this file in previous commit. Fixes JIT non-UTF bug.
e118e60	a31c548	Mon May 13 16:26:17 2019 +0000	Fix crash when \\X is used without UTF in JIT.
a31c548	274efb8	Sat May 11 11:43:39 2019 +0000	Fix typo.
16de900	4e4f273	Mon Apr 22 12:39:38 2019 +0000	Implement a check on the number of capturing parentheses, which for some reason has never existed. This fixes ClusterFuzz issue 14376.
e85de98	590f65f	Mon Mar 11 17:29:08 2019 +0000	Fix crash in pcre2_substitute() with NULL match context.
473d8f9	4fd8932	Fri Mar 1 16:19:49 2019 +0000	Fix --enable-jit=auto for out-of-tree builds.
4fd8932	740a979	Sat Feb 16 11:58:37 2019 +0000	Try to fix CMake old policy warning issue.
740a979	4bb683e	Thu Feb 14 16:07:14 2019 +0000	Fix two identical documentation typos.
f2e1cea	8c8deae	Wed Feb 13 16:48:30 2019 +0000	Fix overflow bug in new /u code. Fixes ClusterFuzz 13073.
d90de8b	45959f1	Thu Feb 7 17:59:37 2019 +0000	Previout bug-fix was bad. This properly fixes an overrun while reading a Unicode group name.
45959f1	4d17f4b	Thu Feb 7 17:29:50 2019 +0000	Fix small bug in new Unicode group name logic.
a657d4c	ae913fb	Sun Feb 3 14:49:39 2019 +0000	Fix warning when compiled without Unicode support.
86349f8	f33fc9b	Tue Jan 29 14:34:59 2019 +0000	Fix bug in VERSION conditional test in DFA matching.
d38c7f7	7de013b	Thu Jan 17 11:47:59 2019 +0000	Fix word boundary in JIT compiler. Patch by Mike Munday.
7de013b	8f165d3	Fri Jan 4 16:41:32 2019 +0000	Fix issues with BAD_ESCAPE_IS_LITERAL in character classes.
5bec7dd	ed63958	Thu Dec 13 13:23:59 2018 +0000	Fix MAP_JIT issues on Mac. Patch by Carlo Arenas.
0b64d9c	9e4e6fe	Tue Nov 27 16:00:58 2018 +0000	Fix non-recognition of anchoring when preceded by (*MARK) etc.
cd73c93	24b592e	Sat Nov 17 16:59:39 2018 +0000	Fix two instances of <= 0 being applied to unsigned integers.
9a9fdf3	87a9887	Sun Oct 28 17:24:24 2018 +0000	Fix teeny typo.
951bc4b	c796bb8	Mon Oct 22 16:47:55 2018 +0000	Fix heap limit checking overflow bug in pcre2_dfa_match().
c796bb8	9968924	Sun Oct 21 15:06:43 2018 +0000	Fix typos and obsolescences in comments.
9968924	8a0dd89	Sat Oct 20 09:28:02 2018 +0000	Fix zero-repeated subroutine call at start of pattern bug, which recorded an incorrect first code unit.
4642f82	f90ce1a	Wed Oct 17 16:44:22 2018 +0000	Fix typo.
971f885	2ba2264	Mon Oct 15 11:01:24 2018 +0000	Fix typos in code for alphabetic ranges in EBCDIC environments.
cda4780	866750f	Wed Oct 3 15:41:47 2018 +0000	Fix bugs of omission in new script run code.
8800191	3b3dc09	Fri Sep 21 07:24:34 2018 +0000	Fix an xclass matching issue in JIT.
80adf9d	aa26877	Tue Sep 18 10:19:14 2018 +0000	Fix subject buffer overread in JIT. Found by Yunho Kim.
a0188b9	7035170	Mon Sep 17 08:09:51 2018 +0000	Fix more invalid UTF issues revealed by new tests in the JIT compiler.
ab30606	3e6f016	Mon Sep 10 17:34:19 2018 +0000	Fix small bug in pcre2grep (no effect other than a sanitizer warning).
80c57b5	6636628	Thu Sep 6 15:59:11 2018 +0000	Minor code fix to avoid static analyzer complaint.
59c2175	50f0de6	Sun Sep 2 16:53:29 2018 +0000	Fix anchoring bug in conditionals with only one branch.
a8f00b3	6c63199	Wed Aug 29 08:26:29 2018 +0000	Fix typo in Makefile.am, which caused testoutput8-16-4 to be omitted from tarballs.
5d12e53	1c6f2fc	Tue Aug 21 11:27:35 2018 +0000	Minor code fix to get rid of Coverity warning (I hope).
6e6bb40	91a6a3a	Fri Aug 17 14:45:35 2018 +0000	Fix bad auto-possessification of certain types of class.
9332d4b	c722bf2	Sat Aug 4 08:20:18 2018 +0000	Fix dynamic options changing bug.
7754812	7d97c22	Sun Jul 22 15:43:00 2018 +0000	Add more tests for further ClusterFuzz issues, all were fixed by the previous patch; they just crashed in different ways. The fixed issues are ClusterFuzz numbers 9522, 9534, 9535, 9541, 9542. The bug was a new one, introduced by a recent code update (never in a release).
7d97c22	5ea9f6b	Sun Jul 22 15:19:43 2018 +0000	Fix oversight in recent OP_COMMIT_ARG update.
192b82c	635d04f	Sat Jul 21 14:34:51 2018 +0000	Allow :NAME on (*ACCEPT), (*FAIL), and (*COMMIT) and fix bug with (*MARK) followed by (*ACCEPT) in an assertion. More small updates to perltest.sh.
666e94c	d01c822	Mon Jul 16 15:24:32 2018 +0000	Fixed atomic group backtracking bug.
614e144	b053ad9	Wed Jul 11 09:48:32 2018 +0000	Fix typo.
50aa696	b229437	Mon Jul 2 12:26:04 2018 +0000	Fix bug in VERSION number reading.
b229437	1c79bdf	Mon Jul 2 11:23:45 2018 +0000	Ignore qualifiers on lookaheads within lookbehinds when checking for a fixed length.
1c79bdf	462f25d	Mon Jul 2 10:54:03 2018 +0000	Fix global search/replace in pcre2test and pcre2_substitute() when the pattern matches an empty string, but never at the starting offset.
4d2eef1	b87a1b5	Sat Jun 30 13:13:47 2018 +0000	Fix typo.
89c2a02	9de1a27	Fri Jun 22 16:29:56 2018 +0000	Fix bug when \\K is used in a lookbehind in a substitute pattern.
8f571cf	c817f94	Fri Jun 22 14:58:09 2018 +0000	Fix typo in previous.
fa58ac6	3fb01b0	Wed May 30 15:42:23 2018 +0000	Fix typos.
7ccd0fa	6f6d443	Mon Mar 19 08:15:52 2018 +0000	MIPS-JIT compiler fix: flags were not preserved for fast return.
ee7e093	04919e9	Sun Feb 25 12:12:48 2018 +0000	A small fix to pcre2grep to avoid compiler warnings for -Wformat-overflow=2.
b26aa36	553bf8a	Mon Feb 19 17:26:33 2018 +0000	Fix \\C bug with repeated character classes in UTF-8 mode.
af9bcb7	aff7710	Mon Feb 19 16:55:47 2018 +0000	Fix pcre2test -C to correctly show what \\R matches.
aff7710	7eae1c5	Mon Feb 19 14:49:42 2018 +0000	Fix the value passed back for POSIX unset groups when REG_STARTEND has a non-zero starting offset, and make pcre2test show relevant POSIX unset groups.
53a5884	7a5b962	Wed Jan 31 17:53:56 2018 +0000	Fix auto-possessification bug at the end of a capturing group that is called recursively.
7a5b962	958cd14	Tue Jan 16 16:50:40 2018 +0000	Increment dummy ovector size in internal structures to avoid spurious array bound checker warnings. This fixes oss-fuzz 5415.
a6237da	940627c	Fri Jan 12 17:55:47 2018 +0000	Fix problem when compiling without Unicode support.
940627c	1e0f88b	Wed Jan 10 09:28:03 2018 +0000	Fix a typo in JIT and add a test.
807f370	7a6e8a4	Mon Jan 1 14:54:06 2018 +0000	Previous FIRSTLINE patch was broken. Fix it.
7a6e8a4	800d884	Mon Jan 1 14:12:35 2018 +0000	Fix PCRE2_FIRSTLINE bug when a pattern match starts with the first code unit of a newline sequence.
911d43c	07de1b1	Tue Dec 26 15:10:04 2017 +0000	Fix \\K issues in pcre2grep.
3458a2e	59d85d7	Tue Dec 12 16:23:01 2017 +0000	Fix infelicity in not finding a first character inside a non-assertive group within a positive assertion.
59d85d7	1a81b73	Tue Dec 12 15:01:51 2017 +0000	Fix incorrect first matching character when a backreference with zero minimum repeat starts a pattern (possibly after assertions).
77513bf	28e73c6	Thu Nov 30 08:15:28 2017 +0000	Fix after JIT compiler update.
f93d278	2881730	Thu Nov 23 07:54:39 2017 +0000	Fix pcre2_jit_match early check.
2543ba8	76814d9	Mon Nov 13 17:12:55 2017 +0000	Fix crash for --line-buffered with a .gz or .bz2 file in pcre2grep.
76814d9	1cc5351	Mon Nov 13 16:52:39 2017 +0000	Fix multiple multiline matching issues in pcre2grep.
3636691	76e1ce0	Sun Oct 29 16:58:38 2017 +0000	Fix oss-fuzz bugs 3852 and 3891 (same bug); mis-closing external captures by *ACCEPT inside assertions.
13fe976	3a55923	Sun Oct 22 16:17:44 2017 +0000	Fix memory leak issue introduced in last bug fix in pcre2grep.
3a55923	71d0ee7	Fri Oct 20 16:51:59 2017 +0000	Fix pcre2grep recursive file name length issue.
14edec2	8bbf2b1	Mon Sep 25 15:05:29 2017 +0000	Fix typos in documentation.
8bbf2b1	897d547	Mon Sep 18 15:51:44 2017 +0000	Fixed a small memory leak in pcre2test (convert contexts).
3cd616c	72716c1	Mon Aug 28 14:59:04 2017 +0000	Fix typo in VMS code in pcre2test.
18d7627	6a42f68	Sat Aug 12 16:22:52 2017 +0000	Fix "maybe uninitialized" warning.
0ba5272	464d037	Tue Jul 25 15:27:30 2017 +0000	Fix bug in /xx implementation.
4f37764	b8a935f	Sat Jun 17 15:36:22 2017 +0000	Document configuration for SELinux execmem allocator and fix CMake usage.
76a57bd	69eab9c	Sat Jun 17 11:32:06 2017 +0000	Convert pcre2grep to use new pcre2_compile() options, thereby fixing two minor (?) bugs.
6679349	c4fac10	Fri Jun 16 10:27:02 2017 +0000	Fix a match offset check in JIT.
e4c86e2	8e4b992	Sat Jun 3 16:42:58 2017 +0000	Fix matching offsets from regexec() in the POSIX wrapper when called with REG_STARTEND and a starting offset greater than zero.
c0902e1	a16919c	Tue May 30 10:42:57 2017 +0000	Make pcre2_dfa_match() take notice of the match limit, to catch patterns that use too much resource. This should fix oss-fuzz 1761.
4404c8c	cfe289c	Mon May 29 16:23:52 2017 +0000	Fix CMakelists.txt missing new convert file.
cfe289c	3f83148	Mon May 29 16:21:11 2017 +0000	Fix pcre2test buffer size issue for convert calls in non-8-bit modes.
3f83148	b317bdc	Sun May 28 04:05:58 2017 +0000	Fix alnum parsing in glob conversion.
3f96e07	3d80fa4	Sat May 27 15:49:29 2017 +0000	Fix lookbehind with zero-length branch in DFA matching. Fixes oss-fuzz 1959.
fef4de5	231a800	Tue May 23 16:47:29 2017 +0000	Fix potential NULL dereference in new code for surrogate escapes, discovered by Coverity Scan.
0e62218	e36e582	Mon May 22 18:06:55 2017 +0000	Screw down the depth limit for DFA matching in the fuzzer function. Fixes OSS-fuzz 1761 (I hope).
f8256af	7927ac0	Sun May 14 12:04:13 2017 +0000	Experimental conversion: fix POSIX BRE starting ^*.
cd4a219	ab1e3c9	Thu May 11 16:28:54 2017 +0000	A better fix for oss-fuzz 1465.
ab1e3c9	1909bf0	Wed May 10 18:21:03 2017 +0000	Refactor to avoid sanitize warnings when accessing the variable size ovector in the backtracking frame. Fixes oss-fuzz issue 1465. Also make -bigstack in RunTest allocate a 64Mb stack for use with clang sanitizing.
1909bf0	3813b51	Wed May 10 16:44:33 2017 +0000	Refactor to avoid picky compiler warnings. Fixes oss-fuzz issue 1454.
3813b51	7ca875b	Wed May 10 15:42:13 2017 +0000	Correct fix for experimental POSIX pattern translation.
7ca875b	660811e	Tue May 9 10:44:50 2017 +0000	Fix bug in experimental conversion code.
764e23e	4655d89	Mon May 8 15:07:34 2017 +0000	Fix typos in macros for experimental convert functions.
587011e	ba1c759	Sun May 7 15:55:41 2017 +0000	Fix memory leak in pcre2test (found by Coverity Scan).
382b64b	6e943e5	Sat May 6 16:56:07 2017 +0000	Fix crash when more than one kind of "push" was set in pcre2test.
584f35c	3dca43f	Tue Apr 18 14:37:01 2017 +0000	Improve prefix character scanning in JIT.
41d1c6d	e21268b	Sun Apr 16 16:49:11 2017 +0000	Tidies and minor bug fix resulting from Coverity Scan issues.
bd511d3	0cb5a91	Wed Apr 12 13:48:11 2017 +0000	Fix valgrind warnings for unset padding at the end of the pcre2_real_code structure.
3b8672b	14989bd	Tue Apr 11 14:53:26 2017 +0000	Fix ACCEPT issue with ENDANCHORED.
2b36600	59c4618	Wed Apr 5 15:40:06 2017 +0000	Fix typo and remove extraneous blank lines.
0757041	fcd0c39	Tue Apr 4 11:37:21 2017 +0000	Fix non-passing of mark values out of recursions.
fcd0c39	7c32d95	Mon Apr 3 18:02:07 2017 +0000	Fix capturing in conditional negative assertions ended with (*ACCEPT).
a073581	bdac9df	Fri Mar 31 15:51:41 2017 +0000	Fix buglet in recent update for showing malloc/free at match time.
bdac9df	f7e077c	Fri Mar 31 05:40:37 2017 +0000	Fix character type detection when 32-bit and UCP are enabled but UTF is not in JIT.
649ae8f	935183d	Sat Mar 25 15:19:49 2017 +0000	Fix bug introduced at 10.21: use memory allocator from the pattern if no context is supplied to pcre2_match().
45ddeb7	d5ca2de	Thu Mar 23 17:54:58 2017 +0000	Fix issues with (*VERB)s inside recursive subroutine calls.
d5ca2de	de307ea	Wed Mar 22 15:12:06 2017 +0000	Fix misbehaving DFA match for possessively repeated character class (Bugzilla 2086).
cde5f12	338a37e	Tue Mar 21 17:46:21 2017 +0000	Fix 32-bit error buffer size bug in pcre2test (Bugzilla 2079).
a122f42	e105a0f	Tue Mar 21 16:31:54 2017 +0000	Fix NULL deference if pcre2_callout_enumerate() is called with a NULL pattern when Unicode support is available (Bugzilla 2076).
e105a0f	8e4eb8d	Tue Mar 21 16:25:01 2017 +0000	Fix memory leak when deserializing invalid data (Bugzilla 2075).
ca75518	31455a7	Tue Mar 21 16:09:57 2017 +0000	Fix pcre2grep Windows problem for new output-colouring code when not under mingw (Bugzilla 2067).
31455a7	20cafac	Tue Mar 21 12:22:58 2017 +0000	Minor pcre2test code fix for framesize modifier and documentation update.
d6faa55	77ef3e6	Sun Mar 19 18:34:27 2017 +0000	Fix pcre2test bug for global match with zero terminated subject.
d7da2dc	ee1f790	Thu Mar 16 17:17:47 2017 +0000	Fix crash for forward reference in lookbehind with PCRE2_ANCHORED. Fixes oss-fuzz issue 865.
26e92bc	143c136	Fri Mar 10 16:34:54 2017 +0000	Fix crash for pattern with very many captures. Fixes oss-fuzz issue 783.
