401c8b01	f284d356	Mon May 8 18:38:18 2023 +1000	Fix attribute deduplication in form and empty elements (#1950)
d9544a49	f0ae81b1	Wed Apr 26 20:53:45 2023 +1000	Fixed an assert
21aac912	4d6e1671	Sun Mar 26 17:36:12 2023 +1100	Tense fix
d31d637b	28335277	Sun Jan 22 10:57:14 2023 +1100	Fixed typos
bc2181dd	32597ce4	Thu Jan 19 15:25:21 2023 +1100	Fix unescape for runs of escaped characters
eabfcdd2	8b5d2ad1	Mon Aug 29 20:55:03 2022 +1000	Fix typos (#1830)
87334452	e714ef12	Sun Jun 19 10:32:55 2022 +1000	Fixed an OOB in TreeBuilder when getting the body Element
eaf50287	72612480	Sun May 15 13:55:40 2022 +1000	Fix/safelist deep copy constructor (#1763)
ddfdc5b5	180fe95d	Wed Dec 29 15:52:45 2021 +1100	Fix typo in javadoc
b049d5bc	7c9539cc	Sun Dec 19 15:21:57 2021 +1100	Fix sequence input stream parsing (#1671)
7c9539cc	46b0b956	Sun Dec 19 14:52:57 2021 +1100	Fixed comment transition and removed some parse errors
65ca248e	b0c206f0	Mon Sep 13 17:47:57 2021 +1000	Fix javadoc warning
880720e9	d7d10ad1	Thu Sep 2 22:25:37 2021 +1000	Fixed generateImpliedEndTags
eb2f8d27	7a215a7c	Fri Aug 27 18:53:53 2021 +1000	[fixes #1616] Make the imports of javax.annotation(.meta) optional
c91fc28e	b7318178	Wed Aug 25 12:25:36 2021 +1000	Remove version from the javax.annotation OSGi package imports to fix #1616
7cc295c1	19c77325	Sun Aug 22 21:53:24 2021 +1000	Javadoc warning fix
eba3e39a	9d538e63	Sat Aug 14 14:32:34 2021 +1000	Fix an IOOB when HTML root cleared and then attributes added
26d3c14e	436d1199	Wed Aug 4 17:00:38 2021 +1000	Fixed an NPE hit on Current Element if there was nothing left on the stack
e10b0ee0	2c8b5789	Fri Jul 16 11:29:41 2021 +1000	Dependabot ignore names fixed. (#1591)
426e35ec	6b04287f	Mon Jul 12 20:55:59 2021 +1000	Fix the Evaluator for wildcard namespace queries
6b04287f	32d98784	Mon Jul 12 14:05:50 2021 +1000	Fix a potential stack overflow in InTable
661523f2	e45e53c8	Fri Jul 9 16:41:59 2021 +1000	Changelog for adoption agency fix
33da0583	14419a6b	Wed Jul 7 14:18:08 2021 +1000	Fix potential NPE in resetInsertionMode()
0802228b	78e14c4b	Thu Jan 7 17:04:16 2021 +1100	Fixed dangling brace
48615054	8e7dedbb	Tue Jan 5 19:02:43 2021 +1100	Fixes the toString() methods of the Evaluators
032f0215	79496d8d	Thu Dec 31 13:59:28 2020 +1100	Javadoc fixes for first sentence
982c993a	6a047bfe	Mon Dec 28 12:00:39 2020 +1100	Fix Elements.forms()
b03e2d2e	415f6255	Mon Dec 21 11:28:03 2020 +1100	Fixed some typos
a7c07d96	ee05221d	Sun Dec 20 14:07:30 2020 +1100	Fix issue in addNodes where could incorrectly reparent
f6388656	6e3c98c4	Fri Dec 11 16:12:56 2020 +1100	Fixed javadoc and added testcase for Element#isBlock
6e3c98c4	2ccd3f88	Fri Dec 11 15:52:53 2020 +1100	Fix null guards on start tag attributes
c52f8312	6c689fce	Thu Dec 10 16:31:27 2020 +1100	Fix Jetty version
9d9e53c8	a657ae02	Sat Feb 22 22:39:26 2020 -0800	Fixed a performance regression in 1.12
1c51c84e	52bbe52a	Sun Feb 9 10:48:50 2020 -0800	Fix some jdoc warnings
e81c35f9	d06d8f42	Sat Feb 8 18:03:58 2020 -0800	Fix file to LF endings
2d431412	5359490c	Sun Feb 2 10:20:56 2020 -0800	Test to verify zwnj fix for Farsi
128008e2	97758e74	Sun Feb 2 09:56:10 2020 -0800	Fix TextNode.outerHtml normalization for orhpans
a8d431ba	cfd13628	Sat Feb 1 19:04:14 2020 -0800	Fixes #1220 self-closing textarea
f2ff26b6	eb7b0d78	Thu Jan 30 21:42:08 2020 -0800	Fix case in-sensitivity for Tag.Endswith (namespaced elements)
a4210b7a	8371a171	Sun Jan 26 16:53:41 2020 -0800	Also add fix for ends with spaces
8371a171	9b674f82	Sun Jan 26 16:45:16 2020 -0800	fix for bug #1279
de97030f	86d69ea6	Sun Jan 26 16:02:41 2020 -0800	Fix edge cases with delimiters being near a buffer boundary.
b61a3e6b	a9439f0c	Thu Jul 4 17:49:17 2019 -0700	Fix Travis CI JDK issues (#1236)
333fcc3f	e42ca3b8	Sat Jun 29 17:12:13 2019 -0700	Travis fixup
8e3eeb5f	a47a7e45	Sun Jun 2 14:50:06 2019 -0700	Jdk11 / Jdk12 JavaDoc generation fix (#1217)
0fe6d51f	525d7c19	Thu May 16 16:35:04 2019 -0700	Fix :has selector to set the root, allowing relative selectors
a3649e6b	7400feca	Sun May 12 19:03:53 2019 -0700	fix inconsistent javadoc
7400feca	620287bf	Sun May 12 19:00:56 2019 -0700	fix typo in Selector.java
18cd16d2	7c60ac13	Wed Dec 26 16:55:24 2018 -0800	Fix up end-of-line normalization; always want LFs on text
39e90ee3	6be19a6f	Sun Apr 29 15:06:19 2018 -0700	Indentation fix
3c699bad	0f7e0cc3	Sun Apr 15 12:39:44 2018 +0200	Parse invalid unicode escapes as Windows-1252 instead [Fixes #1034]
197815a0	1028b37a	Sat Apr 14 13:48:08 2018 -0700	Fix typo in README.md (#1028)
e5210d1f	11e018fe	Fri Dec 22 13:49:47 2017 -0800	Corrected fix for #998
8808e3fb	b8411990	Tue Nov 14 12:39:20 2017 -0800	NPE fix
5fa76800	aeaf3c1a	Sun Nov 12 16:13:28 2017 -0800	Fixed an issue where were was not spelled correctly.
f75f4739	4d78e031	Mon Nov 13 00:57:36 2017 +0100	Fix #429
24121880	5ba643ce	Sat Oct 21 17:17:23 2017 -0700	Fixup crlf size
4fa93397	32af6ba9	Sat Oct 7 15:46:27 2017 -0700	allow template inside thead/tbody/tr. Fixes #807 (#901)
32af6ba9	929c2f8b	Sat Oct 7 15:43:46 2017 -0700	Add unit test (but no fix) for 883 (#893)
51163017	bbcf905c	Sat Oct 7 15:37:28 2017 -0700	Fixed IndexLessThan matches() to ignore root element and added tests (#918)
c33ba536	846108dc	Sat Oct 7 15:27:26 2017 -0700	fixed issue #916 (#928)
397a0cae	cd3e51d1	Sat Oct 7 15:15:05 2017 -0700	[fix] parsing of mixed-case tags after b934c5d (#942)
be56a546	590f77e5	Sat Oct 7 15:00:11 2017 -0700	Updated javadoc plugin to fix bug with JDK9
590f77e5	35e80a77	Sat Oct 7 14:37:17 2017 -0700	Fixed w3c test in JDK 9
7ba0ee75	45a9de55 8121d8cf	Sat Jun 10 17:45:31 2017 -0700	Merge pull request #820 from cketti/GH-256_fix_locale_bugs
33deba95	38049ce2 0db39c27	Sat Jun 10 12:52:06 2017 -0700	Merge pull request #881 from Siedlerchr/fix872
0db39c27	f28c024b	Wed May 10 11:54:08 2017 +0200	Fix #872 Set request body to null when doing a redirect
57855251	f28c024b	Tue Jan 24 19:23:43 2017 -0500	Minor fix for the parsing of non-empty selects
56a728d4	83f01fd8	Sat Jan 21 16:27:06 2017 -0800	Fix double escaping of query string in redirect
188c3be9	0b75415d	Sun Nov 13 19:26:19 2016 -0800	Fixed a few typos
c28e5bf5	fa929d4f	Mon Oct 24 18:01:41 2016 -0700	Fixed handling of public/system flag in doctypes
d3c58259	3b2440a2	Tue Aug 23 17:11:16 2016 +0200	optimize Element#hasClass this method is perf sensitive (CPU and memory allocations) This replace the regexp split with a custom implementation that do not allocate unneeded memory. With this patch a simple test calling Element#select in a loop for several selector went from 3Gb allocated to 10Mb. GC times were reduced. Fixes #752
f0f0e41e	aa81e10c	Fri Aug 19 12:54:51 2016 -0700	Merge ahielg:master for attribute fix
2bca40cf	49db84f8	Thu May 5 20:52:32 2016 -0700	Fix test
49db84f8	4c4192d3	Thu May 5 20:44:57 2016 -0700	Fix getting stuck on non-ascii tags
4c4192d3	31be24fb	Thu Apr 28 09:26:32 2016 -0700	Fixed .not() example
1c18964e	47f00ba6	Sat Apr 16 17:21:47 2016 -0700	Javadoc 1.8 fix
143ede68	50336e64	Tue Apr 5 10:53:55 2016 -0700	Make prefix namespaces work
b2e37fca	941f69bf	Sun Apr 3 20:19:13 2016 -0700	Fixed an issue when moving moving nodes using Element.insert(index, children)
1dec69d8	f2f3e660	Wed Jan 27 16:26:11 2016 -0500	Fix for bug 671: namespace is included in W3CDom.fromJsoup
0aa50cd3	658bb5ca	Sun Aug 30 13:52:20 2015 +0200	Fix "Parent" Evaluator ignores "root" argument for matches.
f4c7766f	8c43a813	Sun Aug 2 12:26:07 2015 -0700	Fix test now that XML responses auto use XML parser
1e09df66	3ba88d8c	Mon Jul 13 22:34:50 2015 -0700	Fix a relative redirect issue, and clean up URL resolving.
3ba88d8c	ddf4c1bc	Sun Jul 5 23:45:23 2015 -0700	Fixed &nbsp; for XHTML in Shift_JS
3b4f9dfa	5be8b081	Sun Jul 5 21:21:02 2015 -0700	Fix table insertion into TH tags
3a7f39c5	ec608674	Sun Jul 5 14:58:53 2015 -0700	Fixed an issue where unexpected elements in a badly nested table could be moved to the wrong location in the document.
9e97fbf6	11f7c1bd	Wed Apr 22 12:21:40 2015 -0700	:lt documentation fix
e8809994	6d6ee1cc	Wed Apr 8 19:04:00 2015 +0200	Fixed format.
b14e7357	0961b24e	Mon Apr 6 19:30:03 2015 -0700	Speed fix for Android canEncode
ed39e9a3	c01fcd33	Thu Apr 2 19:15:52 2015 -0700	Change note for #489 fix
c01fcd33	0c10dbff	Thu Apr 2 19:14:23 2015 -0700	Form data submission fix
a7b2b42a	b06fcf0d ee613b20	Sun Mar 29 15:31:32 2015 -0700	Merge pull request #509 from offa/datautil_fix
bcdd5bb2	37ab504f 842977c3	Sun Mar 29 14:53:47 2015 -0700	Merge pull request #517 from offa/javadoc_fix
98e87c6a	2588abdd 2f7079a0	Sun Mar 29 14:32:40 2015 -0700	Merge pull request #526 from offa/class_fix
22217f11	ee5d4dff	Tue Mar 17 10:36:58 2015 -0400	fix test
2f7079a0	16e8fc98	Fri Jan 9 20:37:19 2015 +0100	Fix for classes with space.
842977c3	16e8fc98	Sat Jan 3 16:15:57 2015 +0100	Fixed JavaDoc errors and warnings for JDK8 with stricter doc rules.
ee613b20	16e8fc98	Tue Dec 16 21:58:40 2014 +0100	Fixed UnsupportedCharsetException for meta charset tags with an unsupported charset.
eacba9ae	16e8fc98	Thu Dec 11 16:10:02 2014 +0100	Fix for https://github.com/jhy/jsoup/issues/504
24d01fba	ed95f9b8 850e1c27	Sat Oct 18 17:38:15 2014 -0700	Merge pull request #479 from hannibal218bc/fix-element-classnames
ed95f9b8	b45aebf0 288b76ea	Fri Oct 17 16:36:55 2014 -0700	Merge pull request #477 from offa/some_fixes
d84d6a14	ffc28bee 456a5545	Sat Sep 27 18:49:22 2014 -0700	Merge pull request #400 from mdaniel/css2-quoted-attributes-fix
97bd4286	d758acab e187364d	Sat Sep 27 18:35:26 2014 -0700	Merge pull request #410 from tipabu/fix-title-html
d758acab	821b021a	Sat Sep 27 18:33:04 2014 -0700	Fixed 1.5 support from last pull
81a9f532	80158d6f	Wed Jul 23 14:43:58 2014 -0500	Attempt fix for #77. Add support for # \'protocol\'.
924c4807	80158d6f	Sun Mar 23 22:03:48 2014 +0100	Ensure JDK5 compatibility. Fixes #392.
32ab9579	80158d6f	Thu Jan 16 14:57:03 2014 -0300	Fix issue with invalid document when script tag is whitelisted
311d2e7e	80158d6f	Wed Dec 4 17:47:29 2013 +0100	Fix Validation of cookie names
3f9f33d8	6c4f16f2	Sun Nov 17 21:12:57 2013 -0800	Fix issue with UTF-8 BOM when charset only in HTML.
d3705477	73e26919	Sun Oct 6 17:12:58 2013 -0700	FindBugs squash
76399e5b	88730bf9	Sun Oct 6 16:20:52 2013 -0700	Fixed an issue where elements added via the adoption agency algorithm did not preserve their attributes.
88730bf9	2518e92a	Sun Oct 6 15:36:25 2013 -0700	Fixed a crash when reading an unterminated CDATA section.
2518e92a	834d3142	Sun Oct 6 13:46:11 2013 -0700	Fixed support for self-closing script tags.
82200d78	38065277	Sun Jan 27 12:44:52 2013 +0800	fixed incorrect code copy-and-paste
d94f56c2	3982ea11	Sat Jan 26 18:18:40 2013 -0800	Fixed overzealous indenting in outerHtmlTail
3cfd4511	3232ff00	Mon Dec 10 15:51:23 2012 -0800	Fixed an issue when parsing <textarea>/RCData tags containing unescaped closing tags that would drop the traling >.
82f86831	547a1147	Tue Jul 17 07:03:32 2012 -0700	Fixed an issue when normalising whitespace for strings containing high-surrogate characters.
bbd77846	d9f15627	Sun Jun 10 22:16:39 2012 -0700	Javadoc fix
94002db5	4b763cc8	Mon May 28 11:49:07 2012 -0700	Fixed whitespace preservation in <textarea> tags.
21759032	9a5d4f3b	Sat May 26 15:43:53 2012 -0700	Fixed missing <td> in javadoc
9a5d4f3b	1e85878f	Sat May 26 15:05:06 2012 -0700	Copy .properties files, to fix mvn build of Entities.
5c43ce2d	cd054a8a	Sat May 26 14:12:20 2012 -0700	Fixed NPE in Parser.parseFragment() when context parameter is null.
561d12a9	cd054a8a	Mon May 14 15:35:58 2012 +0300	Use English-locale settings when uppercasing charset. Fixes a problem with Turkish characters, see: http://mattryall.net/blog/2009/02/the-infamous-turkish-locale-bug
a97385eb	002a4940	Sun May 6 00:50:48 2012 -0700	Fixed issue with :all pseudo-tag in HTML sanitizer when cleaning tags
002a4940	472c7e55	Sun May 6 00:33:31 2012 -0700	Fix NPE in style fragment parse
472c7e55	04b8921d	Sat Apr 14 20:59:41 2012 -0700	Fixed GAE support: load HTML entities from a file on startup, instead of embedding in the class.
04b8921d	1d37cef1	Sat Apr 14 12:59:04 2012 -0700	Fixed issue where contents of a script tag within a comment could be incorrectly parsed.
1d37cef1	dbc1e34b	Sat Apr 14 12:31:46 2012 -0700	Fixed HTML entity parser to correctly parse entities like frac14 (letter + number combo).
5d56ace1	447bff37	Thu Apr 5 21:25:16 2012 -0700	Fixed precedence parsing of group OR (,) in CSS selectors.
249e5a8a	c744b9af	Mon Apr 2 19:40:56 2012 -0700	Fixed parsing of group-or commas in CSS selectors.
1030e618	1d31086a	Sun Mar 25 22:24:20 2012 -0700	Correctly handle content (ignore it) after frameset end. Fixes #162
68c05150	9afeb6b7	Tue Mar 20 19:55:16 2012 -0700	Changelog and test for pull #165 (comments in tables). Fixes #126
d8c3f9cb	99c4da88	Sun Mar 4 17:18:30 2012 -0800	Fixed invocation of alternative parser in Jsoup.Connection. Updated test to confirm.
99c4da88	433d2f18	Sun Mar 4 16:34:15 2012 -0800	Fixed URL tests.
3592968b	1e84edbe	Fri Dec 30 13:21:11 2011 -0800	Fixes issue #126 in jsoup, where comments inside table were replicated inside body
70b2cf9a	c98349a7	Sun Aug 28 16:39:30 2011 +1000	Fixed doctype tokeniser to allow whitespace between name and public identifier.
c2ecaa18	7171cec2	Sun Jul 17 21:33:33 2011 +1000	Fixed handling of null characters within comments.
3fb895c9	1ea48c83	Sat Jul 16 11:04:21 2011 +1000	Javadoc typo fix.
128b3f82	3d6f1e47	Sat Jul 2 21:12:11 2011 +1000	Fixed normalisation of carriage returns to newlines on input HTML
3d6f1e47	f36b950d	Sat Jul 2 21:12:11 2011 +1000	Fixed issue where a single 0 character was lexed incorrectly as a null character.
f36b950d	f16c0c17	Sat Jul 2 21:12:11 2011 +1000	Fixed an issue with a missing quote when serialising DocumentType nodes.
f16c0c17	81d1fb98	Sat Jul 2 21:12:11 2011 +1000	Fixed CharacterReader to handle unconsuming at EOF correctly. Additional <script> test at EOF.
7fe86808	7b47828b	Sat Jul 2 21:12:10 2011 +1000	Fixed an issue when parsing <script> tags.
b5f53ec2	ab489018	Sat Jul 2 21:12:10 2011 +1000	Changelog for Java 1.5 fix
ab489018	49eb02fe	Sat Jul 2 21:12:10 2011 +1000	Fix an incorrect case fall-through, and add some not-null validations to prevent warnings.
e30ed5d3	a99106ee	Sat Jul 2 21:12:10 2011 +1000	Fix Java 1.5 compatibility
76de9d87	51cb8669	Sat Jul 2 21:12:08 2011 +1000	Fixed cookie handling issue in jsoup.Connect where empty cookies would cause a validation exception.
51cb8669	411c01ff	Sat Jul 2 21:12:08 2011 +1000	Fixed issue in TokeniserState where the tokeniser could get trapped at EOF if in RCDataEndTag state.
6d9081bb	db9efbd5	Sat Jul 2 21:12:08 2011 +1000	Testcase for bug #63.
a14fb16d	7d172333	Sat Jul 2 21:12:07 2011 +1000	Fixed issue with selector parser where some boolean AND + OR combined queries (e.g. "meta[http-equiv], meta[content]") were being parsed incorrectly as OR only queries (e.g. former as "meta, [http-equiv], meta[content]")
277949e7	bbca7db2	Sat Jul 2 21:12:06 2011 +1000	Removed com.sun.xml.internal.ws.util.StringUtils to fix https://github.com/jhy/jsoup/issues/#issue/69 "jsoup/src/main/java/org/jsoup/select/selectors/AndSelector.java:[8,35] package com.sun.xml.internal.ws.util does not exist"
4a470a02	25097669	Sat Jul 2 21:12:05 2011 +1000	Fixed tokeniser optimisation when scanning for missing data element close tags.
d0a7e3a0	43a39b30	Sat Jul 2 21:12:05 2011 +1000	Fixed issue when using descendant regex attribute selectors.
dbbe693c	12a4abda	Sat Jul 2 21:12:04 2011 +1000	fix non-void element parsing such as <a href=/link/>link text</a>
170c25f9	073d9734	Sat Jul 2 21:12:03 2011 +1000	fix bug in element selector: incorrect behavior on multiple classes
073d9734	6fb07413	Sat Jul 2 21:12:03 2011 +1000	added AttrSelector.AttrNamePrefixSelector
adce18ec	9dcc488f	Sat Jul 2 21:12:02 2011 +1000	Fixed absolute URL generation from relative URLs which are only query strings.
2f5b1878	2e496949	Sat Jul 2 21:12:02 2011 +1000	Fixes IndexArrayOutOfBoundException on response with empty headers
2e496949	da9b977e	Sat Jul 2 21:12:02 2011 +1000	Fixed support for HTML entities with numbers in name (e.g. &frac34, &sup1)
cacbbfb9	ef57a000	Sat Jul 2 21:12:01 2011 +1000	Fixed issue in jsoup.connect when extracting character set from content-type header; now supports quoted charset declaration.
ef57a000	9e2d3711	Sat Jul 2 21:12:01 2011 +1000	Fixed support for jsoup.connect to follow redirects between http & https URLs.
20ed24ce	0b56f3e5	Sat Jul 2 21:12:01 2011 +1000	Fixed issue in Entities when unescaping &#36; ("$")
0b56f3e5	84de4abc	Sat Jul 2 21:12:01 2011 +1000	Test fix
dfe666c4	6f1606e3	Sat Jul 2 21:11:59 2011 +1000	Fixed html() method of Attribute
c6936dd3	84056ded	Sat Jul 2 21:11:58 2011 +1000	Fixed Attributes.hmtl()
62afbdf6	5e52f1b2	Sat Jul 2 21:11:58 2011 +1000	Fixed issue when parsing tags with keyless attributes.
5e52f1b2	f548940d	Sat Jul 2 21:11:58 2011 +1000	Fixed support for case-sensitive HTML escape entities.
1342c611	ff329d58	Sat Jul 2 21:11:57 2011 +1000	Javadoc fix
cad245f7	eb1edd46	Sat Jul 2 21:11:56 2011 +1000	Note <tag > fix
eb1edd46	33aed223	Sat Jul 2 21:11:56 2011 +1000	Fixed support for character class regular expressions in [attr=~regex] selector
33aed223	2ca58b79	Sat Jul 2 21:11:56 2011 +1000	Fixed support for character class regular expressions in [attr=~regex] selector
af580c31	7520dee7	Sat Jul 2 21:11:55 2011 +1000	Added support for [^attributePrefix] selector query. Useful for finding elements with HTML5 datasets: [^data]
97d203b3	f00fdf09	Sat Jul 2 21:11:53 2011 +1000	Fixed javadoc for :eq(n)
6c2032dc	bb4ead7c	Sat Jul 2 21:11:53 2011 +1000	Fixed javadoc typo
27a52f90	77add794	Sat Jul 2 21:11:53 2011 +1000	Fix an issue where text order was incorrect when parsing pre-document HTML.
77add794	04ad97cc	Sat Jul 2 21:11:52 2011 +1000	Fixed test package
c01af229	42a712e5	Sat Jul 2 21:11:49 2011 +1000	Fix absolute URL resolution issue when a base tag has no href.
98e828a2	37d4c1f1	Sat Jul 2 21:11:46 2011 +1000	Fixed parse of unclosed <dl><dt>Foo<dd>Bar</dl> runs.
e3222667	2264b369	Sat Jul 2 21:11:44 2011 +1000	Implemented "abs:" virtual attribute prefix for absolute URLs.
ac57740b	95fe538d	Sat Jul 2 21:11:44 2011 +1000	Fixed selector for multi descenders.
72fe7662	e9e331c2	Sat Jul 2 21:11:44 2011 +1000	Fixed select parser for childs.
eb95cc76	ef748897	Sat Jul 2 21:11:43 2011 +1000	Fixed selector so that "parent child" doesn\'t contain parent, and "element.class" is an AND on parent element, and doesn\'t match .class in child element (i.e. I re-read the CSS3 selector doc, which is clearer than jquery doc).
b8b73080	ce691239	Sat Jul 2 21:11:42 2011 +1000	Fixed head canContain
