b'41fe1bae4	cc502a116	Wed Jul 26 14:43:46 2023 +0000	dashboard: display fix candidate info on the bug page
2a509c272	71f8554da	Wed Jul 26 09:45:29 2023 +0000	pkg/report: gather Go runtime bugs under one bug
6756545c2	e88c086e5	Tue Jul 25 14:03:30 2023 +0000	syz-ci: fix default job parameters
e06c669f4	67db6ccb7	Tue Jul 25 08:23:29 2023 +0000	all: support cross-tree fix bisection
f10792b12	4699b1c1f	Tue Jul 25 08:23:29 2023 +0000	dashboard: rename createPatchTestingJobs() to jobFromBugSample()
25ba520b4	b6c534b62	Tue Jul 25 08:23:29 2023 +0000	dashboard: move findResult() to Bug
721cc683c	2c76a8260	Mon Jul 24 08:22:47 2023 +0000	tools/create-gce-image.sh: don\'t use a fixed root device path on ppc64le
e2c3b4007	28847498e	Fri Jul 21 10:28:20 2023 +0000	dependabot.yml: fix config parsing error
022df2bb9	13995e768	Tue Jul 18 12:16:58 2023 +0000	executor: fix loop condition in lookup_endpoint
13995e768	20f8b3c2c	Tue Jul 18 12:12:19 2023 +0000	dashboard: fix the Config.Decommissioned race
432c8d9a7	b03742d1d	Fri Jul 7 12:12:12 2023 +0000	dashboard: include Manager into BugReport
5142e5aa3	22ae5830a	Fri Jul 7 09:59:51 2023 +0000	pkg/bisect: fix SYZFATAL bisections
1a2f6297d	c6509052a	Thu Jul 6 09:36:39 2023 +0000	dashboard: order bugs in a report by their priority
f99c2404d	07d54a36c	Tue Jul 4 10:06:59 2023 +0000	dashboard/app: export bug id
07d54a36c	6f968005c	Tue Jul 4 07:24:44 2023 +0000	dashboard/app: export fix commits repo + branch as json
573dd3df4	8ab61eba7	Thu Jun 29 11:11:23 2023 +0000	dashboard: export causeBug repo + branch
efd787092	176698609	Thu Jun 29 11:11:23 2023 +0000	dashboard/app/getjson_test.go: rename fixCommit to vcsCommit
1015459f7	79782afcf	Mon Jun 26 10:47:14 2023 +0200	dashboard/config/linux/README.md: fix typo
0cf1feea4	09ffe2697	Tue Jun 20 15:04:32 2023 +0200	dashboard/app: export fix-commits as a json
09ffe2697	4b9f2f7e2	Mon Jun 19 16:42:56 2023 +0200	dashboard/app: test bugGroup json reporting
4b9f2f7e2	f1f9726ad	Mon Jun 19 16:42:56 2023 +0200	dashboard/app: add bugGroup json reporting
a87f55960	d0f31f895	Wed Jun 7 12:49:35 2023 +0200	docs: typo fixes
6b9fb3c40	a4ae4f428	Wed Jun 7 11:04:38 2023 +0200	docs/linux/qemu: fix the link to ARM64 toolchain
3ddd77a0a	e2a77acd2	Wed May 31 15:31:17 2023 +0200	dashboard: use correct links to subsystem\'s fixed bugs
cf1845599	1497c3f69	Fri May 26 13:52:20 2023 +0200	dashboard: include tree origin jobs into full bug info
d608a2afc	6b7e906bb	Thu May 25 14:59:38 2023 +0200	dashboard: include label message into bug reports
0513b3e67	0d9bcfef7	Thu May 25 11:45:51 2023 +0200	syz-manager: use 3 VMs per bug reproduction
e0257275e	07fe13821	Fri May 19 16:19:18 2023 +0200	dashboard: preserve Bug modifications in doneJob
07fe13821	3bb7af1de	Fri May 19 16:19:18 2023 +0200	dashboard: optionally disable bug obsoletion
2b9ba477a	4209590a2	Fri May 12 16:10:53 2023 +0200	dashboard: improve checkBugStatus logging
75ee7f6f4	c887d8877	Fri May 12 16:10:53 2023 +0200	dashboard: improve error logging for bug stats
ecca8a243	76821f5ba	Fri May 12 13:24:58 2023 +0200	dashboard: display bug origin tree testing results
893599a2d	46a143059	Fri May 12 13:03:07 2023 +0200	dashboard: prefer bug?exit= links over bug?id=
adb9a3cd3	0fbd49f48	Thu May 11 19:18:00 2023 +0200	dashboard: adjust bug origin tree testing periods
4f98af4e2	e25e3643c	Tue May 9 16:23:28 2023 +0200	dashboard: display cause bisection attempts on the bug\'s page
f3eb580f0	48e0a81d7	Wed May 3 14:00:25 2023 +0200	dashboard: move common bug filtering to createPatchTestingJobs
52d40fd25	62df2017e	Tue May 2 10:51:44 2023 +0200	sys/syz-extract: fix meta checking when using explicit file list
41f953954	6f737ad74	Fri Apr 28 14:53:23 2023 +0200	dashboard: determine bug origin trees and missing backports
70a605de8	95acf4d22	Thu Apr 27 19:33:36 2023 +0200	dashboard: fix subsystem page filtering
cc2b6c8b6	6f3d6fa7a	Thu Apr 27 17:35:01 2023 +0200	dashboard: drop #syz unset from bug\'s template
e14f82fbf	e7f18c19f	Thu Apr 27 11:42:09 2023 +0200	dashboard: list sample commands at the bottom of bug reports
6dd2fc4a0	662958191	Thu Apr 27 11:42:09 2023 +0200	docs: describe bug labels
662958191	703f643f9	Thu Apr 27 11:42:09 2023 +0200	dashboard: let users exclude bugs from monthly reporting
703f643f9	cef7cc099	Thu Apr 27 11:42:09 2023 +0200	dashboard: support bug labels
cef7cc099	030e10720	Thu Apr 27 11:42:09 2023 +0200	dashboard: add Ref column to bug reminders
6f5b1cc41	19a3dabee	Thu Apr 27 09:43:17 2023 +0200	syz-verifier/execresult_test.go: fix loop variable misuse
8d843721a	ca8bc64d9	Wed Apr 26 11:50:12 2023 +0200	dashboard: integrate bug reminders and discussions
3097c1c27	fdc182930	Mon Apr 24 18:40:49 2023 +0200	dashbord: dispaly fix bisection attempts as a job list
8e54598ac	436577a93	Tue Apr 18 15:36:37 2023 +0200	sys/linux/test: add a regression test for sendmmsg bug
438fca29e	fe81a6e2c	Wed Apr 12 20:25:53 2023 +0200	dashboard: conditionally expand the similar bugs section
fe81a6e2c	6ecb91f6d	Wed Apr 12 20:25:53 2023 +0200	dashboard: move discussions higher than similar bugs
f7ba566df	132eb7c80	Fri Apr 7 09:55:58 2023 +0200	dashboard: display collapsible info sections on the bug page
132eb7c80	c68ce9376	Fri Apr 7 09:55:58 2023 +0200	dashboard: put cause and fix bisection info blocks closer
6d7280105	9d8dc9a93	Fri Apr 7 09:46:50 2023 +0200	dashboard: skip non-existent BugIDs
9d8dc9a93	7c6af7b65	Fri Apr 7 09:46:50 2023 +0200	dashboard: update bugs outside of the transaction
90b6b54d9	b78f6ba06	Thu Apr 6 13:59:25 2023 +0200	dashboard: collect and display bug-related discussions
831373d36	18e8a9827	Tue Apr 4 15:13:59 2023 +0200	dashboard: fix subsystem change logging
18e8a9827	fd331b6d8	Tue Apr 4 13:39:20 2023 +0200	pkg/subsystem: update the bug subsystem extraction logic
928dd1772	7db618d07	Tue Apr 4 10:25:21 2023 +0200	dashboard: fix subsystem link generation
898831fcd	888ff08c4	Mon Apr 3 13:50:54 2023 +0200	pkg/subsystem: fix nilfs syscalls
888ff08c4	d04ac3a54	Mon Apr 3 12:19:04 2023 +0200	dashboard: display the correct bug number in subsystem reports
5232cf025	811086ce0	Tue Mar 28 17:31:22 2023 +0200	dashboard: share repro level and report link in SimilarBugInfo
174dbe701	099768ae6	Mon Mar 27 11:47:19 2023 +0200	tools/syz-fmt.go: fix a bug of file info api when updating golang
18ee04d7d	fbf0499ac	Mon Mar 27 10:28:15 2023 +0200	dashboard: ignore duplicate bug list commands
9700afae0	fdb8436fe	Fri Mar 24 15:37:43 2023 +0100	dashboard: clean up remaining debug output
d6deada33	ee89d73c0	Fri Mar 24 15:37:43 2023 +0100	dashboard: enforce the limit of created bug lists per run
ee89d73c0	adb42342d	Fri Mar 24 14:00:26 2023 +0100	dashboard: configure the minimal number of bugs in a reminder
adb42342d	f94b4a29b	Fri Mar 24 14:00:26 2023 +0100	dashboard: introduce per-subsystem reminders about open bugs
f94b4a29b	d846e076d	Wed Mar 22 11:07:42 2023 +0100	dashboard: don\'t show Reported-by for never reported bugs
7939252e4	18b586030	Fri Mar 17 17:40:37 2023 +0100	dashboard: point to subsystem page(s) from the bug page
026e22005	c72cff6c5	Mon Mar 13 12:43:29 2023 +0100	pkg/report: fix false positive reboot reports
6b272a2ce	d7ea8bc49	Tue Mar 7 15:59:12 2023 +0100	docs: fix broken link
153c64502	d97ac5137	Mon Feb 27 09:10:32 2023 +0100	dashboard: improve the bug subsystem page
e792ae78c	0241542af	Fri Feb 24 15:09:49 2023 +0100	docs: document the bug subsystems feature
60c682d26	6a06699b9	Fri Feb 24 15:09:49 2023 +0100	dashboard: support manual bug subsystem assignment
5e3180302	c725ad8a1	Fri Feb 24 12:47:23 2023 +0100	vm/proxyapp/proxyappclient_mocks_test.go: copy mock interface to fix the error
95a142dea	26be8df81	Fri Feb 24 12:47:23 2023 +0100	Makefile: fix golangci-lint OOMs updating to 1.51.2
d21349bc1	d8daec9bf	Tue Feb 21 16:53:54 2023 +0100	dashboard: include subsystem links in BugReport
d02e9a701	3222c2ed2	Fri Feb 17 20:22:07 2023 +0100	dashboard: sort subsystems table by Open bugs
3222c2ed2	ff4c959e9	Fri Feb 17 18:39:46 2023 +0000	gvisor: fix race builds (#3704)
cf8c2d392	95d024ce4	Fri Feb 17 15:02:29 2023 +0100	pkg/cover/backend: apply PC fix up only if .plt section is present
10e90609e	04a1e722b	Fri Feb 17 15:02:29 2023 +0100	pkg/cover: move PC fix up into RestorePC
0f6b41b60	44e83a715	Fri Feb 17 10:01:32 2023 +0100	tools/syz-fillreports: change the bug filtering logic
44e83a715	851bc19a3	Fri Feb 17 10:01:32 2023 +0100	dashboard: fix the refresh_subsystems URL
d1c0cfb50	a591dd142	Thu Feb 16 17:01:23 2023 +0100	tools/demo_setup.sh: fix corpus location
8a350932a	48bd4c368	Thu Feb 16 11:29:36 2023 +0100	dashboard: periodically refresh bug subsystems
2f0f5f6d6	6e13575de	Thu Feb 16 11:29:36 2023 +0100	dashboard/app: infer bug subsystems from crashes
18376b101	7338e3c48	Thu Feb 16 11:29:36 2023 +0100	dashboard: add an admin method to refresh all bugs
9da240155	68f80dec7	Tue Feb 14 17:02:43 2023 +0100	dashboard: factor out the bug filtering code
9db88265d	1d6b4af75	Tue Feb 14 14:29:32 2023 +0100	dashboard: display subsystems on the bug page
5c39b01ab	4d66ad723	Mon Feb 13 12:59:07 2023 +0100	pkg/subsystem: fix a bug in ReachableParents
6a3c415d0	fc9c934ee	Wed Feb 8 20:25:02 2023 +0100	tools/syz-fillreports: use raw bug IDs
5bc3be51c	0a9c11b64	Mon Feb 6 17:03:38 2023 +0000	executor: fix initialize_tun() for Android (#3656)
e40567a58	6b1283d2c	Fri Jan 27 17:31:25 2023 +0100	dashboard: filter bugs by subsystem
6b1283d2c	9da06344c	Fri Jan 27 17:31:25 2023 +0100	dashboard: display subsystems in bug lists
e5a31411c	1fa8fd353	Fri Jan 27 13:33:28 2023 +0100	dashboard: fix racy decommission tests
4589b77c2	3b9d2b55c	Thu Jan 26 11:08:32 2023 +0100	dashboard: load more bugs via API
3b9d2b55c	651c142ca	Thu Jan 26 11:08:32 2023 +0100	dashboard: include report elements in the BugReport
9dfcf09cf	44388686a	Mon Jan 23 14:25:48 2023 +0100	syz-ci: don\'t duplicate job instance suffixes
dd15ff294	559a440a3	Fri Jan 20 08:43:12 2023 +0100	docs/starnix: fix typo in manager config file
62267f142	66fca3ae8	Thu Jan 19 10:19:57 2023 +0100	pkg/csource: fix unit tests for arches with non-default DataOffset
ec26274cc	96166539c	Fri Jan 13 13:43:47 2023 +0100	all: fix duplicate parameter types
1a76d665b	915f66a6f	Tue Jan 3 11:08:12 2023 +0100	go.mod: fix conflict for freebsd/riscv64 support
939e0ffeb	f24e40c08	Tue Jan 3 11:08:12 2023 +0100	sys/syz-extract: fix const generation on freebsd/riscv64
9da18ae8f	c692fab1c	Thu Dec 22 11:17:06 2022 +0100	dashboard: collect bug fixing statistics
d3e76707b	4791c8e9d	Tue Dec 20 10:06:39 2022 +0100	dashboard: share invalid bug stats
bd797b29e	f78ac5295	Fri Dec 16 10:22:43 2022 +0100	dashboard: test the new fs bug routing flow
983a45e4e	d3b8f2b35	Fri Dec 16 10:22:43 2022 +0100	dashboard/app: keep Linux bug management routines
d3b8f2b35	6f9c033e1	Fri Dec 16 10:22:43 2022 +0100	dashboard/app: add subsystem tags to the Bug entity
f65116265	e660de910	Tue Dec 13 17:02:33 2022 +0100	dashboard: return bisection info as BugReport object
e660de910	67be1ae74	Tue Dec 13 16:52:51 2022 +0100	vm/proxyapp: fix race on mock calls in the test (#3584)
23fb7f227	5e0b2c163	Fri Dec 9 13:55:42 2022 +0100	dashboard: add full bug info request API
5e0b2c163	1d0805454	Fri Dec 9 13:55:42 2022 +0100	dashboard: take dashapi status conversion out of fillBugReport()
1d0805454	be94e4895	Fri Dec 9 13:55:42 2022 +0100	dashboard: make bisectFromJob() independent from dashapi.BugReport
be94e4895	caafa4e63	Fri Dec 9 13:55:42 2022 +0100	dashboard: split loadSimilarBugs()
caafa4e63	1034e5fa9	Fri Dec 9 13:55:42 2022 +0100	dashboard: split createBugReport()
34e030543	6b92e6649	Mon Dec 5 13:08:40 2022 +0100	dashboard: deny patch testing requests for non AccessPublic bugs
b1062ff67	4f4577d44	Mon Nov 28 10:51:23 2022 +0100	sys/linux: fix nfs mounting
4f4577d44	f0554c3b2	Mon Nov 28 10:51:23 2022 +0100	sys/linux: fix afs mounting
5c180c8ab	9b0f2cc6d	Mon Nov 28 10:51:23 2022 +0100	sys/linux: fix pvfs2 mount
f4470a7b5	ebe1031cf	Fri Nov 25 15:30:12 2022 +0100	tools/syz-testbed: consider the resulting bug titles
ebe1031cf	b64845ad7	Fri Nov 25 15:30:12 2022 +0100	tools/syz-repro: save the resulting bug title to a separate file
b64845ad7	2dad91ec3	Fri Nov 25 14:35:43 2022 +0100	dashboard: send user-friendly bug from title matching errors
3c2d90bcd	52fdf57a8	Wed Nov 23 12:11:48 2022 +0100	docs/linux: fix trivial typos in ubuntu-host_qemu-vm
0313f19c6	d6f75af39	Wed Nov 23 09:09:39 2022 +0100	sys/linux: fix syz_mount_image$fuse signature
1c50689b3	caddc6cbc	Wed Nov 23 09:09:39 2022 +0100	executor: fix puff_zlib_to_file signature
9da37ae85	1c8e10bce	Tue Nov 22 12:07:57 2022 +0100	dashboard: fix the broken AccessTest
f3cab5934	bfcab33d5	Tue Nov 15 16:55:00 2022 +0100	pkg/report: skip debug objects frames
84ea6a79e	273a70691	Thu Nov 10 12:26:55 2022 -0800	sys/linux: fix VFIO map/unmap
5fa28208c	060f945e7	Tue Nov 8 13:31:37 2022 -0800	sys/fuchsia: fix date in vmar copyright header
6feb842be	a779b11a8	Mon Nov 7 09:57:47 2022 -0800	executor: fix "wrong response packet" in BT fuzzing (#3493)
ac259f2d9	da0a628bc	Mon Nov 7 11:45:47 2022 +0100	dashboard: infer bug info from subject and mailing list
da0a628bc	b701d8c0b	Mon Nov 7 11:45:47 2022 +0100	dashboard: explicitly handle and pass parsed bug info
a59bff84f	7a2ebf95a	Thu Nov 3 09:13:06 2022 -0700	executor: fix TestCommonExt for bigendian arches
edac4fd10	bf413db3b	Tue Nov 1 01:02:55 2022 -0700	sys/fuchsia: fixed copyright header
542b02368	87a14adf3	Mon Oct 31 15:41:30 2022 -0700	sys/fuchsia: minor debuglog update
5c716ff64	729b89b83	Wed Oct 26 21:07:28 2022 -0700	sys/targets: fix -static-pie for s390x arch
1984aebd4	78cef5b1c	Tue Oct 25 21:58:54 2022 +0200	syz-fuzzer/fuzzer.go: use different prefixes for errors
e13fff490	94744d216	Mon Oct 17 08:33:46 2022 -0700	sys/fuchsia: fix object typo (#3447)
adf90437a	8e5761f05	Thu Oct 13 11:03:42 2022 +0200	pkg/build: fix make args in clean function
c62d75df0	3f6b40a11	Thu Oct 13 04:58:58 2022 +0000	tools/syz-env: fix volume labels in SELinux environment (#3437)
16a9c9e0f	02e930d1c	Tue Oct 11 12:54:20 2022 -0700	sys/fuchsia: fixed profile syscalls definitions
2c6543adc	a82584ad7	Wed Oct 5 17:06:49 2022 +0200	pkg/cover: fix ARM64 PCs adjusting
a82584ad7	e0b729403	Wed Oct 5 17:06:49 2022 +0200	pkg/cover: fix coverage PC filter
45fd7169d	21d737fbf	Thu Sep 29 13:44:19 2022 +0200	sys/linux: fix invalid args in syz_mount_image tests
d9da3ac63	1d385642c	Thu Sep 29 12:55:00 2022 +0200	pkg/asset: fix download URLs formation for duplicate assets
1d385642c	a41a2080e	Thu Sep 29 10:49:25 2022 +0200	syz-fuzzer: fix "unaligned 64-bit atomic operation"
a41a2080e	b485720cb	Wed Sep 28 16:31:28 2022 +0200	sys/linux: fix errors
b485720cb	8bcc32637	Wed Sep 28 16:31:28 2022 +0200	sys/linux: fix errors
87840e002	10323ddf7	Tue Sep 27 12:33:44 2022 +0200	pkg/config: fix comments stripping
0ef784044	97471de4a	Wed Sep 21 11:46:22 2022 +0200	pkg/csource: fix const sock_filter
dd9a85ff3	b884348d8	Thu Sep 15 08:42:24 2022 +0200	pkg/build: fix fuchsia disk path
90058bdca	a29cf5afb	Fri Sep 9 12:14:52 2022 +0200	executor: fix setup of netdevsim device
a29cf5afb	f30274687	Fri Sep 9 12:14:52 2022 +0200	executor: fix setup of xfrm device
435aeef7d	c5b7bc578	Wed Sep 7 14:01:31 2022 +0200	dashboard: don\'t retest repros for bugs with commits
65aea2b99	9dcd38fcf	Tue Sep 6 10:17:03 2022 +0200	docs: fix a typo in syz_testbed.md
a805568e4	86c46e46b	Thu Sep 1 18:39:30 2022 +0200	vm/cuttlefish: mount debugfs
86c46e46b	d8e6f9110	Thu Sep 1 12:15:05 2022 +0200	dashboard/app: fix a reporting race
8ed3d4701	1628b0078	Thu Sep 1 10:42:40 2022 +0200	pkg/vcs: cherry pick fix for compiling linux with clang prior to v5.11
88bbb6bc5	828e35354	Mon Aug 29 11:33:10 2022 -0700	sys/fuchsia: add the debug syscalls definitions (#3301)
828e35354	d7593c581	Mon Aug 29 10:47:45 2022 -0700	sys/fuchsia: add the debuglog syscalls definitions (#3302)
e5a303f11	379b15131	Fri Aug 26 12:33:44 2022 +0200	dashboard/app: display the reason for bug invalidation
379b15131	ebc0eda4c	Fri Aug 26 12:33:44 2022 +0200	dashboard: improve logging for bug notification creation errors
15195ea3c	9b5bf4cde	Thu Aug 25 17:27:58 2022 +0200	dashboard/app: add one more Bug index
d58e263fa	898b33503	Wed Aug 17 15:46:42 2022 -0700	sys/fuchsia: fix for clock system calls (#3322)
a9409d470	e73b787ca	Wed Aug 17 17:54:47 2022 +0200	docs: fix syntax
9e4b39c24	7a7cb3044	Tue Aug 16 11:57:06 2022 -0700	sys/fuchsia: fix msi syscall names (#3314)
3e4f27bdc	787ed7e0b	Thu Aug 11 14:40:25 2022 +0200	prog: fix Rotator determinism
787ed7e0b	a6201f116	Thu Aug 11 09:51:10 2022 +0200	pkg/vcs/git.go: fixed error in initializing submodules
c2a623d64	da700653b	Tue Aug 9 11:14:07 2022 -0400	docs/fuchsia: make --debug optional (#3283)
758901297	a65a7ce98	Fri Aug 5 17:24:22 2022 +0200	dashboard/config: enable debug options for the arm64-full config
1a3e21dec	1c9013acc	Fri Aug 5 09:32:20 2022 +0200	executor: fixed fuzzing with System account in Android sandbox (#3275)
5e6028b93	88250aee0	Thu Jul 21 17:19:21 2022 +0200	executor: fix mounting of cgroups on read-only fs
95cb00d1f	4ad7e28c8	Fri Jul 15 16:04:04 2022 +0200	pkg/debugtracer: add the ability to capture time in logs
7d5020531	b5477f494	Fri Jun 24 12:52:57 2022 +0200	pkg/build: support debug tracing
4d6694557	a5dbd430e	Fri Jun 24 12:52:30 2022 +0200	pkg/build: fix typo for android/cuttlefish build
a5dbd430e	912f5df7f	Fri Jun 24 09:16:15 2022 +0200	syz-manager, executor: fix out-of-bound access due to NextInstructionPC
6299d0cf6	44ce23d19	Wed Jun 22 17:43:15 2022 +0200	docs/fuchsia: fix image build commands
44ce23d19	3d7b55ce0	Wed Jun 22 17:43:15 2022 +0200	docs/fuchsia: update README.md to fix fuchsia build with kasan enabled
ffa8ac3a5	6bc654432	Mon Jun 20 13:25:11 2022 +0200	prog: fix out-of-bounds access in any blob mutation
f2bfa3b3a	6247d1c3f	Mon Jun 20 13:24:54 2022 +0200	sys/linux: fix tunnel descriptions
6247d1c3f	8f633d840	Mon Jun 20 13:24:54 2022 +0200	executor: fix enabling of ICMP/ping sockets
1719ee24e	127d1fafc	Wed Jun 15 13:06:52 2022 +0200	sys/syz-extract: fix a deadlock
9ce2c85a5	a3bc5d68b	Tue Jun 14 10:19:39 2022 +0200	executor: fix out of bounds write in lookup_connect_response_in()
c88578925	438e961a3	Fri Jun 3 18:36:09 2022 +0200	executor: fixed sandbox \'android\'
438e961a3	56250633e	Fri Jun 3 17:26:50 2022 +0200	prog: fix panic in squash of out_overlay structs
56250633e	eee80d3cd	Fri Jun 3 17:26:50 2022 +0200	prog: allow to use fixed test seed w/o rebuilding tests
af70c3a9d	a4dc9249a	Mon May 30 17:07:32 2022 +0200	dashboard: improve BugReporting update process
7a3350e8c	9598b3925	Mon May 30 17:07:18 2022 +0200	dashboard: move fix pending bugs away from the main page
9598b3925	a46af3462	Mon May 30 17:07:18 2022 +0200	dashboard: highlight fixing commits
bd37ad7ed	bc12afb1f	Fri May 20 17:34:59 2022 +0200	dashboard/app: update bug.html to use #crash_div
7ce5a022b	9ad6612a0	Fri May 13 11:09:45 2022 +0200	dashboard/app: fix reported error depth (#3138)
beb0b4071	4cf59bb08	Wed May 11 15:56:07 2022 +0200	dashboard: don\'t request C reproducers for bugs in syzkaller
4cf59bb08	8d7b3b671	Wed May 11 15:56:07 2022 +0200	dashboard: repeat bug reproduction every 100 days
8b277b8e2	e60b11036	Mon May 9 11:10:52 2022 +0200	pkg/instance: fix nil derefs in patch testing and bisections
b3f09415e	dc9e52595	Thu May 5 10:44:11 2022 +0200	sys/linux: fix errors in dev_loop.txt
7ee63e2c8	2df221f6a	Tue May 3 08:16:11 2022 +0200	vm/gvisor: fix regex typo
2df221f6a	ad6b95d82	Sat Apr 30 10:47:57 2022 +0200	syz-manager: fix strace run condition
e9076525f	8a1f1f07b	Thu Apr 28 16:44:23 2022 +0200	tools/syz-trace2syz: fix a panic in tests
f2c0ef274	2738b391a	Fri Apr 22 15:53:15 2022 +0200	cron: fix typo preventing deployment
160a3f311	7d7bc7384	Wed Apr 20 14:05:46 2022 +0200	tools: fix create-buildroot-image.sh for AMD64
c334415ef	b5866354b	Tue Apr 19 12:07:02 2022 +0200	docs: fix coverage color for "both"
b5866354b	8bcc32a67	Tue Apr 19 12:06:44 2022 +0200	all: fix patch testing for bugs witout C repro
8bcc32a67	b17b2923e	Fri Apr 15 12:22:44 2022 +0200	docs/linux: fix trivial typing typo ida_rsa -> id_rsa
5071aa3b9	af01ee7dd	Tue Apr 12 19:21:17 2022 +0200	syz-ci: fix an excessive auto-replacement
68fc921ad	c4c32d8c7	Thu Mar 31 14:48:05 2022 +0200	syz-verifier: fix stats access, remove races
c4c32d8c7	9d49f3a7c	Thu Mar 31 10:08:30 2022 +0200	syz-verifier: add exectask.go tests, fix races
2b144c61b	d88ef0c5c	Tue Mar 22 15:29:22 2022 +0100	syz-verifier: fix syscalls API mapping in test (#3037)
6e821dbf7	3cd800e43	Mon Feb 21 20:37:29 2022 +0100	fix: "mmap_alloc_size"->"cov->mmap_alloc_size"
4ebb27982	c1c1631dc	Tue Feb 1 13:52:36 2022 +0100	dashboard/app: store daily stats for individual bugs
2cbffd880	96ff84efe	Mon Jan 24 19:06:56 2022 +0100	pkg/db: fix test under root
51cf8ae51	53e00b45e	Fri Jan 14 16:11:46 2022 +0100	sys/targets: fix check of compiler flag for clang
53e00b45e	b8d780ab3	Fri Jan 14 15:35:59 2022 +0100	sys/test: fix overlay test for bigendian
b8d780ab3	65ab1192d	Thu Jan 13 17:03:25 2022 +0100	sys/linux: fix bugs pointed out by syz-check
4b0229115	24c8419d0	Thu Jan 13 17:03:25 2022 +0100	tools/syz-check: use $ as struct variant suffix delimiter
24c8419d0	ea7f9ad29	Thu Jan 13 17:03:25 2022 +0100	pkg/symbolizer: switch to debug/elf for symbol extraction
b73576f02	3f590eebf	Tue Jan 11 16:30:08 2022 +0100	syz-verifier: fix tests
576c26a15	2641e0252	Tue Jan 11 16:30:08 2022 +0100	prog: fix call selection in rotation logic
2641e0252	2235758e9	Tue Jan 11 16:30:08 2022 +0100	pkg/compiler: fix error message spelling
00e03ebc7	7ba329bce	Tue Jan 11 16:30:08 2022 +0100	sys/syz-extract: fix linux extract
ca0f51ac4	1884f55a6	Tue Jan 11 11:29:00 2022 +0100	docs: update reporting_kernel_bugs.md
1884f55a6	a9d62f91c	Tue Jan 11 08:32:27 2022 +0100	docs/openbsd: update found bugs
5140bd580	e4f103c49	Mon Dec 27 13:34:11 2021 +0100	dashboard/config: fix sybsystems.yml, DAMON support
8dd6a5e35	572bcb406	Thu Dec 16 14:09:48 2021 +0100	syzkaller: remove RPC prefix from rpctypes (#2929)
d5901839c	f752fb536	Wed Dec 15 18:11:53 2021 +0100	syz-verifier: fix VM reboot every 5 minutes (#2923)
e46390ef0	49ca1f59e	Mon Dec 13 11:50:08 2021 +0100	sys/targets: fix race in setCompiler
4d4ce9bc2	4459585c0	Thu Dec 9 22:06:41 2021 +0100	executor: fix kcov mmaping in the non-optimized mode
a4a2a5015	0230ba3e7	Wed Dec 8 09:54:40 2021 +0100	tools/syz-crush: fix default VM timeout
40ec852a0	19bd435f7	Mon Dec 6 14:29:36 2021 +0100	tools/syz-testbed: add a bug count table
b18e90e04	579a87547	Mon Dec 6 14:28:24 2021 +0100	executor: set fixed fd for the extra coverage kcov instance
e543635de	3e755bb18	Fri Nov 12 16:33:30 2021 +0100	pkg/ifuzz/powerpc: add prefixed instructions
9c6dddede	c6ef28725	Fri Nov 12 16:33:30 2021 +0100	pkg/ifuzz/powerpc: refactor for adding prefixed instructions
0dd854679	75b040914	Fri Nov 12 16:32:52 2021 +0100	sys/linux: fix and regenerate consts on the latest kenrel
7cca3ba6d	85c102245	Tue Nov 9 18:13:49 2021 +0100	dashboard/config/linux: simplify debug.yml and lockdep.yml constraints
0aabb34af	4c1be0be7	Mon Nov 8 12:10:31 2021 +0100	syz-verifier: fix use of the current dir in test
098b5d530	b2fb4cbc9	Fri Oct 29 10:10:44 2021 +0200	pkg/report: merge "BUG: Dentry still in use" bugs
373bf66b9	719a0d783	Wed Oct 27 13:18:57 2021 +0200	docs: update bug reporting instructions
c8823b7eb	78e5f70a8	Mon Oct 25 15:40:39 2021 +0200	pkg/report: fix parsing of syscall entry points
78e5f70a8	4f0000ee2	Mon Oct 25 12:45:20 2021 +0200	dashboard/app: return JSON data for the /bug requests with "&json=1" (#2823)
282f03fbb	e1ee7e413	Fri Oct 22 10:19:10 2021 +0200	dashboard/config/linux: fix secretmem parameter name
7aa5fe41b	5462d4703	Thu Oct 14 20:31:40 2021 +0200	docs/openbsd: update found bugs
118b58e65	169113bb6	Wed Oct 13 08:49:25 2021 +0200	dashboard/app: fix url escaping in a test
65c1bd643	efe0f24dd	Sat Oct 9 12:51:35 2021 +0200	pkg/csource: fix call list filtering not being consistent
efe0f24dd	620352409	Thu Oct 7 17:05:22 2021 +0200	syz-verifier: fix qemu vm leakage (#2804)
62ee09875	0a63fd369	Wed Oct 6 20:15:54 2021 +0200	syz-verifier: fixes the crash of the app run w/o parameters (#2800)
0a63fd369	eaadec3ec	Tue Oct 5 15:45:04 2021 +0200	pkg/compiler: fix almost infinite recursion in template instantiation
d9ffc8142	8a6b1a8da	Tue Oct 5 15:45:04 2021 +0200	pkg/compiler: fix infinite recursion in template instantiation
477d9f8dc	b198f94f7	Tue Oct 5 14:22:22 2021 +0200	pkg/cover: workaround clang/ubsan bug
b198f94f7	f765b597a	Tue Oct 5 14:22:22 2021 +0200	pkg/cover: fix tests with clang
f765b597a	ce697b49e	Tue Oct 5 13:49:13 2021 +0200	docs/syz-verifier: fix internal link
be530f6c7	6301d9de5	Wed Sep 29 13:23:24 2021 +0200	docs: set GO111MODULE=off to fix documentation compatibility with go v1.16+
e08fe9377	81cc67e3a	Wed Sep 29 12:53:52 2021 +0200	vm/qemu: fix nil deref in qmp
5b989942e	ec8573b1f	Thu Sep 16 21:37:48 2021 +0200	pkg/ifuzz/powerpc: fix instructions
3bc30e296	e3cdbf865	Thu Sep 16 14:48:44 2021 +0200	sys/linux: fix KVM defines
7ec889b4c	e2776ee41	Fri Sep 10 11:06:39 2021 +0200	tools/syz-usbgen: fix usb_ids.patch
7a882a25f	d0f0970bf	Thu Sep 2 12:50:58 2021 +0200	sys/targets: fix darwin reproducers
3b5941f9d	8f58a0efb	Tue Aug 31 16:02:10 2021 +0200	vm/adb: mount debugfs on Android if it is not mounted
be2c130d4	d5a29e530	Sat Aug 28 08:36:41 2021 +0200	docs/openbsd: update found bugs
b318694d0	b599f2fcc	Thu Aug 26 19:29:53 2021 +0200	executor: fix remote coverage collection
33c26cb73	6652437df	Mon Aug 16 13:36:55 2021 +0200	pkg/cover: fix func range drop into variable range
7f7bb9502	b97d64c9f	Wed Aug 4 19:57:22 2021 +0200	dashboard/config/openbsd: fix recreate script
fd5118098	4d1b57d4d	Mon Jul 26 07:51:53 2021 +0200	sys/linux: minor fix of random dev syscall description
e00224d9f	5044cb7c5	Mon Jul 19 11:29:36 2021 +0200	executor/common_kvm_ppc64: fix KVM support
ad7f042a5	d76591186	Mon Jul 19 11:29:36 2021 +0200	pkg/host: fixup for GOARCH checking for PPC64
e30a17b1f	6172cc679	Wed Jul 14 07:16:41 2021 +0200	dashboard: simple review fixes
