b'1d53978	fd2c71a	Fri Jul 7 13:30:05 2023 +0200	Fix #163 (#170)
41ab86f	1dc2340	Fri Jun 30 10:58:11 2023 +0200	Fix UB in HF adjustment. (#161)
1dc2340	b394a70	Thu Jun 29 14:40:07 2023 +0200	Fix another bunch of UB (integer overflows) (#160)
0e21868	c085498	Mon Jun 26 14:34:37 2023 +0200	[WIP] Fix MSYS2 build (#158)
ab3dfd3	dcaed00	Thu Jun 22 06:59:50 2023 +0200	Fix UB: left shift of negative value (#153)
dcaed00	487450c	Thu Jun 22 06:59:04 2023 +0200	Fix UB left shift of negative value. (#152)
487450c	75a85f8	Mon Jun 12 14:48:11 2023 +0200	Fix undefined shift in TNS (fixed point) (#151)
75a85f8	d062deb	Fri Jun 9 14:25:12 2023 +0200	Further fix UB in PNS (#150)
88d280c	fb7d3a6	Wed Jun 7 11:29:29 2023 +0200	Fix a bunch of Undefined-Shift (fixed-point) (#148)
fb7d3a6	6a8208a	Tue Jun 6 15:09:57 2023 +0200	Fix logical error in TNS coeff scaling (#147)
6a8208a	713a28e	Mon Jun 5 14:57:12 2023 +0200	Fixes #143 (#145)
713a28e	b884944	Mon Jun 5 14:15:05 2023 +0200	Fix UB in fixed_point TNS (#146)
dc33466	9377380	Wed May 31 19:05:32 2023 +0200	Fix a bunch of UB bugs (fixed_point mode) (#141)
9377380	a0775ad	Wed May 24 13:48:19 2023 +0200	Fix Undefined-shift in quant_to_spec (#140)
a0775ad	42a1b1b	Tue May 23 10:56:59 2023 +0200	Fix DRM decoder fuzzer (#139)
42a1b1b	7e46bf9	Fri May 19 16:54:33 2023 +0200	Prepare for fuzzing fixed_point builds on oss-fuzz (#138)
0c6c2b1	d5104df	Tue May 16 12:34:32 2023 +0200	Fix warnings in FIXED_POINT builds (#134)
d5104df	87a4c74	Mon May 15 17:55:34 2023 +0200	Fix null-pointer dereference (#133)
87a4c74	a6ed518	Mon May 15 15:11:39 2023 +0200	Fix DRM build warnings (#132)
a6ed518	e93e16a	Mon May 15 12:47:02 2023 +0200	Fix compiler warnings (#131)
e93e16a	9939a07	Mon May 15 11:53:57 2023 +0200	Fix division by zero (#130)
4d76557	50f1cb8	Fri May 5 07:49:40 2023 +0200	Fix: shift exponent 32 is too large for 32-bit type \'uint32_t\' (#126)
cd393df	d7aa650	Thu May 4 12:08:52 2023 +0200	Fix Undefined-shift in rewrev_bits (#124)
d7aa650	d59ee83	Tue May 2 17:06:18 2023 +0200	Fix: Use-of-uninitialized-value in lt_update_state (#123)
d59ee83	ead250d	Tue May 2 13:33:23 2023 +0200	Fix Undefined-shift in showbits_hcr (#122)
ead250d	c783308	Tue May 2 13:30:25 2023 +0200	Fix: Divide-by-zero in hf_adjustment (#121)
c783308	c60de7d	Tue May 2 10:44:23 2023 +0200	Fix: Undefined-shift in reordered_spectral_data (#120)
bec4d36	16e7faa	Fri Apr 28 15:46:37 2023 +0200	Fix "Undefined-shift in showbits_hcr" (#117)
16e7faa	7070798	Fri Apr 28 15:03:22 2023 +0200	Fix "left shift of 1 by 31 places cannot be represented in type \'int\'" (#116)
6ae9e70	135b378	Thu Apr 27 14:44:14 2023 +0200	Fix "Undefined-shift in rewrev_bits" (#113)
135b378	c4fb9ab	Thu Apr 27 10:55:53 2023 +0200	Fix "Index-out-of-bounds" (#112)
7460432	1df5c4a	Wed Apr 26 11:44:21 2023 +0200	Fix "stack-buffer-overflow" (#111)
1df5c4a	2332fe2	Wed Apr 26 10:42:50 2023 +0200	Fix division by zero (#110)
b94d2d0	5cee79d	Mon Apr 24 12:28:36 2023 +0000	Fix "Undefined-shift in sbr_envelope"
2028a70	5cee79d	Mon Apr 24 12:45:31 2023 +0200	Fix copy-paste in previous PR (#105)
5cee79d	e92540a	Mon Apr 24 12:30:26 2023 +0200	Fix "Stack-buffer-overflow in pns_decode" (#104)
1404ecd	6518149	Fri Apr 21 10:05:08 2023 +0200	Fix fuzzer (double-free) (#100)
9fbdcd1	8df6bbf	Wed Apr 19 19:44:33 2023 +0200	Cleanup / typo fixes (#98)
c8f36e7	0ee2cbf	Wed Apr 19 07:37:21 2023 +0200	Fix MP4 frame offset calculation (#96)
4a75bb9	7f64054	Mon Apr 17 11:05:49 2023 +0200	Fix access to unallocated channels (#94)
7f64054	60d7184	Mon Apr 17 11:02:52 2023 +0200	Fix infinite loop (#93)
8afab12	2a96e9c	Thu Mar 30 16:28:23 2023 +0200	Fix an infinite loop case in the AAC parser (#87)
91d4c95	cfc9a69	Thu Mar 30 10:50:59 2023 +0200	Fix possible Heap Out-Of-Bounds (#84)
4af04cb	d06cc4a	Wed Mar 29 13:02:54 2023 +0200	Fix possible out-of-bounds
d06cc4a	3918dee	Sun Mar 12 09:25:01 2023 +0100	Fix incorrect variable initialization (#82)
b9bd2eb	df42c6f	Thu Oct 20 17:49:45 2022 +0200	fix 7.1 with PCE mapping (#79)
e8aa1c9	f1e19ef 4ed30d3	Fri Oct 9 17:48:33 2020 +0200	Merge pull request #66 from awesie/awesie-fix-4
f1e19ef	374734e 34534b2	Thu Oct 8 09:30:37 2020 +0200	Merge pull request #65 from awesie/awesie-fix-3
374734e	e48c2c8 ef7a59d	Thu Oct 8 09:30:26 2020 +0200	Merge pull request #64 from awesie/awesie-fix-2
34534b2	072b788	Wed Oct 7 20:33:44 2020 -0500	Fix infinite loop in huffman_getescape.
072b788	9facdf1	Wed Oct 7 20:33:44 2020 -0500	Fix infinite loop in adts_parse.
9facdf1	e48c2c8	Wed Oct 7 20:33:44 2020 -0500	Fix NULL pointer dereferences.
e48c2c8	f71b5e8 2783bda	Tue Oct 6 06:45:42 2020 +0200	Merge pull request #63 from awesie/awesie-fix-1
2783bda	fd7a5f8	Mon Oct 5 06:54:53 2020 -0500	Fix PNS decoding when only right channel is noise.
1b71a6b	1073aee	Mon Aug 31 10:02:37 2020 +0200	fix heap-buffer-overflow in mp4read.c
1073aee	eb19fa5	Mon Aug 17 07:37:09 2020 +0200	mp4read.c: fix stack-buffer-overflow in stringin()/ftypin()
25fbe5d	00aa732	Thu Apr 23 12:25:30 2020 +0200	fix some inconsistencies in the frontend output
00aa732	74e949f	Wed Mar 11 15:43:53 2020 +0100	fix "inline function \'cfftf1\' declared but never defined" compiler warning
74e949f	366d350	Wed Mar 11 10:58:30 2020 +0100	fix compilation with LC_ONLY_DECODER (#47)
366d350	6494791	Wed Mar 11 10:55:43 2020 +0100	fix compilation without SBR/PS_DEC (#48)
7c3e60a	fae8a83	Wed Oct 2 12:51:10 2019 +0200	fix Tille -> Title typo in frontend/mp4read.c
920ec98	f1f8e00	Tue Jun 11 17:03:27 2019 +0200	Fix link failure with gcc-9 and wl,asneeded flags
942c3e0	a8dc3f8	Mon Jun 10 13:58:40 2019 +0200	Fix a couple buffer overflows
b9862e2	a8dc3f8	Sun May 5 10:31:12 2019 +0200	main: fix crash with unsupported MP4 files
b85c744	9a00b58	Fri Dec 22 20:04:35 2017 +0000	Fix compilation with MinGW
58fff5c	36f3f62	Thu Dec 21 12:58:09 2017 +0100	More generalized solution that also fixes compilation with GCC < 4.7.3.
8e28afb	f930bf8	Thu Dec 21 00:34:00 2017 +0000	Fix compilation with GCC 4.7.4
ebec9f9	678aaac	Tue Dec 19 13:16:37 2017 +0100	Fixed indentation.
678aaac	334e764	Tue Dec 19 13:02:21 2017 +0100	Fixed a number of compiler warnings because of unused variables + fixed use of un-initialized variable.
372b2e4	00adf5c	Sat Dec 16 19:47:46 2017 +0100	Fixed possible buffer overflow. Buffer \'percents\' was statically allocated with fixed size, but a string of *unbounded* size (because it contains a user-supplied the file name) was written into that buffer via sprintf().
5a03651	f27df30	Sat Dec 16 19:43:55 2017 +0100	Fixed compilation of functions \'bswap32\' and \'bswap16\' on Win32.
022b3e5	bdab105	Thu Oct 5 23:20:58 2017 +0200	fixed syntax errors when NEAACDECAPI is actually defined to __cdecl
f62f226	4e60057	Sat Sep 30 14:33:36 2017 +0200	fixed spelling
35fffb6	e899f1d	Fri Sep 29 13:20:37 2017 +0200	version -> 2.8.4; small build fix
1b7910f	da52b8d	Sat Sep 16 10:35:24 2017 +0200	fixed RNG bug in pns.c
fbd505b	e2d3ad8	Wed Sep 6 11:57:52 2017 +0200	fixed compile error and autotools packing
e2d3ad8	706209c	Wed Aug 9 16:06:59 2017 +0200	fixed extended tag(\'----\') read
ce90f3b	3a59b95	Wed Jul 19 14:08:07 2017 +0200	typoe fixed
ef31633	85420dc	Fri Jul 14 10:49:28 2017 +0200	even better fix for multiple vulnerabilities
09b0228	cfb21cf	Tue Jul 11 08:12:10 2017 +0200	Working patch to fix previous broken commit "multiple vulnerabilities"
cfb21cf	8e846b6	Mon Jul 10 15:50:07 2017 +0200	multiple vulnerabilities fixed (Fabian Greffrath)
8e846b6	c9daaeb	Mon Jul 10 15:38:26 2017 +0200	fixed the man page by avoiding a line break (Fabian Greffrath)
eac0bcb	f84bc9b	Mon Jul 3 11:55:17 2017 +0000	fix autotools warnings
f84bc9b	b44f998	Fri Nov 11 11:25:58 2016 +0000	Fixed implicit SBR detection via AudioSpecificConfig fail when char is unsigned. Patch submitted by Fabian Greffrath
b44f998	37365c5	Sun Feb 22 10:09:29 2015 +0000	The bugfix does not fully fix DRC processing in FAAD2 but significantly improves the implementation. Patch by unknown author.
712d0cf	7d0b06c	Sat Jan 24 14:21:05 2015 +0000	Fixed libfaad crash on fuzzed file. Patch by Fabian Greffrath.
7d0b06c	00cea4f	Thu Jan 22 10:04:06 2015 +0000	Fixed syntax error: an unescaped hyphen is used as a minus sign. Patch by Fabian Greffrath
00cea4f	157eb06	Thu Jan 22 09:40:52 2015 +0000	Fixed segfaults on amd64 due to incorrect pointer size
157eb06	023295e	Thu Jan 22 08:55:49 2015 +0000	Fix visibility attribute compiler warnings. Patch by Fabian Greffrath
023295e	802af12	Mon Jan 19 09:46:12 2015 +0000	Fix advance_buffer problem with large ID3v2 tags. Patch by Mike Crowe
39dd342	41a763e	Fri Mar 2 15:25:24 2012 +0000	Fix hyphen in manpage.
41a763e	b42afd4	Fri Jun 4 20:47:56 2010 +0000	Fixed PNS correlation between left and right channel. Incorrect scaling of right channel.
a8e8a91	42b2e46	Fri Jun 5 16:32:27 2009 +0000	Compile fixes
b54f42f	66d2a35	Fri Feb 6 14:24:21 2009 +0000	Build script fix
66d2a35	0878897	Fri Feb 6 03:39:58 2009 +0000	Fixed difference in declarations
0878897	583b72b	Thu Feb 5 00:51:03 2009 +0000	Final fixes to version numbers and use of external header
bf186d7	c320c72	Thu Jan 29 00:41:08 2009 +0000	Minor compile fixes
a432dd7	65a4292	Tue Dec 23 01:24:49 2008 +0000	[ 2150104 ] fix album artist, disc number, and compilation flag in mp4ff
9a71d06	96eeea1	Mon Sep 22 17:55:09 2008 +0000	Smaller fixes for compilation issues and ARM
b6b4f60	d4d4ca1	Fri Sep 19 22:50:20 2008 +0000	Security fix in main.c Bugfix in envelope border calculation Small bugfixes
d4d4ca1	b79b5a2	Sun Apr 6 00:52:10 2008 +0000	Project file fixes
d15dbae	facf1c4	Sat Mar 29 21:10:24 2008 +0000	workaround for latm bug
2ed7cad	d4a65c0	Tue Dec 4 14:41:04 2007 +0000	Fixed libtool ABI version numbering thing
d4a65c0	3bd54e2	Thu Nov 1 12:34:11 2007 +0000	Final fix to copyright header Fixed small bug in PS decoder
dca1dfb	d5261b3	Tue Sep 11 18:21:28 2007 +0000	blackfin fixed point multiplication optimization
d5261b3	ac792ae	Tue Sep 11 18:20:37 2007 +0000	blackfin fixpoint configuration
e2defb3	a952619	Tue Jun 5 19:00:18 2007 +0000	Fixes from SF tracker
a952619	5cfc298	Tue Jun 5 18:38:57 2007 +0000	hcr.c: Removed some code that caused false errors. bits.h: Fixed a potential bug, although code is never used probably.
588f588	639b9c8	Mon Sep 25 19:46:25 2006 +0000	LRINTF fixes for OSX
639b9c8	ee772c4	Tue Aug 15 19:22:15 2006 +0000	Fixed small range checking bug
ee772c4	0620c36	Tue Aug 15 19:05:11 2006 +0000	Compilation fixes for linux Bugfix in ps_syntax.c bitstream reading for PS
41961f6	26f8278	Mon Aug 7 18:09:05 2006 +0000	Another silly bug
26f8278	519d283	Mon Aug 7 18:00:49 2006 +0000	Silly bug
519d283	b737ae4	Sun Aug 6 18:57:15 2006 +0000	Latest changes: make faad2 compile on linux with the xmms plugin; fix incorrect SBR detection in extended AudioSpecificConfig.
b737ae4	e19fec5	Sat Jul 22 14:13:21 2006 +0000	Bugfix in HCR code
e19fec5	542ddb7	Fri Jul 7 12:35:24 2006 +0000	faad_rewindbits fixed
542ddb7	5ad0c0a	Fri May 26 19:21:35 2006 +0000	Fixed stupid SBR downsampled filterbank bug
8498be7	891c7d0	Tue Oct 19 18:02:10 2004 +0000	in_mp4.c: small bugfix for crashing at end of file
dd018ff	4d4850f	Mon Oct 18 19:25:00 2004 +0000	fixed some problems in winamp plugin
8ab8622	befcd24	Wed Sep 8 09:43:40 2004 +0000	Sync CVS - smal bugfixes
52b8323	b5330cb	Fri Sep 3 21:49:56 2004 +0000	Some display fixes
4ce32db	fb2e3a6	Thu Sep 2 15:49:29 2004 +0000	Bugfixes for PS AAC streaming
336d6ca	b288de8	Thu Sep 2 14:02:02 2004 +0000	Bugfixes for PS AAC streaming
58b5f3d	3355b74	Mon Aug 23 19:16:11 2004 +0000	Linux fix
2405cc8	570827b	Fri Aug 20 08:31:32 2004 +0000	fix in build system
570827b	9dcbf0e	Fri Aug 20 08:30:53 2004 +0000	fixed problem in mpeg4ip plugin
9dcbf0e	2d6b47c	Thu Aug 19 18:58:14 2004 +0000	Fix in makefile?
3020282	14ca39c	Thu Aug 19 18:41:31 2004 +0000	Fixed project file
1b1b737	3836229	Fri Aug 6 08:09:45 2004 +0000	makefile fix
3836229	916dbed	Wed Aug 4 19:13:43 2004 +0000	fix in DRM dec
916dbed	7421a3b	Wed Aug 4 11:12:56 2004 +0000	fix in project file
7421a3b	a1f471d	Tue Aug 3 20:29:21 2004 +0000	hcr.c: bugfix
776e895	faea722	Tue Jul 27 09:02:46 2004 +0000	Attempt to fix linux compilation
faea722	5ff3ed7	Tue Jul 27 08:56:41 2004 +0000	Attempt to fix linux compilation
f039a4f	62336de	Wed Apr 21 11:34:19 2004 +0000	build system fixes
62336de	c095b2f	Mon Apr 12 18:17:42 2004 +0000	- PS fixed point - Minor updates in SBR - AUTHORS updated
c095b2f	3eb3659	Sat Apr 3 19:08:38 2004 +0000	Fixed aacDecDrop, now also uses mp4ff, including m4a and m4p support Added some comments to PS
3eb3659	9f66d47	Sat Apr 3 10:49:15 2004 +0000	bugfix in SBR hf gen better disabling of MAIN and LTP decoding DRM API change
e021cc2	877579b	Tue Mar 30 08:16:09 2004 +0000	Updated mpeg4ip libraries to version 1.0 This may require some fixing in makefiles, etc
d8578de	d657db3	Fri Mar 19 15:35:59 2004 +0000	Fixed point output possible
d657db3	0593e00	Fri Mar 19 10:37:56 2004 +0000	Fix for 64 bit machines (malloc with size_t) DRM quality increased a lot (CRC for SBR disabled for now, error recovery for SBR improved) PS updates DRM code now resilient against mono<->stereo changes
0593e00	6aad5dd	Sun Mar 14 21:26:22 2004 +0000	fix for compiling DRM
6aad5dd	430570b	Fri Mar 12 13:31:25 2004 +0000	fixed DRM compile
430570b	9fb0bb2	Thu Mar 11 14:34:10 2004 +0000	typo fix
9fb0bb2	0062604	Thu Mar 11 13:32:39 2004 +0000	fixes for mingw compiler
0062604	52bf784	Thu Mar 11 11:40:13 2004 +0000	fix in element id storage
52186c2	1f051ca	Wed Mar 10 19:45:42 2004 +0000	Fixed point SBR initial PS version
cd2a605	24ab866	Tue Mar 2 23:13:50 2004 +0000	Fixed output to stdout
493e73c	0800217	Tue Mar 2 19:37:27 2004 +0000	Bugfixes
6dfe72f	b823b1e	Wed Feb 4 20:07:24 2004 +0000	small fixes for DRM
b823b1e	a620eaf	Wed Feb 4 19:55:03 2004 +0000	fixed stupid wrong huffman table
fcae268	f5de6d8	Tue Jan 20 18:42:51 2004 +0000	Fixed compilation for DRM New SF huffman codebook
dcebb7e	394d1b7	Fri Jan 16 20:20:32 2004 +0000	Stability fixes
394d1b7	09e5bec	Wed Jan 14 20:50:22 2004 +0000	fixed lunix compiling problem (no need to include drms.c for linux, it only works on win32)
9ea647b	d59a88f	Wed Jan 14 20:36:22 2004 +0000	Stability fixes
d59a88f	10ba59a	Wed Jan 14 20:32:30 2004 +0000	Stability fixes
10ba59a	cac7ac2	Wed Jan 14 09:09:13 2004 +0000	DRM fix
9027402	1a1e8a9	Mon Jan 12 18:55:40 2004 +0000	fix for DRM
1a1e8a9	cffc4a4	Sun Jan 11 15:53:51 2004 +0000	mp4ff bugfixes
cffc4a4	891c06a	Sun Jan 11 15:46:19 2004 +0000	mp4ff bugfixes
891c06a	deb0093	Sun Jan 11 15:29:10 2004 +0000	Multichannel bugfix
5ecb2ee	3e1f2d4	Mon Jan 5 20:03:29 2004 +0000	Fixed some tag writing of cover art
7c89540	4d8f6a4	Fri Jan 2 16:38:48 2004 +0000	Tagging fixes
4d8f6a4	0749496	Mon Dec 29 18:36:01 2003 +0000	small bugfix for CBR files
44c69a9	ac3398a	Wed Dec 17 16:37:34 2003 +0000	Small DRM fixes
ac3398a	eabc03b	Wed Dec 17 14:43:17 2003 +0000	New code for DRM standard Some SSE optimisations (someone please make this work for Linux) Start work on Scalable profile General fixes
eabc03b	a3454cd	Wed Dec 17 10:50:21 2003 +0000	Fixed rounding issue
62ce5ca	e620684	Sun Dec 14 13:50:50 2003 +0000	more mp4ff fixes, better gapless support for mp4
e620684	428cc5c	Sun Dec 14 13:50:10 2003 +0000	more mp4ff fixes
054797b	18e4504	Fri Dec 5 15:40:47 2003 +0000	fixed xmms plugin compilation
9e7e4c1	db20466	Tue Nov 25 13:18:42 2003 +0000	Linux compile fix
e6f8968	593d9c3	Sat Nov 22 16:37:58 2003 +0000	Fix for replaygain saving
571ea29	3fc490a	Sat Nov 22 11:12:13 2003 +0000	Fixed memory leak in tag writer, improved handling of track and disc number tag fields
3fc490a	0bb1af0	Fri Nov 21 19:07:32 2003 +0000	no more debug messages :)
779598b	66d8df2	Fri Nov 21 18:20:57 2003 +0000	Fixed stupid bug with unsigned variable in new mp4 library
66d8df2	7563189	Fri Nov 21 17:08:27 2003 +0000	Tagging fixes, added support for extended metadata interface used by Media Library
dbdd0f6	c0ae726	Wed Nov 19 11:43:57 2003 +0000	Fixed wrong negative clipping
c0ae726	b3fd3e2	Tue Nov 18 10:57:19 2003 +0000	It appears that I fixed tagging breaking files
3b2e3d1	7be9972	Wed Nov 12 20:47:59 2003 +0000	Huge ARM speedups SBR fixes TNS bug fixed
2164315	9c13616	Thu Nov 6 14:08:58 2003 +0000	Small accuracy fixes
9c13616	0647406	Thu Nov 6 11:04:14 2003 +0000	Linux compilation fixes mp4ff should compile now xmmsmp4 should compile now spec file added for Red Hat (make dist should now work)
dc165c1	f241b4e	Wed Nov 5 09:32:04 2003 +0000	DRM fix
91082ce	3414879	Tue Nov 4 21:43:30 2003 +0000	fixed MAIN decoding
2cfe0e1	c7dfb43	Sun Nov 2 14:59:06 2003 +0000	workaround for buggy mpeg-2 aac in mp4 files
c7dfb43	0f811a0	Sun Nov 2 14:18:56 2003 +0000	Fixed decoding of MPEG-2 AAC files muxed inside a MP4 file (AudioSpecificConfig == ADIF header)
0f811a0	2737378	Wed Oct 29 18:14:46 2003 +0000	Fixes
2737378	24b3fe8	Mon Oct 20 15:43:52 2003 +0000	DRM fix
24b3fe8	5055d74	Mon Oct 20 14:46:55 2003 +0000	DRM fix some changes in common.h
5055d74	42ce030	Mon Oct 20 14:05:39 2003 +0000	fixes in mp4ff
544ab69	1983417	Sun Oct 19 19:28:41 2003 +0000	__int64 fix
1983417	758d652	Sun Oct 19 19:18:53 2003 +0000	Fix for gapless mp4 decoding
0f800fc	a930800	Fri Oct 17 16:23:05 2003 +0000	Fixes
516916a	adc10e7	Tue Oct 14 16:56:26 2003 +0000	fix in function usage
a880397	181682e	Sun Oct 12 13:30:06 2003 +0000	Fix for title formatting
181682e	0447bab	Fri Oct 10 13:29:38 2003 +0000	Fixes
1b804df	e8edc60	Fri Oct 10 12:23:43 2003 +0000	Fixed glitch in gapless mp4 decoding with certain broken files
2569c47	2cff3a9	Tue Oct 7 11:35:53 2003 +0000	small linux compile fix
800f550	7778db1	Tue Sep 30 16:32:02 2003 +0000	1 more DRM fix
bbdbf31	162e001	Tue Sep 30 08:07:47 2003 +0000	stdout output fixed small function definition fixes
162e001	635f1ed	Mon Sep 29 17:54:17 2003 +0000	Fixed SBR reporting for raw AAC
d6c4b45	6aabec8	Wed Sep 24 18:11:22 2003 +0000	Fixed seeking on ADIF AAC files, made ADTS AAC seeking sample accurate
b147e83	9a10dd1	Mon Sep 22 13:09:43 2003 +0000	small glitches fixed in hf generation
9a10dd1	f6620a7	Mon Sep 22 12:52:15 2003 +0000	*nux fixes
bfa3eb8	502d0c4	Fri Sep 19 19:08:17 2003 +0000	Fixes in linux compilation
812396b	df8d072	Thu Sep 18 13:38:38 2003 +0000	Fixes for implicit signalling of SBR
76aaa6d	edf72d4	Tue Sep 9 18:52:21 2003 +0000	fixed EOF detection on AAC files
edf72d4	0aa2ca7	Tue Sep 9 18:37:32 2003 +0000	wrong patches applied from Ahead CVS: fixed
d126dc6	18993a5	Mon Sep 8 17:02:05 2003 +0000	fixed encoder delay handling
70bde99	56bf3d8	Thu Sep 4 18:35:46 2003 +0000	case fix
56bf3d8	cbe4880	Thu Sep 4 17:43:40 2003 +0000	in_mp4: Gapless playback in_mp4: Title formatting fixed
6f3fe7e	e4b8748	Wed Sep 3 17:31:43 2003 +0000	bugfix: error when sbr data = NULL
7c218bd	1175ddf	Sun Aug 31 10:27:51 2003 +0000	foo_mp4 fix
1175ddf	3f32a17	Sun Aug 31 10:26:48 2003 +0000	fix in foo_mp4
3f32a17	ceeab11	Sun Aug 31 09:59:00 2003 +0000	bugfix: crash when continuing decoding after a broken frame
ceeab11	46302c5	Sat Aug 30 19:33:06 2003 +0000	foo_mp4 fixes
41017b7	3b4bd3b	Wed Aug 27 08:50:32 2003 +0000	small fix to configure script
3b4bd3b	c63edac	Sun Aug 17 19:36:54 2003 +0000	fixes
04891cb	fe8186b	Thu Aug 14 18:40:08 2003 +0000	fixed decoding length for foobar plugin
fe8186b	6c93b4f	Thu Aug 14 18:06:05 2003 +0000	small fix for stdout-put
6c93b4f	733421d	Wed Aug 13 19:54:13 2003 +0000	fixed temp file removal
4ac3f9d	6c3ec62	Thu Aug 7 17:31:19 2003 +0000	fix in tag reading
6c3ec62	9ebb171	Thu Aug 7 17:26:26 2003 +0000	fixed YEAR <-> DATE
6e78052	5866a7c	Sun Aug 3 18:00:15 2003 +0000	in_mp4: VBR display in_mp4: RAW AAC+SBR playback fixed
5866a7c	95192f0	Sun Aug 3 12:17:20 2003 +0000	fixed GENRE tag problem
87f85fd	e8a21ef	Sat Aug 2 23:08:17 2003 +0000	fixed for latest SDK fixed genre bug
00ca67b	c9472c6	Sat Aug 2 18:07:39 2003 +0000	fixed some stuff in the frontend removed dead code
49179da	4ec9a8f	Wed Jul 9 18:32:43 2003 +0000	fixed bug with mp4info
401e13e	4b42418	Wed Jul 9 12:33:08 2003 +0000	CCE fix foobar plugin: fixed tagging foobar plugin: windows compliant channel output order
e98a69b	9831e45	Mon Jul 7 21:11:18 2003 +0000	Added file playback (WIN32) with priority setting Coupling channels are now skipped Minor updates in frontend ADIF bugfix Small fixes
9831e45	13fb62b	Mon Jul 7 12:27:55 2003 +0000	fixed makefile
13fb62b	3254623	Mon Jul 7 09:48:31 2003 +0000	fixes in makefiles
728303a	b75f302	Wed Jul 2 15:12:01 2003 +0000	fix in winamp plugin
e7a86f9	db2d101	Tue Jun 24 20:41:41 2003 +0000	bugfixes
596df37	345a313	Thu Jun 19 21:30:13 2003 +0000	bugfix in mp4info()
345a313	e7a69a6	Thu Jun 19 21:20:59 2003 +0000	Fix in foo_mp4 plugin
e7a69a6	4f70299	Mon Jun 16 21:24:50 2003 +0000	Fixed problem with "use for AAC" option Seems that the Nullsoft plugin suffers from the same problem :)
5832cdb	e6a1e11	Sun Jun 8 21:47:10 2003 +0000	fixed makefile
c0bcb7e	3dbf360	Sun Jun 8 13:47:26 2003 +0000	fixed makefile (I hope)
2750dae	57f4d33	Sat May 31 13:18:05 2003 +0000	fixed some stuff in winamp plugin
57f4d33	edcf077	Thu May 29 19:56:50 2003 +0000	Fixed foobar ADIF support
edcf077	3ade1a7	Thu May 29 19:22:31 2003 +0000	Updates in in_mp4: - dithering option fixed - seeking in AAC ADTS files supported - faster file length calculation (and more accurate)
7931bb5	91aee39	Wed May 21 21:16:03 2003 +0000	fixed seeking past end of file
6a18eb7	1083f9c	Fri May 16 08:31:14 2003 +0000	More fixed point updates only problem now is clipping when using REAL_BITS=16
03339bb	b981e66	Mon Apr 28 10:16:03 2003 +0000	Fixed small problem with id3v2 in foobar plugin
b981e66	69f8ee6	Sun Apr 27 18:53:22 2003 +0000	full seeking support in foobar plugin error return problem fixed
a0ba9ba	d4dba8d	Wed Apr 2 19:09:49 2003 +0000	Little fix in HCR bitstream reading
2e85477	529d431	Tue Apr 1 16:34:35 2003 +0000	stability fixes and ARM fixed point optimisations
038d26c	03d2510	Thu Feb 27 11:37:26 2003 +0000	Fix in wave header writing
03d2510	0e2d830	Tue Feb 25 18:22:16 2003 +0000	Fixed aacDECdrop compilation
0e2d830	130c468	Tue Feb 25 18:15:59 2003 +0000	Fixed Winamp3 plugin compilation
31b537e	7c2d54e	Tue Feb 25 17:44:16 2003 +0000	Fix in function naming :)
7c2d54e	9052d1f	Tue Feb 25 12:03:52 2003 +0000	Fix in tag writing of strings > 128 characters
9052d1f	4dfc6c8	Tue Feb 25 10:51:24 2003 +0000	Fix in winamp3 plugin so that it uses faad.h from the include directory
4dfc6c8	2e34854	Mon Feb 24 15:02:25 2003 +0000	Fixes to bitstream
584e5f7	f33c4f4	Thu Feb 13 14:20:15 2003 +0000	fixed makefile
cdae0e7	1a31624	Thu Feb 6 20:26:44 2003 +0000	Fixed bug in wav header writing
877dfb8	b92e2e2	Tue Feb 4 16:49:38 2003 +0000	Bugfixes, NULL pointer checks...
b92e2e2	367d20b	Fri Jan 17 14:56:18 2003 +0000	Small bugfixes
367d20b	b5b68e5	Sun Jan 12 10:18:37 2003 +0000	Fixed linux compilation
b5b68e5	4c96445	Sun Dec 29 13:13:36 2002 +0000	replaygain stuff fixed for foobar
4c96445	82bc6cc	Sun Dec 29 12:26:30 2002 +0000	Some bugfixes in tagging. replaygain support
82bc6cc	4cebe67	Sun Dec 29 11:10:18 2002 +0000	Fixed tagging in foo_mp4
4cebe67	b3b26ef	Sun Dec 29 11:05:13 2002 +0000	Bugfix
8a8fa3b	cadbe96	Sun Dec 22 21:36:28 2002 +0000	SetThreadAffinity should fix SMP problems
cadbe96	58d9ce7	Sun Dec 22 20:19:24 2002 +0000	Bugfix in rvlc, buffer that was not allocated got deallocated
3020346	b2aec36	Wed Dec 11 11:36:13 2002 +0000	Fixes for frames without channel elements
b2aec36	46ee732	Wed Dec 11 09:52:57 2002 +0000	makefile fix
99a01ee	cd48b77	Tue Dec 10 14:53:15 2002 +0000	Various bugfixes Cleanup of syntax.c
f5944cb	9f3c31d	Thu Dec 5 19:28:22 2002 +0000	Linux and DRM fixes
44e7816	6e334f5	Mon Dec 2 20:28:04 2002 +0000	mono decoding bug some more ssr stuff
b8dedfd	31e91fd	Wed Oct 2 18:49:55 2002 +0000	Prevent out of bounds memory writing (fixes LTP)
31e91fd	a2a56b3	Tue Oct 1 21:55:49 2002 +0000	Fixed random number generator
e6651e5	69a466f	Tue Sep 24 09:23:55 2002 +0000	Fixed other than 16 bit decoding for MP4 files
69a466f	8328e13	Wed Sep 18 11:22:36 2002 +0000	Bitstream reading of ER LTP files fixed
8328e13	450fed9	Mon Sep 16 20:43:37 2002 +0000	RVLC fix for PNS scalefactors
450fed9	876a4ad	Mon Sep 16 11:07:04 2002 +0000	Fix in LTP decoding
876a4ad	b288039	Sun Sep 15 22:02:30 2002 +0000	Some LD table fixes
b288039	dea6224	Fri Sep 13 13:08:45 2002 +0000	Final fixed point updates
dea6224	b7b44ef	Sun Sep 8 18:14:37 2002 +0000	Some small bugfixes (linux compilation) Lot\'s of fixed point stuff
b7b44ef	6c85fee	Thu Sep 5 20:10:53 2002 +0000	Fixed fixed point decoding output now bit identical to floating point version
6c85fee	2976802	Wed Sep 4 10:22:18 2002 +0000	PNS fixed :-))
be3cdaf	9681f24	Wed Sep 4 09:17:42 2002 +0000	Fixed more PNS stuff
d7fd5cf	3655d4b	Fri Aug 30 19:03:48 2002 +0000	Fixes to PNS and more dynamic memory allocation
3655d4b	35a4728	Fri Aug 30 18:14:26 2002 +0000	Ouch, PNS bugfix for mono files
b9c91db	c5c3fc3	Fri Aug 30 12:10:57 2002 +0000	Bugfix in filterbank and dequantisation
c5c3fc3	4208c44	Tue Aug 27 18:16:12 2002 +0000	Fixed point LTP
4208c44	5a35863	Tue Aug 27 10:24:57 2002 +0000	Fixed point decoding working correctly now
fb9d1d2	da29a5e	Mon Aug 26 18:41:47 2002 +0000	Fixed inverting MDCT/iMDCT Fixed LTP Complete new filterbank code Complete new way of applying scalefactors and inverse quantisation Fixed index bug in MDCT Corrected object types in TNS Fixed point almost working
eb34683	449969d	Tue Aug 20 16:59:58 2002 +0000	Bugfix having to do with divide by 0, probably bug in Intel Math library???
7a97eae	c51b2bc	Sat Aug 17 12:27:33 2002 +0000	More preparations for fixed point
c51b2bc	fe4d662	Sat Aug 17 11:46:48 2002 +0000	Small updates in fft for fixed point
fccac30	3cccff7	Thu Aug 15 17:41:44 2002 +0000	Removed seeking to test if the buggy part has something to do with that
3cccff7	edf20d4	Thu Aug 15 17:32:51 2002 +0000	Fixed aacDECdrop
3192dd9	c6050d4	Wed Aug 14 17:55:49 2002 +0000	New info box for mp4 plugin mp4 plugin now supports seeking in aac files and info for aac files (seems a bit buggy)
f153d80	c5a305c	Wed Aug 7 14:34:31 2002 +0000	Final fix?
c5a305c	9a9fa10	Wed Aug 7 14:07:41 2002 +0000	fix for DRM
