fluent-bit-20230225-a3786b86c	a3786b86c	3e360f42f	Sat Feb 25 05:57:43 2023 -0600	slist: fix possible NULL derefence	commit a3786b86cfd630039d0119ee9fc9ef5870df9be6Author: David Korczynski <david@adalogics.com>Date:   Thu Feb 23 08:10:18 2023 -0800    slist: fix possible NULL derefence        flb_sds_create_len can fail and return NULL. This adds a safeguard to    ensure no NULL dereference happens if that's the case.        Fixes: https://bugs.chromium.org/p/oss-fuzz/issues/detail?id=56223        Signed-off-by: David Korczynski <david@adalogics.com>	56223	src/flb_slist.c	154
fluent-bit-20221206-fa7fd13c1	fa7fd13c1	0a0491d0e	Tue Dec 6 16:46:40 2022 -0600	tests: internal: fuzzers: fix offset	commit fa7fd13c1ffbae70dd089945a90d4045bc80f1d8Author: David Korczynski <david@adalogics.com>Date:   Mon Nov 28 02:21:45 2022 -0800    tests: internal: fuzzers: fix offset        Fixes: https://bugs.chromium.org/p/oss-fuzz/issues/detail?id=53103        Signed-off-by: David Korczynski <david@adalogics.com>	53103	tests/internal/fuzzers/ctrace_fuzzer.c	3
fluent-bit-20221202-5949473d5	5949473d5	1837c5a02	Fri Dec 2 22:24:27 2022 -0600	parser: fix overflow	commit 5949473d5ce9e3d56ae2e248cc3a82a13474aabdAuthor: David Korczynski <david@adalogics.com>Date:   Mon Nov 28 02:55:11 2022 -0800    parser: fix overflow        Fixes: https://bugs.chromium.org/p/oss-fuzz/issues/detail?id=52414        Signed-off-by: David Korczynski <david@adalogics.com>	52414	src/flb_parser.c	973;982
fluent-bit-20221011-a7eca37d3	a7eca37d3	b40a404f8	Tue Oct 11 11:04:02 2022 -0600	strptime: fix integer boundary	commit a7eca37d3aaa617a0cd34cb0dd0f7f3f25b0594cAuthor: David Korczynski <david@adalogics.com>Date:   Fri Oct 7 14:59:09 2022 +0100    strptime: fix integer boundary        The current boundary is wrong, this fixes it.        Fixes: https://bugs.chromium.org/p/oss-fuzz/issues/detail?id=51024        Signed-off-by: David Korczynski <david@adalogics.com>	51024	src/flb_strptime.c	721
fluent-bit-20220910-e2c524ba7	e2c524ba7	60c668c82	Sat Sep 10 06:53:08 2022 +0900	parser: fix double-free	commit e2c524ba7bf0487ba3df569cce8855cb753f084aAuthor: David Korczynski <david@adalogics.com>Date:   Fri Sep 9 14:40:14 2022 +0100    parser: fix double-free        It's not necessary to free tmp here as tmp is freed at fconf_error        Fixes: https://bugs.chromium.org/p/oss-fuzz/issues/detail?id=51132        Signed-off-by: David Korczynski <david@adalogics.com>	51132	src/flb_parser.c	753
fluent-bit-20220909-60c668c82	60c668c82	2ed2f3334	Fri Sep 9 14:00:19 2022 -0600	pack: fix read stack-buffer-overflow READ in msgpack_sbuffer_write (#5731)	commit 60c668c824a46a88e332c73737423043e2ded3faAuthor: Alex <93376818+sashashura@users.noreply.github.com>Date:   Fri Sep 9 22:00:19 2022 +0200    pack: fix read stack-buffer-overflow READ in msgpack_sbuffer_write (#5731)        * pack: Fix read Stack-buffer-overflow READ in msgpack_sbuffer_write        This PR fixes Stack-buffer-overflow in msgpack_sbuffer_write revealed by fuzzing:    https://bugs.chromium.org/p/oss-fuzz/issues/detail?id=45208        The root cause is that snprintf call in flb_pack_msgpack_to_json_format returns the number of characters that would have been written if the buffer had been sufficiently large.    It leads to reading out of the boundaries of the buffer later.        Signed-off-by: sashashura <aleksandrosansan@gmail.com>	45208	src/flb_pack.c	838;861;891;937
fluent-bit-20220902-49e3a0bc1	49e3a0bc1	29a8b88ae	Fri Sep 2 20:56:53 2022 -0600	strptime: fix signed overflow	commit 49e3a0bc16f33b91f5921887e211c59f867a7e74Author: David Korczynski <david@adalogics.com>Date:   Fri Sep 2 17:07:05 2022 +0100    strptime: fix signed overflow        Return 0 if signed integer overflows occur        Fixes: https://bugs.chromium.org/p/oss-fuzz/issues/detail?id=47092        Signed-off-by: David Korczynski <david@adalogics.com>	47092	src/flb_strptime.c	706
fluent-bit-20220902-98abed26d	98abed26d	d07c7c6db	Fri Sep 2 20:52:06 2022 -0600	tests: internal: fuzzers: fix index error	commit 98abed26d3ed76079a66a7c2735a19b0ac347b8eAuthor: David Korczynski <david@adalogics.com>Date:   Fri Sep 2 12:02:23 2022 +0100    tests: internal: fuzzers: fix index error        Fixes: https://bugs.chromium.org/p/oss-fuzz/issues/detail?id=45911        Signed-off-by: David Korczynski <david@adalogics.com>	45911	tests/internal/fuzzers/multiline_fuzzer.c	101
fluent-bit-20220901-b71a561cd	b71a561cd	0c5d8da6b	Thu Sep 1 17:18:28 2022 -0600	pack: fix oss-fuzz crashon tokens state (#5975)	commit b71a561cd2bf3cdc40335c0f4c701a5be070c8d3Author: Alex <93376818+sashashura@users.noreply.github.com>Date:   Fri Sep 2 01:18:28 2022 +0200    pack: fix oss-fuzz crashon tokens state (#5975)        https://bugs.chromium.org/p/oss-fuzz/issues/detail?id=45978        Signed-off-by: sashashura <93376818+sashashura@users.noreply.github.com>	45978	src/flb_pack.c	322;405
fluent-bit-20220819-74a21b176	74a21b176	676a26b24	Fri Aug 19 18:23:05 2022 -0600	pack: fix heap-double-free in flb_pack_state_reset (#5883)	commit 74a21b176cd941c39b10086ee9e0343a904f3178Author: Aleks L <93376818+sashashura@users.noreply.github.com>Date:   Sat Aug 20 01:23:05 2022 +0100    pack: fix heap-double-free in flb_pack_state_reset (#5883)        https://bugs.chromium.org/p/oss-fuzz/issues/detail?id=45978        Signed-off-by: Aleks L <93376818+sashashura@users.noreply.github.com>	45978	src/flb_pack.c	333
fluent-bit-20220706-639806ce3	639806ce3	51956949b	Wed Jul 6 11:57:50 2022 -0600	tests: internal: fuzzers: fix index error	commit 639806ce3eea2bf8fd4ce0e105989998adb8c207Author: David Korczynski <david@adalogics.com>Date:   Tue Jun 21 15:02:40 2022 +0100    tests: internal: fuzzers: fix index error        Fixes: https://bugs.chromium.org/p/oss-fuzz/issues/detail?id=45911        Signed-off-by: David Korczynski <david@adalogics.com>	45911	tests/internal/fuzzers/multiline_fuzzer.c	102
fluent-bit-20220706-51956949b	51956949b	c42079e63	Wed Jul 6 11:57:25 2022 -0600	record_accessor: fix possible null-deref (#5101)	commit 51956949b38e3388775450b621685414b4809afbAuthor: DavidKorczynski <david@adalogics.com>Date:   Wed Jul 6 18:57:25 2022 +0100    record_accessor: fix possible null-deref (#5101)        Check rp->key is set before dereferencing. This fixes:    https://bugs.chromium.org/p/oss-fuzz/issues/detail?id=45642        Signed-off-by: David Korczynski <david@adalogics.com>	45642	src/flb_record_accessor.c	422
fluent-bit-20220425-68ef2425f	68ef2425f	a654f84d5	Mon Apr 25 21:59:37 2022 -0600	output: fix potential NULL deref	commit 68ef2425fbfae416e8c7ac817b8bf9f19aa2da5cAuthor: David Korczynski <david@adalogics.com>Date:   Thu Mar 17 12:16:20 2022 +0000    output: fix potential NULL deref        Fixes https://bugs.chromium.org/p/oss-fuzz/issues/detail?id=45644        Signed-off-by: David Korczynski <david@adalogics.com>	45644	src/flb_output.c	1030
fluent-bit-20220425-26539ec7a	26539ec7a	b4a227710	Mon Apr 25 21:58:10 2022 -0600	parser: fix null dereference	commit 26539ec7ab239fa86877897b0ceede329e98cc88Author: David Korczynski <david@adalogics.com>Date:   Thu Mar 17 14:42:27 2022 +0000    parser: fix null dereference        Avooid calling strcmp with potential NULL. This fixes    https://bugs.chromium.org/p/oss-fuzz/issues/detail?id=45648        Signed-off-by: David Korczynski <david@adalogics.com>	45648	src/flb_parser.c	166
fluent-bit-20220221-228368152	228368152	3b50e7234	Mon Feb 21 20:56:56 2022 -0600	tests: internal: multiline: fix leak (#4885)	commit 2283681529fc1eadd7f7127e7bce9086b6f015ceAuthor: DavidKorczynski <david@adalogics.com>Date:   Tue Feb 22 02:56:56 2022 +0000    tests: internal: multiline: fix leak (#4885)        Ensure result is destroyed before returning. Fixes:    https://bugs.chromium.org/p/oss-fuzz/issues/detail?id=38362        Signed-off-by: David Korczynski <david@adalogics.com>	38362	src/multiline/flb_ml.c	498
fluent-bit-20220220-ce08fb9ea	ce08fb9ea	f8d806f20	Sun Feb 20 13:16:09 2022 -0600	config: fix memory leak	commit ce08fb9ea58c331cf2096e8048da57afd3ee1f8aAuthor: David Korczynski <david@adalogics.com>Date:   Fri Feb 18 23:56:42 2022 +0000    config: fix memory leak        Fixes https://bugs.chromium.org/p/oss-fuzz/issues/detail?id=42097        Signed-off-by: David Korczynski <david@adalogics.com>	42097	src/flb_config.c	440
fluent-bit-20210906-05144b2d9	05144b2d9	26c796fc6	Mon Sep 6 18:01:22 2021 -0600	tests: internal: fuzzers: fix issue in utils fuzzer	commit 05144b2d99a4d88db561d0329e4bd97453d466e1Author: David Korczynski <david@adalogics.com>Date:   Fri Sep 3 12:53:01 2021 +0100    tests: internal: fuzzers: fix issue in utils fuzzer        Fixes bug: https://bugs.chromium.org/p/oss-fuzz/issues/detail?id=36718        Signed-off-by: David Korczynski <david@adalogics.com>	36718	tests/internal/fuzzers/utils_fuzzer.c	142
fluent-bit-20210720-8d732092a	8d732092a	27a11aef6	Tue Jul 20 09:45:45 2021 -0600	signv4: fix NULL dereference	commit 8d732092a3e6179e5133d1ca2bf08007c7a5e493Author: David Korczynski <david@adalogics.com>Date:   Tue Jul 20 12:25:37 2021 +0100    signv4: fix NULL dereference        Fixes bug: https://bugs.chromium.org/p/oss-fuzz/issues/detail?id=31801        Signed-off-by: David Korczynski <david@adalogics.com>	31801	src/flb_signv4.c	357
