bfa2b74cb	ce047d8ee	Wed Jul 19 18:38:56 2023 +0100	trivial: Use a glib2 with the EPERM patch to fix CI
996507d63	64c41336c	Tue Jul 18 14:55:41 2023 +0100	trivial: Fix -Wtautological-type-limit-compare
fea86feed	c4ce17dc6	Sat Jul 15 20:33:19 2023 +0100	Fix the definitions of CFU force flags
fa5be9077	64dd2f84a	Sat Jul 15 09:39:40 2023 +0100	trivial: Fix one -Wsign-compare warning
64dd2f84a	1fbe2330d	Sat Jul 15 09:37:50 2023 +0100	trivial: Fix two -Wformat= warnings
1fbe2330d	92eb2a3f8	Sat Jul 15 07:44:49 2023 +0100	trivial: Fix a fuzzing timeout my limiting the HID descriptor table size
846d410c4	94ba1ab65	Thu Jul 13 16:31:22 2023 +0100	cfu: Fix a possible crash when adding modules
f9c94852f	3d6f243db	Thu Jul 13 16:31:22 2023 +0100	cfu: Fix a critical warning when loading CFU modules
36cd93ce7	44853cd11	Thu Jul 13 10:16:53 2023 +0100	trivial: Convert 0b literals to 0x to fix a warning in gi-docgen
47f190dcd	f072ee5e0	Mon Jul 10 12:51:18 2023 +0100	Add --no-security-fix to skip actions in \'fwupdmgr security\'
08a9e48d2	9193ac287	Mon Jul 10 07:58:10 2023 +0100	fpc: Remove the connection detail suffix from the name
9193ac287	94321470b	Mon Jul 10 07:58:10 2023 +0100	trivial: Fix an error prefix to be more true
4ffb8546d	3939851d4	Sun Jul 9 07:03:48 2023 +0100	trivial: Fix self test failure on s390x
996c223a0	87c0651c2	Sat Jul 8 09:10:49 2023 +0100	trivial: thunderbolt: Fix up the ->to_string() attr names
109c3e4ce	4bea9459b	Wed Jul 5 18:22:05 2023 +0100	trivial: Fix a possible resource leak spotted by Coverity
4fbae4197	9304b32dd	Wed Jul 5 14:10:36 2023 +0100	uefi-capsule: return failure on error, and style fixes
1c9c20735	45178295b	Wed Jul 5 14:01:36 2023 +0100	trivial: Fix a new -Wunused-variable
613a3e204	f3fa86a62	Mon Jul 3 16:47:39 2023 +0100	trivial: fpc: Fix the ->to_string() output
d8fd3b592	b8cbe429a	Mon Jul 3 16:47:39 2023 +0100	trivial: Fix a small memory leak when using firmware-parse auto
7246970e1	f3d0071a2	Mon Jul 3 16:47:39 2023 +0100	Fix parsing of IGSC code firmware
a11907e7d	cd878ba1a	Sat Jul 1 16:49:30 2023 +0100	trivial: Fix introspection data for fu_context_get_firmware_gtype_ids()
156e2f2e8	b96f5fdc4	Fri Jun 30 09:07:16 2023 +0100	genesys: Fix a trivial problem spotted by PVS
826010f53	02132356c	Wed Jun 28 15:45:56 2023 +0100	trivial: Fix a crash when calling fu_firmware_set_bytes() with the current GBytes
2f0416684	d1e2903b1	Mon Jun 26 17:07:36 2023 +0100	trivial: Fix ossfuzz CI
57cd2e878	3158f56ab	Mon Jun 26 12:01:00 2023 +0100	trivial: Fix one -Wunused-variable warning
3158f56ab	3e63b6c6c	Mon Jun 26 11:22:39 2023 +0100	Fix oss-fuzz by providing a dummy efivar implementation
674d4cac7	bf4e8fd03	Mon Jun 26 09:57:11 2023 +0100	wacom-usb: Fix a emulation failure on s390x
b91ad4217	b4699736e	Sat Jun 24 15:33:24 2023 +0100	trivial: Fix a fuzzing crash when parsing crazy EFI loadopts
8e6235859	2c018a13f	Thu Jun 22 11:55:16 2023 +0100	Fix quirks for TUXEDO InfinityBook S 14/15 Gen6 devices
753b32b7f	ed0149678	Fri Jun 16 13:28:36 2023 +0100	uefi-dbx: Fix a debug statement to not be confusing
1225bb4c2	b4d05a8ed	Mon Jun 12 12:22:03 2023 +0100	wacom-usb: Do not truncate feature reports to fix ID6 update
782397cae	aa03040ba	Tue Jun 6 14:07:40 2023 +0100	bcm57xx: Fix the firmware size for the Lenovo branded BCM5719
f114f09cf	b59aa3a34	Tue Jun 6 12:36:41 2023 +0100	usi-dock: Fix devices with an old firmware version
95ea4ed25	93e85495b	Tue Jun 6 11:47:08 2023 +0100	ccgx-dmc: Fix a potential segfaul when updating
5d2449993	4e4902025	Tue Jun 6 11:03:51 2023 +0100	genesys: Fix a fuzzing crash in the writer
f1464cb79	31b9b3e4a	Tue Jun 6 10:02:34 2023 +0100	trivial: Fix genesys fuzzer
d4060d6c8	088deff03	Tue Jun 6 11:34:53 2023 +0300	trivial: ccgx: debug print silicon ID if detected
5f3079c8a	f54756f27	Tue Jun 6 05:46:56 2023 +0100	Fix high memory usage when writing a carefully crafted EFI filesystem
f54756f27	579fa81cc	Fri Jun 2 14:46:23 2023 +0100	plugins: nordic-hid: Fix discovery of peripherals connected via dongle
831402cb9	a945c5495	Wed May 24 13:49:08 2023 +0100	logitech-hidpp: Complete the HidPp to Hidpp rename to fix the unifying update
ee3bcb194	7cb42cc75	Tue May 23 11:11:28 2023 +0100	trivial: Fix oss-fuzz
4d7e9e86c	ed1b2bce8	Tue May 23 09:23:37 2023 +0100	trivial: Fix the rustgen docs in two places
f36643568	ac09f5c14	Tue May 16 20:15:42 2023 +0100	trivial: Fix a meson warning
412020347	a1ab17f66	Mon May 15 17:56:09 2023 +0100	synaptics-cxaudio: Fix a GError misusage detected using Tartan
a1ab17f66	18519e655	Mon May 15 17:56:09 2023 +0100	tmp: Fix a posisble crash detected using Tartan
c84de8322	60b9552e1	Mon May 15 12:50:21 2023 +0100	trivial: Do not use \'const gpointer\' to fix clang-tidy misc-misplaced-const
bba42d3a1	a133dfa76	Mon May 15 09:04:06 2023 +0100	Fix fwupd.conf(5) man page to use [fwupd] section
6a6fc76d9	d482526b0	Wed May 10 19:00:53 2023 +0100	uefi-dbx: Match the dbx version-lowest even if the version gets fixed-up
3e6253430	7c7ff563d	Tue May 9 21:13:53 2023 +0100	Add the latest dbx fixups for BlackLotus
7c7ff563d	068e4ebe5	Sun May 7 12:45:23 2023 +0100	trivial: Fix critical warning with \'fwupdtool get-remotes\'
9c82fc14d	725bc5fd9	Sun May 7 11:37:07 2023 +0300	steelseries: fix the version detection for Bluetooth mode
a5aec6c90	2ffb1ca9d	Wed May 3 16:23:16 2023 +0100	trivial: Fix another -Wunused-variable
43ae03a6d	dbbf55ec7	Tue May 2 11:32:59 2023 +0100	trivial: Fix a few daemon.conf -> fwupd.conf replacements
b78ed229a	6e0947b26	Sat Apr 29 12:46:21 2023 +0100	Fix the depsolver to promote from the other direction correctly
becd998ce	52ac1886a	Fri Apr 28 21:03:47 2023 +0100	logitech-tap: trivial style fixes
1ef86e466	0fccf190f	Fri Apr 28 09:15:24 2023 +0100	trivial: Fix one -Wunused-variable warning
8583fcf30	ac5d70ba5	Thu Apr 27 12:57:23 2023 +0100	trivial: Fix rustgen printing of structs using -vv
aacbcd04b	3766adb83	Mon Apr 24 08:57:26 2023 +0100	trivial: Fix oss-fuzz to include jinja2
822822e3c	c1779ac48	Mon Apr 24 08:38:48 2023 +0100	pci-mei: Fix a crash by using FuStruct to convert enums to strings
a820bf077	a419a84ab	Thu Apr 20 16:39:03 2023 +0100	trivial: Fix some style nits
bc2ef31e5	3f6f5fca9	Thu Apr 20 16:25:27 2023 +0100	trivial: Fix recently introduced tiny memory leak
3f6f5fca9	cb05b3990	Thu Apr 20 16:16:04 2023 +0100	trivial: Fix ModifyConfig not accessible
cb05b3990	cfe3697da	Thu Apr 20 13:59:45 2023 +0100	trivial: Fix a missing error check
cfe3697da	ff9465982	Thu Apr 20 12:17:12 2023 +0100	mtd: Fix trivial critical warning when registering the quirk keys
63523d110	9dd55e53a	Mon Apr 17 17:45:24 2023 +0100	trivial: Use g_object_new() in the fuzzers to fix CI
9dd55e53a	a179d7316	Mon Apr 17 17:45:24 2023 +0100	trivial: Fix a -Wunused-variable spotted by clang
a179d7316	0c47fdf4a	Mon Apr 17 17:03:35 2023 +0100	trivial: contrib/pcap2emulation: Fix supplementary phase file format
42d049634	664fd0098	Mon Apr 17 12:37:02 2023 +0100	trivial: Fix a critical warning when exiting the daemon
d4c525786	5b4919e7c	Fri Apr 14 17:05:12 2023 +0100	contrib/pcap2emulation: Fix \'usb_port\' referenced before assignment
302dbee88	f888ab9b9	Wed Apr 12 11:11:08 2023 +0100	fix uefi-capsule build with compat_cli enabled
83dfea61b	681ea1dd3	Wed Apr 5 16:04:53 2023 +0100	trivial: Add some guidance on what debug levels to use
7b56b9433	f142f6933	Wed Apr 5 16:03:33 2023 +0100	Reduce the amount of debugging when using --plugins
d5e9756fb	fcf5c7cdd	Wed Apr 5 15:31:27 2023 +0100	trivial: Improve some debugging
4bcbcade2	c96f3cbb5	Wed Apr 5 06:56:06 2023 -0500	trivial: Include the fwupd *version* in the debugging output
c96f3cbb5	c218cdd79	Wed Apr 5 08:45:31 2023 +0100	steelseries: Fix the CounterpartGuid for the Aerox 3 Wireless Mouse
c218cdd79	282d0d42f	Mon Apr 3 22:50:46 2023 +0100	trivial: Fix oss-fuzz
98d59fcd1	dc7f79f58	Fri Mar 31 12:07:05 2023 -0500	Fix the continuous integration status in the README
43ed36f9d	dde0a2b0c	Thu Mar 30 22:04:53 2023 +0100	trivial: Fix \'fwupdmgr install FILE GUID\'
0c196b62b	e8343394a	Thu Mar 30 16:25:45 2023 +0100	trivial: Fix a critical warning when fuzzing EFI volumes
e8343394a	e88f4e1f4	Thu Mar 30 11:09:58 2023 +0100	uefi-capsule: Fix possible crash when getting UEFI report metadata
e88f4e1f4	96d5f05db	Wed Mar 29 20:56:28 2023 +0100	trivial: Fix oss-fuzz CI target, harder
96d5f05db	3d7d5dca6	Wed Mar 29 20:46:04 2023 +0100	trivial: Fix oss-fuzz CI target
bd577fb05	3fbcf3507	Tue Mar 28 12:15:12 2023 -0500	trivial: Fix test failures when compiling without sqlite
3fbcf3507	94023316e	Tue Mar 28 12:15:12 2023 -0500	trivial: Fix test failures when compiling without libarchive
94023316e	58e312d41	Tue Mar 28 12:15:12 2023 -0500	trivial: Fix test failures when compiling without polkit
58e312d41	6f7639851	Tue Mar 28 12:15:12 2023 -0500	trivial: Fix compile warnings when compiling without libgusb
6f7639851	dca81f511	Tue Mar 28 12:15:12 2023 -0500	trivial: Do not use \'build\' as a prefix for the OpenBMC helper
dca81f511	3ff7c44f6	Tue Mar 28 10:22:19 2023 +0100	trivial: Fix compile time meson warning \'c_args defined multiple times\'
ea1bbe70d	00581c50b	Mon Mar 27 20:20:24 2023 +0100	trivial: Fix a tiny memory leak in the thunderbolt self tests
00581c50b	519003bc6	Mon Mar 27 20:20:05 2023 +0100	trivial: Fix a tiny memory leak spotted by Coverity
519003bc6	b2a083d88	Mon Mar 27 20:20:05 2023 +0100	trivial: Fix a -Wformat-literal string warning
b2a083d88	05e68e3f0	Mon Mar 27 20:20:05 2023 +0100	trivial: Be more careful when using g_str_has_suffix()
05e68e3f0	d08cb76ce	Mon Mar 27 14:51:52 2023 +0100	trivial: Fix capacity of GD25Q127C
d08cb76ce	1b30eebe8	Mon Mar 27 14:51:42 2023 +0100	trivial: Fix a wacom-usb fuzzing warning
8c297add9	0eec0c4a6	Mon Mar 27 11:12:16 2023 +0100	trivial: Fix protocol value in CH341a docs
0eec0c4a6	3977436de	Mon Mar 27 10:19:54 2023 +0100	trivial: Fix tiny memory leak when getting the ESP
b060f4e9a	70474ccc9	Fri Mar 24 11:31:59 2023 +0000	synaptics-cape: Fix regression where the timeout for INTR was made much smaller
cb9f823b8	e2678279e	Wed Mar 22 17:23:26 2023 +0000	wacom-usb: Fix flashing the new Intuos BT S
e2678279e	c2c073ca7	Tue Mar 21 13:43:42 2023 +0000	trivial: Fix compiling with *old* versions of libqmi
c2c073ca7	a4f2cc952	Tue Mar 21 13:08:35 2023 +0000	modem-manager: Fix a -Wdeprecated-declarations warning when using new libqmi versions
a4f2cc952	c1fb031cc	Tue Mar 21 12:47:23 2023 +0000	trivial: Fix -Wunused-result when using new libcbor versions
556cd3568	c089d8566	Tue Mar 21 11:16:53 2023 +0000	trivial: Fix a harmless memory leak in the redfish self tests
f80ac8b3b	d96d5c286	Mon Mar 20 13:40:14 2023 +0000	trivial: Fix format typo in 918d06fe20e0942230d2c5b2c31680625731956b
d96d5c286	6731355eb	Mon Mar 20 13:39:49 2023 +0000	mtd: Fix the name of the Intel SPI controller
609e1e9b4	0d503e203	Sat Mar 18 22:34:13 2023 +0000	wacom-usb: Use fu_device_retry_full() to get better debugging details
c2a3d01ff	aeac82c50	Sat Mar 18 22:32:35 2023 +0000	trivial: Fix a tiny memory leak when using get-report-metadata
df2da44f9	918d06fe2	Sat Mar 18 20:16:07 2023 +0000	Add the latest dbx version version fixups
918d06fe2	3d9413d8a	Sat Mar 18 20:15:18 2023 +0000	ccgx: Improve some logging to debug a invalid fwct analysis failure
3d9413d8a	f694e27a7	Sat Mar 18 20:15:18 2023 +0000	ccgx: Fix the \'usbfs: process did not claim interface 1 before use\' warning
f694e27a7	abb7898d8	Sat Mar 18 20:15:18 2023 +0000	ccgx: Use better string labels in the debug log
eaa10f157	76ba3f0c2	Sat Mar 18 12:56:25 2023 -0500	Fix the defines for HFSTS6 enforcement policy
44d30e26c	a6e7d8ebd	Fri Mar 10 09:49:44 2023 +0000	trivial: Fix Fedora 36 build
2ddf95479	b09797479	Thu Mar 9 17:41:10 2023 +0000	qubes: Fix capturing stdout in tests
b09797479	2c0323b78	Thu Mar 9 17:41:10 2023 +0000	qubes: Fix tests after dropping sys-usb support
c7908079e	2682a6a32	Thu Mar 9 17:41:10 2023 +0000	qubes: fix update archive handling
e05ff8e10	75b2b44d7	Wed Mar 8 19:54:14 2023 +0000	trivial: Fix a -Wunused-variable warning
75b2b44d7	a4e61cd0b	Wed Mar 8 08:10:18 2023 +0000	trivial: Cast to the correct GType when debugging
7e502cf7d	f37d1e834	Mon Mar 6 16:56:05 2023 +0000	Fix a critical warning when parsing an empty kernel cmdline
d0a6f2418	eea6a0500	Tue Feb 28 14:55:29 2023 +0000	Fix a critical warning when parsing invalid metadata
37f09e409	88d4227ea	Thu Feb 23 15:43:55 2023 +0000	Fix a small memory leak when refreshing metadata
fda087e53	d4796439f	Thu Feb 23 15:43:55 2023 +0000	trivial: Fix a small memory leak for old libxmlb versions
d4796439f	584db3a06	Thu Feb 23 15:43:55 2023 +0000	trivial: Fix compile failure with an old libjat version
a754f93ff	221da635f	Wed Feb 22 21:37:45 2023 +0000	Fix a critical warning when parsing an empty kernel cmdline
5a4229fce	7b5b56a1a	Tue Feb 21 09:13:28 2023 -0600	Allow enabling low-level debugging of fwupdx64.efi from uefi_capsule.conf
9407c5680	02e665b84	Fri Feb 17 16:44:09 2023 +0000	trivial: fix overwriting errors for existence of shim fixes: #5545
30ed9ced2	a5dd40690	Fri Feb 17 12:57:46 2023 +0000	trivial: fix typo
9ec39636e	11cd52f58	Wed Feb 15 20:14:12 2023 +0000	trivial: Fix -Wunused-variable with old GUsb versions
73d1b47e1	caaeb1ea1	Wed Feb 15 17:16:28 2023 +0000	trivial: Fix newline when asking for confirmation
b1556dc04	474b520e9	Wed Feb 15 15:46:36 2023 +0000	Fix -Dbuild=library target
23ae0b115	a52879312	Tue Feb 14 09:27:11 2023 +0000	trivial: Fix critical warning when using fwupdtool export-hwids
64ebbd2f9	382759f78	Mon Feb 13 16:13:10 2023 +0000	trivial: Fix the gtk-doc header to reflect reality
06c95b22a	828dc5a7b	Mon Feb 13 12:34:46 2023 +0000	trivial: Fix warning: function has a definition with different parameter names
828dc5a7b	3b53fde5b	Mon Feb 13 12:34:46 2023 +0000	trivial: Fix warning: return after continue
3b53fde5b	8290e4d1e	Mon Feb 13 12:34:46 2023 +0000	trivial: Fix warning: parameter is const-qualified in the function declaration
8290e4d1e	2950f5fa3	Mon Feb 13 12:34:46 2023 +0000	trivial: Fix warning: declared with a const-qualified typedef
2950f5fa3	5dbc91e76	Mon Feb 13 12:34:46 2023 +0000	trivial: Fix warning: pointer parameter \'buf\' can be pointer to const
5dbc91e76	2336f6a34	Mon Feb 13 12:34:46 2023 +0000	trivial: Fix warning: repeated branch in conditional chain
2336f6a34	d1b99ed5f	Mon Feb 13 12:34:46 2023 +0000	trivial: Fix warning: do not use \'else\' after \'return\'
d1b99ed5f	296fc0c0e	Mon Feb 13 12:34:46 2023 +0000	trivial: Fix warning: redundant return statement at the end of a function with a void return type
ca564bbc5	e4ce1c4d1	Mon Feb 13 12:34:46 2023 +0000	trivial: Fix a typo that was missed in review
ae80ba6d1	d911ca60c	Fri Feb 10 13:11:25 2023 +0000	Fix SMBIOS struct parsing when there are three NULs in a row
910f58d9c	eff7bfed8	Fri Feb 10 11:02:34 2023 +0000	cros-ec: Fix an uninitialized buffer warning from valgrind
390796c0d	fb4e8446c	Fri Feb 10 10:52:09 2023 +0000	ti-tps6598x: Fix a small memory leak when flashing new firmware
d621511c3	101f72537	Wed Feb 8 08:58:40 2023 +0000	Fix fwupdtool firmware-convert to work with image-less formats
70417a3ae	9b75eb9e3	Tue Feb 7 11:24:03 2023 +0000	wistron-dock: Fix critical warning during update
d4109b9f7	7116ff94c	Tue Feb 7 11:00:53 2023 +0000	trivial: Fix Fedora CI when it cannot autostart udisks
986b811b3	255ca3d51	Mon Feb 6 10:24:03 2023 +0000	trivial: Fix a tiny coverity-spotted memory leak on error
f3bf12dd1	c6a3a6e82	Fri Feb 3 17:25:03 2023 +0000	trivial: Fix fu-self-test with libgusb from the main branch
c6a3a6e82	d2082a5f3	Fri Feb 3 16:53:48 2023 +0000	trivial: Fix critical warning when loading an emulated DFU device
d2082a5f3	2eb4357a7	Fri Feb 3 15:43:04 2023 +0000	Revert "trivial: Fix clang-format of JSON files for newer versions of clang"
2eb4357a7	b3343755a	Fri Feb 3 14:28:44 2023 +0000	trivial: Fix clang-format of JSON files for newer versions of clang
df2569f2c	d70358041	Wed Feb 1 20:44:56 2023 -0600	snap: Fix a meson parameter
8ed6a52ca	e3197cc71	Wed Feb 1 16:42:51 2023 +0000	trivial: Enable USB debugging when backend debugging is enabled
c5b81559e	32d6c7f8d	Mon Jan 30 15:12:06 2023 +0000	trivial: Remove some dead comments left in after debugging
d6bb00a47	b9da5362a	Mon Jan 30 14:19:59 2023 +0000	trivial: Update all fixes using markdownlint
b9da5362a	00e8aaefc	Mon Jan 30 14:19:59 2023 +0000	trivial: Update all fixes using codespell
00ec2d8c2	965a7c64d	Thu Jan 26 14:04:01 2023 +0000	trivial: Fix critical warning in future code
854bec2e1	d26c84777	Thu Jan 26 08:55:49 2023 +0000	colorhug: Show the flash success value in debugging
3ab4e386c	af5fb429c	Wed Jan 25 12:09:29 2023 +0000	Fix hotplug events when emulating devices
ddd514083	575871f50	Tue Jan 24 15:41:01 2023 +0000	trivial: Fix tests to include \'emulated\'
3824af475	bda113829	Mon Jan 23 17:16:57 2023 +0000	trivial: Fix fuzzing with libxmlb from main, harder
62eafd6c4	53597cf04	Mon Jan 23 16:46:13 2023 +0000	trivial: Fix fuzzing with libxmlb from main
5e64c883b	ff46480ad	Mon Jan 23 13:19:53 2023 +0000	trivial: Fix build fix when using ppc64le system
fd08eaefe	5d6cb83d1	Sun Jan 22 08:29:20 2023 +0000	trivial: Fix bitwise operators in last commit
433d138a2	60783fa0d	Sat Jan 21 13:32:53 2023 +0000	Show some debugging when we ignore a release due to missing checksums
189686368	c647d0d0f	Wed Jan 18 19:36:45 2023 -0600	wacom-usb: prefix errors that occur when writing to the device
17156f13d	84217074b	Fri Jan 13 15:43:39 2023 +0000	trivial: Fix the progress steps when dumping firmware
bd306179f	91bf84f7a	Tue Jan 10 22:26:52 2023 +0000	Fix installing with -Doffline=false
17d92d96b	8d365e84d	Tue Jan 10 12:33:05 2023 -0600	trivial: clarify documentation on PSP security processor (Fixes: #5394)
2c20ade1d	1ca3cdd4d	Mon Jan 9 15:39:36 2023 +0000	emmc: Add back a legacy GUID to fix a regression
7b6770061	e73f7d019	Wed Jan 4 16:16:20 2023 +0000	trivial: fix error message on reading IA32_TME_ACTIVATION
6c18cc0f6	42b29d076	Wed Jan 4 07:24:01 2023 -0600	mtd: Use dummy SMBIOS data to fix self test on s390x
02d17592b	67deecde3	Thu Dec 29 15:49:02 2022 +0000	Fix deprecated meson commands
67deecde3	de5b2adaa	Thu Dec 29 13:57:31 2022 +0000	Lots of spelling fixes
63f403832	fbf4d3753	Thu Dec 15 17:27:22 2022 +0000	Fix some trivial null-correctness spotted by Tartan
4fc8685ca	a7c199bb5	Thu Dec 15 17:27:22 2022 +0000	synaptics-cape: Prefix the GError correctly
a7c199bb5	b9837e414	Thu Dec 15 17:27:22 2022 +0000	elantp: Prefix the GError correctly
23cc1ba49	9f8f08e6b	Thu Dec 15 17:27:22 2022 +0000	trivial: Fix reading from garbage when getting the pending reboot
5bbcd8703	f3a541bf9	Thu Dec 15 17:27:22 2022 +0000	trivial: Fix an impossible-to-hit read of undefined data
2c5ee0734	87ffda474	Thu Dec 15 16:41:55 2022 +0000	trivial: Fix debugging with FU_HID_DEVICE_VERBOSE
153b56686	790b9023f	Thu Dec 15 08:02:17 2022 +0000	Fix the regression to find all device GUID
7a4fa63d0	2fcb6bd08	Wed Dec 14 14:43:52 2022 +0000	Add a \'get-report-metadata\' command to allow debugging metadata collection
02e3549f1	41314f3b3	Wed Dec 14 14:12:17 2022 +0000	trivial: Fix build failure when /var/cache/fwupd is not writable
9c989190d	4ef885461	Wed Dec 14 09:51:22 2022 +0000	trivial: Fix a recently introduced -Wunused-variable
882a7eec8	0d0ffa470	Tue Dec 13 13:47:35 2022 +0000	trivial: Fix warning when running fwupdtool --version
18dac1885	ef6c399a6	Mon Dec 12 17:29:17 2022 +0000	Fix a tiny memory leak when parsing signed reports
ef6c399a6	f3fdb7f6a	Mon Dec 12 17:29:17 2022 +0000	Fix a tiny memory leak when probing MEI devices
1d69bec34	308068e73	Sat Dec 10 14:42:30 2022 +0000	trivial: Fix up a plugin method name
308068e73	85a168206	Fri Dec 9 07:53:33 2022 -0600	trivial: fix autopkgtest failure
85a168206	45662477f	Thu Dec 8 14:18:47 2022 -0600	trivial: uefi-capsule: decrease warning about missing header to debug
45662477f	7fa569f87	Thu Dec 8 09:17:00 2022 -0600	Don\'t suggest iommu=pt to people (Fixes: #5304)
ba14cff47	d74a4704c	Tue Dec 6 14:43:33 2022 +0000	trivial: Fix a gtk-doc introspection warning
d74a4704c	9485e898c	Tue Dec 6 14:41:24 2022 +0000	intel-gsc: Make the code match the comment to fix upgrading on real hardware
324c1b859	123fac737	Thu Dec 1 14:29:04 2022 +0000	trivial: Fix fuzzers
123fac737	ad930b8d1	Wed Nov 30 10:13:19 2022 +0000	trivial: Fix some g_prefix_error() calls to include the trailing space
49fa741fc	63903c82d	Tue Nov 29 09:03:08 2022 +0000	trivial: contrib/qubes: fix AttributeError and ImportError
e02a094ca	fd7bec2e2	Sat Nov 19 12:59:30 2022 +0000	trivial: Fix memory leak when incorporating FuMeiDevice
fd7bec2e2	5b44de228	Sat Nov 19 12:59:30 2022 +0000	trivial: Fix a tiny leak when translating the security attr
a66c4ccbd	8e32b6a35	Fri Nov 18 08:03:54 2022 +0000	synaptics-rmi: Fix the issue when updating non-secure devices
14ef2d17c	f44518158	Thu Nov 10 12:22:45 2022 +0000	trivial: Fix the tests on s390x
f44518158	73a63b89a	Thu Nov 10 12:10:41 2022 +0000	dfu-csr: Fix a critical warning when deploying firmware
73a63b89a	159f7883d	Wed Nov 9 16:41:10 2022 +0000	trivial: Fix lvfs-testing remote file
72a84c597	f38576224	Wed Nov 9 14:02:39 2022 +0000	trivial: Fix capsule image generation for broken locales
f38576224	f93f5ebff	Tue Nov 8 14:46:05 2022 +0000	igsc: Fix README.md
44f816e1c	6bc1ecd61	Thu Nov 3 23:51:00 2022 -0500	trivial: Fix invalid self test loop
05e75fd87	f4637db93	Thu Nov 3 18:18:34 2022 +0000	analogix: Fix potential division by zero when writing
09eb3fc7f	da6928fe7	Wed Nov 2 15:01:23 2022 +0000	Fix a regression when using fwuptool install-blob with FMAP firmware
064da7091	2b64a41dd	Tue Nov 1 16:23:17 2022 +0000	trivial: Fix docs warning for fu_udev_device_find_usb_device()
ae99b57b2	ee0365220	Tue Nov 1 16:19:27 2022 +0000	trivial: Fix over-constification in fu_udev_device_get_siblings_with_subsystem()
b50b67107	93466bd7c	Thu Oct 27 15:29:32 2022 +0100	Add fu_progress_to_string() to make debugging easier
aeb7dfe6b	577a512ce	Thu Oct 27 15:21:18 2022 +0100	trivial: Fix a -Wunused-variable compile warning
577a512ce	41c434ec2	Thu Oct 27 14:49:55 2022 +0100	trivial: Fix the dell self tests with the new GUsb installed
507b38dea	01fe8bdcb	Wed Oct 26 09:41:33 2022 -0500	trivial: fix a host security event message
0bf5afaa9	33347866d	Tue Oct 25 10:46:29 2022 -0500	dell: Fix the GError setting when querying for a TPM
e8eaca005	7c4398615	Tue Oct 25 15:39:30 2022 +0100	Save the ONLY_QUIRK instance IDs to fix incorporation of i2c
749eb4985	8eca325ae	Mon Oct 24 13:58:00 2022 +0100	dell: Fix plugin startup
6f129a97d	21dfea650	Wed Oct 19 12:50:12 2022 +0100	Fix a compile failure when compiling without efiboot
ef04d0578	d25d4f124	Thu Oct 13 18:34:00 2022 +0100	trivial: Fix a critical warning when using old kernel versions
b922ba1bb	95e014a84	Wed Oct 12 10:42:19 2022 -0500	trivial: snap: add libpcre.so.3 into snap package (Fixes: #4195)
6e715143f	652bd6510	Wed Oct 12 09:00:37 2022 -0500	trivial: snap: ci: try to fix deploy to store
abb279fcb	4abbf13be	Wed Oct 12 08:11:19 2022 -0500	trivial: fix deploy string
598e31ded	9475a849e	Mon Oct 10 11:29:30 2022 -0500	trivial: snap: move fix-bash-completion step into build step
9fe9d7d7c	a92a33f52	Sun Oct 9 20:33:19 2022 +0100	Fix millisecond formatting
0110a3ebd	b244057d4	Fri Oct 7 16:24:55 2022 +0100	Fix a regression when getting the i2c bus number
4e7f04b83	41973568a	Fri Oct 7 16:24:55 2022 +0100	parade-lspcon: Fix a small memory leak when reloading the device
2fef67db3	a01379f83	Fri Oct 7 14:52:31 2022 +0100	trivial: Fix writing uSWIDv2 payloads
617137922	017cdb78d	Fri Oct 7 14:41:48 2022 +0100	Add some more profiling to debug custom device GType creation
017cdb78d	c87cbf835	Fri Oct 7 08:04:06 2022 -0500	trivial: Fix the self tests when building with -Dgusb=disabled
c87cbf835	3043c1d68	Fri Oct 7 08:04:06 2022 -0500	modem-manager: Fix building with -Dgusb=disabled
3043c1d68	96e832bd0	Fri Oct 7 08:04:06 2022 -0500	ccgx: Fix building with -Dgusb=disabled
f579c0322	ac2763887	Thu Oct 6 12:44:36 2022 +0100	trivial: Only show the DS20 debug output when debugging
3f6f35d8c	1b6438e8f	Wed Oct 5 12:46:04 2022 +0100	trivial: Fix two more plugin names
1f8d3b61b	b21d29d98	Mon Oct 3 09:34:20 2022 +0100	linux-tainted: Fix a daemon warning if the daemon has disabled the plugin
842f32b20	a484eb769	Fri Sep 30 12:28:20 2022 +0100	trivial: Fix a few more plugin names
56adf2473	23747cccb	Thu Sep 29 15:59:33 2022 -0500	trivial: debian: fix building fwupd-tests package
23747cccb	999d2368b	Thu Sep 29 11:04:38 2022 -0500	trivial: fix dfu-tool linking
cdbc6b526	ae70c210c	Thu Sep 29 15:32:30 2022 +0100	Fix installing the dbx update when not using fwupdtool --force
b50ef90aa	34486b90e	Fri Sep 23 16:39:21 2022 +0100	trivial: Fix up some internal docs to reflect reality
7be0c033a	b7ac4b407	Fri Sep 23 07:52:39 2022 -0500	trivial: skip self tests for fwupd_client_remotes_func if G_DBUS_ERROR_NAME_HAS_NO_OWNER Fixes: #5073
b7ac4b407	34dfa8689	Thu Sep 22 21:52:50 2022 -0500	trivial: fix docs deployment
34dfa8689	5c284e911	Thu Sep 22 13:11:42 2022 -0500	trivial: restore libcurl support in snap (Fixes: #5069)
5fbc21a53	ec493527c	Thu Sep 22 17:31:42 2022 +0100	trivial: Fix the example spec file on i686
ec493527c	49af1667b	Thu Sep 22 16:54:26 2022 +0100	trivial: Fix the Pre-boot DMA protection HSI long description
be2311c6c	5d38e0aee	Thu Sep 22 14:34:10 2022 +0100	trivial: Fix gtk-doc markup issue
d4c589cc0	2d2bde226	Thu Sep 22 14:24:50 2022 +0100	trivial: Fix -Wunused-variable warning
2d2bde226	b71968d34	Thu Sep 22 14:24:50 2022 +0100	trivial: Fix -Wunused-but-set-variable warning
b71968d34	7fd8aa6a3	Thu Sep 22 14:24:50 2022 +0100	trivial: Fix -Wunused-but-set-variable warning
096364199	64cf323e5	Wed Sep 21 12:59:44 2022 +0100	trivial: Fix self tests when using -Dgresource_quirks=enabled
64cf323e5	28fc1a513	Wed Sep 21 07:29:33 2022 +0100	wacom-raw: Fix maximum szie for AES panels
e9964a0f9	9df226ca0	Tue Sep 20 16:05:13 2022 +0100	trivial: Fix compile when using python 3.7 or older
0d60fa319	fe5d93f7d	Tue Sep 20 10:16:55 2022 +0100	trivial: Fix two gi-docgen issues
