Gdal-20180218-d8109cdf87	d8109cdf87	cbd6969d4c	Sun Feb 18 18:30:39 2018 +0000	MVT: avoid potential divide by zero. Fixes https://bugs.chromium.org/p/oss-fuzz/issues/detail?id=6445. Credit to OSS Fuzz	commit d8109cdf87f4fc11fd1db09de07f1e835d5ee6cdAuthor: Even Rouault <even.rouault@mines-paris.org>Date:   Sun Feb 18 18:30:39 2018 +0000    MVT: avoid potential divide by zero. Fixes https://bugs.chromium.org/p/oss-fuzz/issues/detail?id=6445. Credit to OSS Fuzz        git-svn-id: https://svn.osgeo.org/gdal/trunk@41533 f0d54148-0727-0410-94bb-9a71ac55c965	6445	gdal/ogr/ogrsf_frmts/mvt/ogrmvtdataset.cpp	531;584
Gdal-20180215-166cc0872e	166cc0872e	71d72fce4f	Thu Feb 15 17:44:37 2018 +0000	ISO8211: avoid debug message to be emitted too many times. Fixes https://bugs.chromium.org/p/oss-fuzz/issues/detail?id=6388. Credit to OSS Fuzz	commit 166cc0872ec4b4c9ca53ed479f97b6aefb164144Author: Even Rouault <even.rouault@mines-paris.org>Date:   Thu Feb 15 17:44:37 2018 +0000    ISO8211: avoid debug message to be emitted too many times. Fixes https://bugs.chromium.org/p/oss-fuzz/issues/detail?id=6388. Credit to OSS Fuzz        git-svn-id: https://svn.osgeo.org/gdal/trunk@41511 f0d54148-0727-0410-94bb-9a71ac55c965	6388	gdal/frmts/iso8211/ddfrecord.cpp	362
Gdal-20180214-f3c9919fcc	f3c9919fcc	514c4f0626	Wed Feb 14 11:52:01 2018 +0000	SDTS: fix time out issue on oss-fuzz. Fixes https://bugs.chromium.org/p/oss-fuzz/issues/detail?id=6310. Credit to OSS Fuzz	commit f3c9919fccebb9602ab0bd181c59699a6495ac6cAuthor: Even Rouault <even.rouault@mines-paris.org>Date:   Wed Feb 14 11:52:01 2018 +0000    SDTS: fix time out issue on oss-fuzz. Fixes https://bugs.chromium.org/p/oss-fuzz/issues/detail?id=6310. Credit to OSS Fuzz        git-svn-id: https://svn.osgeo.org/gdal/trunk@41480 f0d54148-0727-0410-94bb-9a71ac55c965	6310	gdal/frmts/sdts/sdtscatd.cpp	165
Gdal-20180212-aa9b7713a3	aa9b7713a3	9944743a9d	Mon Feb 12 13:18:07 2018 +0000	DXF: avoid undefined behaviour/out-of-bounds read access. Fixes https://bugs.chromium.org/p/oss-fuzz/issues/detail?id=6202. Credit to OSS Fuzz	commit aa9b7713a35e0885fa038ed7ab391d215bcfa3ebAuthor: Even Rouault <even.rouault@mines-paris.org>Date:   Mon Feb 12 13:18:07 2018 +0000    DXF: avoid undefined behaviour/out-of-bounds read access. Fixes https://bugs.chromium.org/p/oss-fuzz/issues/detail?id=6202. Credit to OSS Fuzz        git-svn-id: https://svn.osgeo.org/gdal/trunk@41456 f0d54148-0727-0410-94bb-9a71ac55c965	6202	gdal/ogr/ogrsf_frmts/dxf/ogrdxflayer.cpp	35;1303;1416
Gdal-20180212-9944743a9d	9944743a9d	6a2b27e2ca	Mon Feb 12 13:11:56 2018 +0000	GTM: avoid excessive processing time. Fixes https://bugs.chromium.org/p/oss-fuzz/issues/detail?id=6236. Credit to OSS Fuzz	commit 9944743a9d4f77b8bbcf6c365b3dd8a262b5adfbAuthor: Even Rouault <even.rouault@mines-paris.org>Date:   Mon Feb 12 13:11:56 2018 +0000    GTM: avoid excessive processing time. Fixes https://bugs.chromium.org/p/oss-fuzz/issues/detail?id=6236. Credit to OSS Fuzz        git-svn-id: https://svn.osgeo.org/gdal/trunk@41455 f0d54148-0727-0410-94bb-9a71ac55c965	6236	gdal/ogr/ogrsf_frmts/gtm/gtm.cpp	682
Gdal-20180211-be1ac8f943	be1ac8f943	ae234200f4	Sun Feb 11 13:27:35 2018 +0000	MBTiles: avoid floating point division by zero. Fixes https://bugs.chromium.org/p/oss-fuzz/issues/detail?id=6222. Credit to OSS Fuzz	commit be1ac8f9430f187b7697c78812a48e1220f6656fAuthor: Even Rouault <even.rouault@mines-paris.org>Date:   Sun Feb 11 13:27:35 2018 +0000    MBTiles: avoid floating point division by zero. Fixes https://bugs.chromium.org/p/oss-fuzz/issues/detail?id=6222. Credit to OSS Fuzz        git-svn-id: https://svn.osgeo.org/gdal/trunk@41451 f0d54148-0727-0410-94bb-9a71ac55c965	6222	gdal/frmts/mbtiles/mbtilesdataset.cpp	165;1149;1175;1209;2687;2716;2751
Gdal-20180210-5469f27be4	5469f27be4	d6e2e6c98a	Sat Feb 10 12:12:28 2018 +0000	Sentinel2: avoid potential dereference of invalid element. Fixes https://bugs.chromium.org/p/oss-fuzz/issues/detail?id=6185. Credit to OSS Fuzz	commit 5469f27be4c61f57da921104efa02f96dcc6cd99Author: Even Rouault <even.rouault@mines-paris.org>Date:   Sat Feb 10 12:12:28 2018 +0000    Sentinel2: avoid potential dereference of invalid element. Fixes https://bugs.chromium.org/p/oss-fuzz/issues/detail?id=6185. Credit to OSS Fuzz        git-svn-id: https://svn.osgeo.org/gdal/trunk@41447 f0d54148-0727-0410-94bb-9a71ac55c965	6185	gdal/frmts/sentinel2/sentinel2dataset.cpp	2238
Gdal-20180207-d036ebf1ae	d036ebf1ae	8f8b9994ef	Wed Feb 7 14:44:57 2018 +0000	/vsicurl/: prevent recursive opening. Fixes https://bugs.chromium.org/p/oss-fuzz/issues/detail?id=6090. Credit to OSS Fuzz	commit d036ebf1ae955fc7bd89255aa437207f5dc07fe9Author: Even Rouault <even.rouault@mines-paris.org>Date:   Wed Feb 7 14:44:57 2018 +0000    /vsicurl/: prevent recursive opening. Fixes https://bugs.chromium.org/p/oss-fuzz/issues/detail?id=6090. Credit to OSS Fuzz        git-svn-id: https://svn.osgeo.org/gdal/trunk@41435 f0d54148-0727-0410-94bb-9a71ac55c965	6090	gdal/port/cpl_google_cloud.cpp;gdal/port/cpl_http.cpp	368;1545
Gdal-20180207-8ba99f89dc	8ba99f89dc	21610daab5	Wed Feb 7 11:40:29 2018 +0000	MVT: avoid int overflow. Fixes https://bugs.chromium.org/p/oss-fuzz/issues/detail?id=6065. Credit to OSS Fuzz	commit 8ba99f89dc26c5b19a523a5bcfc2361e5a93be40Author: Even Rouault <even.rouault@mines-paris.org>Date:   Wed Feb 7 11:40:29 2018 +0000    MVT: avoid int overflow. Fixes https://bugs.chromium.org/p/oss-fuzz/issues/detail?id=6065. Credit to OSS Fuzz        git-svn-id: https://svn.osgeo.org/gdal/trunk@41432 f0d54148-0727-0410-94bb-9a71ac55c965	6065	gdal/ogr/ogrsf_frmts/mvt/ogrmvtdataset.cpp	840;903;931;962;1001;1019
Gdal-20180206-fddc7230ae	fddc7230ae	93ea5f3749	Tue Feb 6 13:19:43 2018 +0000	degrib: fix int overflow. Fixes https://bugs.chromium.org/p/oss-fuzz/issues/detail?id=6048. Credit to OSS Fuzz	commit fddc7230aeff23e64b782bf8c256f26aa1a9d8b3Author: Even Rouault <even.rouault@mines-paris.org>Date:   Tue Feb 6 13:19:43 2018 +0000    degrib: fix int overflow. Fixes https://bugs.chromium.org/p/oss-fuzz/issues/detail?id=6048. Credit to OSS Fuzz        git-svn-id: https://svn.osgeo.org/gdal/trunk@41421 f0d54148-0727-0410-94bb-9a71ac55c965	6048	gdal/frmts/grib/degrib/degrib/clock.c	2505
Gdal-20180206-11c16327b1	11c16327b1	e7474f959a	Tue Feb 6 12:11:09 2018 +0000	Internal libgeotiff: resync with SVN upstream. reject files where the GTIFF_DOUBLEPARAMS tags has more than MAX_VALUES=1000 values to avoid potential out-of-bounds read overflow. Fixes https://bugs.chromium.org/p/oss-fuzz/issues/detail?id=6035. Credit to OSS Fuzz	commit 11c16327b1200815413f65533a879f63feeab81cAuthor: Even Rouault <even.rouault@mines-paris.org>Date:   Tue Feb 6 12:11:09 2018 +0000    Internal libgeotiff: resync with SVN upstream. reject files where the GTIFF_DOUBLEPARAMS tags has more than MAX_VALUES=1000 values to avoid potential out-of-bounds read overflow. Fixes https://bugs.chromium.org/p/oss-fuzz/issues/detail?id=6035. Credit to OSS Fuzz        git-svn-id: https://svn.osgeo.org/gdal/trunk@41417 f0d54148-0727-0410-94bb-9a71ac55c965	6035	gdal/frmts/gtiff/libgeotiff/geo_new.c	178
Gdal-20180206-e7474f959a	e7474f959a	a6954f372c	Tue Feb 6 11:37:55 2018 +0000	FileGDB/OpenFileGDB: fix memory leak on corrupted geometries. Fixes https://bugs.chromium.org/p/oss-fuzz/issues/detail?id=6045. Credit to OSS Fuzz	commit e7474f959a7070f8da5b6b6be62cce364c2c31f6Author: Even Rouault <even.rouault@mines-paris.org>Date:   Tue Feb 6 11:37:55 2018 +0000    FileGDB/OpenFileGDB: fix memory leak on corrupted geometries. Fixes https://bugs.chromium.org/p/oss-fuzz/issues/detail?id=6045. Credit to OSS Fuzz        git-svn-id: https://svn.osgeo.org/gdal/trunk@41416 f0d54148-0727-0410-94bb-9a71ac55c965	6045	gdal/ogr/ogrpgeogeometry.cpp	2077;2699
Gdal-20180204-d0c539642d	d0c539642d	69e7da2bf4	Sun Feb 4 10:38:52 2018 +0000	MVT: fixes int overflow. Fixes https://bugs.chromium.org/p/oss-fuzz/issues/detail?id=5955. Credit to OSS Fuzz	commit d0c539642da55442f89a2a4a5b5aec25975808c5Author: Even Rouault <even.rouault@mines-paris.org>Date:   Sun Feb 4 10:38:52 2018 +0000    MVT: fixes int overflow. Fixes https://bugs.chromium.org/p/oss-fuzz/issues/detail?id=5955. Credit to OSS Fuzz        git-svn-id: https://svn.osgeo.org/gdal/trunk@41402 f0d54148-0727-0410-94bb-9a71ac55c965	5955	gdal/ogr/ogrsf_frmts/mvt/ogrmvtdataset.cpp	837
Gdal-20180203-ea62f5f89d	ea62f5f89d	efd03ffd7d	Sat Feb 3 21:52:30 2018 +0000	Avoid harmless floating-point division by zero. Fixes https://bugs.chromium.org/p/oss-fuzz/issues/detail?id=5946. Credit to OSS Fuzz	commit ea62f5f89d2ef6e11f3906c59d2e55bc47641e3cAuthor: Even Rouault <even.rouault@mines-paris.org>Date:   Sat Feb 3 21:52:30 2018 +0000    Avoid harmless floating-point division by zero. Fixes https://bugs.chromium.org/p/oss-fuzz/issues/detail?id=5946. Credit to OSS Fuzz        git-svn-id: https://svn.osgeo.org/gdal/trunk@41399 f0d54148-0727-0410-94bb-9a71ac55c965	5946	gdal/ogr/ogrpgeogeometry.cpp	1735
Gdal-20180203-e70c6ad79a	e70c6ad79a	bf46ba6b94	Sat Feb 3 11:02:30 2018 +0000	FileGDB/OpenFileGDB: fix memory leak in error code path of discretization of Bezier curves. Fixes https://bugs.chromium.org/p/oss-fuzz/issues/detail?id=5920. Credit to OSS Fuzz. trunk only	commit e70c6ad79a1ace34c33fa44420565a57d09a09aeAuthor: Even Rouault <even.rouault@mines-paris.org>Date:   Sat Feb 3 11:02:30 2018 +0000    FileGDB/OpenFileGDB: fix memory leak in error code path of discretization of Bezier curves. Fixes https://bugs.chromium.org/p/oss-fuzz/issues/detail?id=5920. Credit to OSS Fuzz. trunk only        git-svn-id: https://svn.osgeo.org/gdal/trunk@41384 f0d54148-0727-0410-94bb-9a71ac55c965	5920	gdal/ogr/ogrpgeogeometry.cpp	1956
Gdal-20180202-65e39a0cb7	65e39a0cb7	2baab53e70	Fri Feb 2 12:18:11 2018 +0000	OGRSpatialReference::importFromUSGS(): fix int overflow. Fixes https://bugs.chromium.org/p/oss-fuzz/issues/detail?id=5893. Credit to OSS Fuzz	commit 65e39a0cb7ff40e63f488367740a5b3c0f848fe1Author: Even Rouault <even.rouault@mines-paris.org>Date:   Fri Feb 2 12:18:11 2018 +0000    OGRSpatialReference::importFromUSGS(): fix int overflow. Fixes https://bugs.chromium.org/p/oss-fuzz/issues/detail?id=5893. Credit to OSS Fuzz        git-svn-id: https://svn.osgeo.org/gdal/trunk@41381 f0d54148-0727-0410-94bb-9a71ac55c965	5893	gdal/ogr/ogr_srs_usgs.cpp	466
Gdal-20180202-2baab53e70	2baab53e70	4c39892584	Fri Feb 2 12:15:14 2018 +0000	FileGDB/OpenFileGDB: fix invalid memory allocation attempt in discretization of Bezier curves. Fixeshttps://bugs.chromium.org/p/oss-fuzz/issues/detail?id=5896. Credit to OSS Fuzz. trunk only	commit 2baab53e7038c57f87ed6bf21ffa96d5def420b1Author: Even Rouault <even.rouault@mines-paris.org>Date:   Fri Feb 2 12:15:14 2018 +0000    FileGDB/OpenFileGDB: fix invalid memory allocation attempt in discretization of Bezier curves. Fixeshttps://bugs.chromium.org/p/oss-fuzz/issues/detail?id=5896. Credit to OSS Fuzz. trunk only        git-svn-id: https://svn.osgeo.org/gdal/trunk@41380 f0d54148-0727-0410-94bb-9a71ac55c965	5896	gdal/ogr/ogrpgeogeometry.cpp	1932
Gdal-20180202-01c9d26600	01c9d26600	0554eda847	Fri Feb 2 10:53:17 2018 +0000	FileGDB/OpenFileGDB: fix division by zero / excessive memory allocation attempt in discretization of Bezier curves. Fixes https://bugs.chromium.org/p/oss-fuzz/issues/detail?id=5882. Credit to OSS Fuzz. trunk only	commit 01c9d26600e43e4c6e27afe321eacd34da834d06Author: Even Rouault <even.rouault@mines-paris.org>Date:   Fri Feb 2 10:53:17 2018 +0000    FileGDB/OpenFileGDB: fix division by zero / excessive memory allocation attempt in discretization of Bezier curves. Fixes https://bugs.chromium.org/p/oss-fuzz/issues/detail?id=5882. Credit to OSS Fuzz. trunk only        git-svn-id: https://svn.osgeo.org/gdal/trunk@41378 f0d54148-0727-0410-94bb-9a71ac55c965	5882	gdal/ogr/ogrpgeogeometry.cpp	1932
Gdal-20180129-fb05bb01e5	fb05bb01e5	de12661e80	Mon Jan 29 20:58:12 2018 +0000	MITAB: avoid int overflow. Fixes https://bugs.chromium.org/p/oss-fuzz/issues/detail?id=5813. Credit to OSS Fuzz	commit fb05bb01e50ab04dafa92c305b95be97442981ebAuthor: Even Rouault <even.rouault@mines-paris.org>Date:   Mon Jan 29 20:58:12 2018 +0000    MITAB: avoid int overflow. Fixes https://bugs.chromium.org/p/oss-fuzz/issues/detail?id=5813. Credit to OSS Fuzz        git-svn-id: https://svn.osgeo.org/gdal/trunk@41365 f0d54148-0727-0410-94bb-9a71ac55c965	5813	gdal/ogr/ogrsf_frmts/mitab/mitab_datfile.cpp	213;240
Gdal-20180129-de12661e80	de12661e80	c7d7e58dff	Mon Jan 29 20:48:41 2018 +0000	VFK: fix uninitialized buffer. Related to https://bugs.chromium.org/p/oss-fuzz/issues/detail?id=5812	commit de12661e8009e40532ffacaca7b7867935d8ecd7Author: Even Rouault <even.rouault@mines-paris.org>Date:   Mon Jan 29 20:48:41 2018 +0000    VFK: fix uninitialized buffer. Related to https://bugs.chromium.org/p/oss-fuzz/issues/detail?id=5812        git-svn-id: https://svn.osgeo.org/gdal/trunk@41364 f0d54148-0727-0410-94bb-9a71ac55c965	5812	gdal/ogr/ogrsf_frmts/vfk/vfkreader.cpp	68
Gdal-20180129-c7d7e58dff	c7d7e58dff	2aaa26865e	Mon Jan 29 20:48:17 2018 +0000	CPLRecodeIConv(): fixes out-of-bounds write. Fixes https://bugs.chromium.org/p/oss-fuzz/issues/detail?id=5812. Credit to OSS Fuzz	commit c7d7e58dff13e716713ba1c468d901c34a262fe5Author: Even Rouault <even.rouault@mines-paris.org>Date:   Mon Jan 29 20:48:17 2018 +0000    CPLRecodeIConv(): fixes out-of-bounds write. Fixes https://bugs.chromium.org/p/oss-fuzz/issues/detail?id=5812. Credit to OSS Fuzz        git-svn-id: https://svn.osgeo.org/gdal/trunk@41363 f0d54148-0727-0410-94bb-9a71ac55c965	5812	autotest/cpp/test_cpl.cpp;gdal/port/cpl_recode_iconv.cpp	2010;104;141
Gdal-20180128-3674f486f2	3674f486f2	4d6feea7fa	Sun Jan 28 12:11:29 2018 +0000	KRO: avoid excessive memory allocation. Fixes https://bugs.chromium.org/p/oss-fuzz/issues/detail?id=5770. Credit OSS Fuzz	commit 3674f486f26779ff4cf973ea98b3633958af828aAuthor: Even Rouault <even.rouault@mines-paris.org>Date:   Sun Jan 28 12:11:29 2018 +0000    KRO: avoid excessive memory allocation. Fixes https://bugs.chromium.org/p/oss-fuzz/issues/detail?id=5770. Credit OSS Fuzz        git-svn-id: https://svn.osgeo.org/gdal/trunk@41360 f0d54148-0727-0410-94bb-9a71ac55c965	5770	gdal/frmts/raw/krodataset.cpp	192
Gdal-20180128-4d6feea7fa	4d6feea7fa	97bd5e1539	Sun Jan 28 11:57:40 2018 +0000	MVT: fix reading of multilinestring with 3 parts or more. Fixes https://bugs.chromium.org/p/oss-fuzz/issues/detail?id=5755. Credit to OSS Fuzz	commit 4d6feea7fa75f162f68bba5ff7a87180bb6e76d0Author: Even Rouault <even.rouault@mines-paris.org>Date:   Sun Jan 28 11:57:40 2018 +0000    MVT: fix reading of multilinestring with 3 parts or more. Fixes https://bugs.chromium.org/p/oss-fuzz/issues/detail?id=5755. Credit to OSS Fuzz        git-svn-id: https://svn.osgeo.org/gdal/trunk@41359 f0d54148-0727-0410-94bb-9a71ac55c965	5755	autotest/ogr/data/mvt/multilinestring/metadata.json;autotest/ogr/ogr_mvt.py;gdal/ogr/ogrsf_frmts/mvt/ogrmvtdataset.cpp	1;0;237;246;607;939
Gdal-20180127-5fde7f25ec	5fde7f25ec	30fc21bfc3	Sat Jan 27 08:44:48 2018 +0000	MVT: avoid divide by zero. Fixes https://bugs.chromium.org/p/oss-fuzz/issues/detail?id=5735. Credit to OSS Fuzz	commit 5fde7f25ec380fddaa77331b9a06ee982eb75791Author: Even Rouault <even.rouault@mines-paris.org>Date:   Sat Jan 27 08:44:48 2018 +0000    MVT: avoid divide by zero. Fixes https://bugs.chromium.org/p/oss-fuzz/issues/detail?id=5735. Credit to OSS Fuzz        git-svn-id: https://svn.osgeo.org/gdal/trunk@41355 f0d54148-0727-0410-94bb-9a71ac55c965	5735	gdal/ogr/ogrsf_frmts/mvt/ogrmvtdataset.cpp	517
Gdal-20180126-1f9f8496ca	1f9f8496ca	28a977d2b2	Fri Jan 26 20:44:51 2018 +0000	CPLJSONObject::GetChildren(): fix crash if this is not a JSon object. Fixes https://bugs.chromium.org/p/oss-fuzz/issues/detail?id=5723. Credit to OSS Fuzz	commit 1f9f8496ca5d1d315be35f066a49b3f70aa29334Author: Even Rouault <even.rouault@mines-paris.org>Date:   Fri Jan 26 20:44:51 2018 +0000    CPLJSONObject::GetChildren(): fix crash if this is not a JSon object. Fixes https://bugs.chromium.org/p/oss-fuzz/issues/detail?id=5723. Credit to OSS Fuzz        git-svn-id: https://svn.osgeo.org/gdal/trunk@41351 f0d54148-0727-0410-94bb-9a71ac55c965	5723	gdal/port/cpl_json.cpp	907
Gdal-20180126-be3a672514	be3a672514	a8cbfe1bff	Fri Jan 26 18:33:41 2018 +0000	CPLJSONDocument::LoadMemory(): fix memory leak in error code path. Fixes https://bugs.chromium.org/p/oss-fuzz/issues/detail?id=5722. Credit to OSS Fuzz	commit be3a672514264bd0942bc57556703a9f172b23a9Author: Even Rouault <even.rouault@mines-paris.org>Date:   Fri Jan 26 18:33:41 2018 +0000    CPLJSONDocument::LoadMemory(): fix memory leak in error code path. Fixes https://bugs.chromium.org/p/oss-fuzz/issues/detail?id=5722. Credit to OSS Fuzz        git-svn-id: https://svn.osgeo.org/gdal/trunk@41347 f0d54148-0727-0410-94bb-9a71ac55c965	5722	gdal/port/cpl_json.cpp	166
Gdal-20180126-3b27f6697e	3b27f6697e	e860a6bb3f	Fri Jan 26 12:43:48 2018 +0000	CPLJson: avoid too many nested objects which can cause stack buffer overflow on object freeing. Fixes https://bugs.chromium.org/p/oss-fuzz/issues/detail?id=5711. Credit to OSS Fuzz	commit 3b27f6697e0da40156b28de80c8db88fd6969459Author: Even Rouault <even.rouault@mines-paris.org>Date:   Fri Jan 26 12:43:48 2018 +0000    CPLJson: avoid too many nested objects which can cause stack buffer overflow on object freeing. Fixes https://bugs.chromium.org/p/oss-fuzz/issues/detail?id=5711. Credit to OSS Fuzz        git-svn-id: https://svn.osgeo.org/gdal/trunk@41340 f0d54148-0727-0410-94bb-9a71ac55c965	5711	gdal/port/cpl_json.cpp	979
Gdal-20180126-8bc4f24bf7	8bc4f24bf7	f3e3b9da77	Fri Jan 26 12:14:28 2018 +0000	GML: fix memory leak in error code path. Fixes https://bugs.chromium.org/p/oss-fuzz/issues/detail?id=5705. Credit to OSS Fuzz	commit 8bc4f24bf7b78424cfd0df089a3cc0542d4e110eAuthor: Even Rouault <even.rouault@mines-paris.org>Date:   Fri Jan 26 12:14:28 2018 +0000    GML: fix memory leak in error code path. Fixes https://bugs.chromium.org/p/oss-fuzz/issues/detail?id=5705. Credit to OSS Fuzz        git-svn-id: https://svn.osgeo.org/gdal/trunk@41337 f0d54148-0727-0410-94bb-9a71ac55c965	5705	gdal/ogr/ogrsf_frmts/gml/parsexsd.cpp	483;514;526;540;552;641;692
Gdal-20180125-bacfaf34ce	bacfaf34ce	53e54f7dde	Thu Jan 25 21:20:59 2018 +0000	grib / g2clib: fix heap buffer read overflow. Fixes https://bugs.chromium.org/p/oss-fuzz/issues/detail?id=5687. Credit to OSS Fuzz	commit bacfaf34ce3140124da5a6172d2103fe0475437cAuthor: Even Rouault <even.rouault@mines-paris.org>Date:   Thu Jan 25 21:20:59 2018 +0000    grib / g2clib: fix heap buffer read overflow. Fixes https://bugs.chromium.org/p/oss-fuzz/issues/detail?id=5687. Credit to OSS Fuzz        git-svn-id: https://svn.osgeo.org/gdal/trunk@41335 f0d54148-0727-0410-94bb-9a71ac55c965	5687	gdal/frmts/grib/degrib/g2clib/dec_png.c	35
Gdal-20180123-66da91b19c	66da91b19c	8f4eec35aa	Tue Jan 23 12:03:06 2018 +0000	INGR: avoid excessive memory allocation attempt / crash. Fixes https://bugs.chromium.org/p/oss-fuzz/issues/detail?id=5592. Credit to OSS Fuzz	commit 66da91b19c6888e97a8376c482757410a8ab496fAuthor: Even Rouault <even.rouault@mines-paris.org>Date:   Tue Jan 23 12:03:06 2018 +0000    INGR: avoid excessive memory allocation attempt / crash. Fixes https://bugs.chromium.org/p/oss-fuzz/issues/detail?id=5592. Credit to OSS Fuzz        git-svn-id: https://svn.osgeo.org/gdal/trunk@41320 f0d54148-0727-0410-94bb-9a71ac55c965	5592	gdal/frmts/ingr/IntergraphDataset.cpp	480
Gdal-20180123-8f4eec35aa	8f4eec35aa	6e80c6e6fc	Tue Jan 23 11:57:16 2018 +0000	HFA: avoid excessive memory allocation attempt / crash. Fixes https://bugs.chromium.org/p/oss-fuzz/issues/detail?id=5583. Credit to OSS Fuzz	commit 8f4eec35aa3dd06babac08edc597496f9a5c0f5bAuthor: Even Rouault <even.rouault@mines-paris.org>Date:   Tue Jan 23 11:57:16 2018 +0000    HFA: avoid excessive memory allocation attempt / crash. Fixes https://bugs.chromium.org/p/oss-fuzz/issues/detail?id=5583. Credit to OSS Fuzz        git-svn-id: https://svn.osgeo.org/gdal/trunk@41319 f0d54148-0727-0410-94bb-9a71ac55c965	5583	gdal/frmts/hfa/hfadataset.cpp	1981
Gdal-20180120-c45becd076	c45becd076	d017bc617d	Sat Jan 20 17:30:09 2018 +0000	VFK: fix memory leak. Fixes https://bugs.chromium.org/p/oss-fuzz/issues/detail?id=5524. Credit to OSS Fuzz	commit c45becd0763d2715376470e52040f0d09a784577Author: Even Rouault <even.rouault@mines-paris.org>Date:   Sat Jan 20 17:30:09 2018 +0000    VFK: fix memory leak. Fixes https://bugs.chromium.org/p/oss-fuzz/issues/detail?id=5524. Credit to OSS Fuzz        git-svn-id: https://svn.osgeo.org/gdal/trunk@41299 f0d54148-0727-0410-94bb-9a71ac55c965	5524	gdal/ogr/ogrsf_frmts/vfk/vfkdatablocksqlite.cpp	551
Gdal-20180120-d6a12098d0	d6a12098d0	bd1aec5368	Sat Jan 20 11:35:23 2018 +0000	ISIS2: avoid out of memory situation. Fixes https://bugs.chromium.org/p/oss-fuzz/issues/detail?id=5519. Credit to OSS-Fuzz	commit d6a12098d09c4b54c8d184b8711ab5a9f2cf4cd9Author: Even Rouault <even.rouault@mines-paris.org>Date:   Sat Jan 20 11:35:23 2018 +0000    ISIS2: avoid out of memory situation. Fixes https://bugs.chromium.org/p/oss-fuzz/issues/detail?id=5519. Credit to OSS-Fuzz        git-svn-id: https://svn.osgeo.org/gdal/trunk@41297 f0d54148-0727-0410-94bb-9a71ac55c965	5519	gdal/frmts/pds/isis2dataset.cpp	587
Gdal-20180119-226ef78004	226ef78004	8ef9337e5e	Fri Jan 19 12:45:11 2018 +0000	fuzzers: ogr_fuzzer: limit number of layers on which to iterate. Fixes https://bugs.chromium.org/p/oss-fuzz/issues/detail?id=5486	commit 226ef780041e2964974bc7819609e7b94f894c85Author: Even Rouault <even.rouault@mines-paris.org>Date:   Fri Jan 19 12:45:11 2018 +0000    fuzzers: ogr_fuzzer: limit number of layers on which to iterate. Fixes https://bugs.chromium.org/p/oss-fuzz/issues/detail?id=5486        git-svn-id: https://svn.osgeo.org/gdal/trunk@41295 f0d54148-0727-0410-94bb-9a71ac55c965	5486	gdal/fuzzers/ogr_fuzzer.cpp	102
Gdal-20180118-ee255c6081	ee255c6081	89d6c97dec	Thu Jan 18 11:46:10 2018 +0000	NTF: fix regression introduced by fix for https://bugs.chromium.org/p/oss-fuzz/issues/detail?id=2166 causing some valid records to be skipped (patch by molnar, fixes https://trac.osgeo.org/gdal/ticket/7204)	commit ee255c6081fbd3b6ad1742325aaa0d3335f3ddf2Author: Even Rouault <even.rouault@mines-paris.org>Date:   Thu Jan 18 11:46:10 2018 +0000    NTF: fix regression introduced by fix for https://bugs.chromium.org/p/oss-fuzz/issues/detail?id=2166 causing some valid records to be skipped (patch by molnar, fixes https://trac.osgeo.org/gdal/ticket/7204)        git-svn-id: https://svn.osgeo.org/gdal/trunk@41288 f0d54148-0727-0410-94bb-9a71ac55c965	2166	gdal/ogr/ogrsf_frmts/ntf/ntffilereader.cpp	987
Gdal-20180117-e992afc412	e992afc412	d39ecf2725	Wed Jan 17 08:44:44 2018 +0000	OGR_PDS: limit processing time on pathological datasets generated by oss-fuzz. Fixes https://bugs.chromium.org/p/oss-fuzz/issues/detail?id=5430. Credit to OSS Fuzz	commit e992afc412b1c20c3749610078da8199b72ef7c0Author: Even Rouault <even.rouault@mines-paris.org>Date:   Wed Jan 17 08:44:44 2018 +0000    OGR_PDS: limit processing time on pathological datasets generated by oss-fuzz. Fixes https://bugs.chromium.org/p/oss-fuzz/issues/detail?id=5430. Credit to OSS Fuzz        git-svn-id: https://svn.osgeo.org/gdal/trunk@41281 f0d54148-0727-0410-94bb-9a71ac55c965	5430	gdal/ogr/ogrsf_frmts/pds/ogrpdsdatasource.cpp	362;377
Gdal-20180117-d39ecf2725	d39ecf2725	ae217f7447	Wed Jan 17 08:35:23 2018 +0000	CSV: limit processing time on pathological datasets generated by oss-fuzz. Fixes https://bugs.chromium.org/p/oss-fuzz/issues/detail?id=5427. Credit to OSS Fuzz	commit d39ecf27255512887747b7482b8d490aca5d9e67Author: Even Rouault <even.rouault@mines-paris.org>Date:   Wed Jan 17 08:35:23 2018 +0000    CSV: limit processing time on pathological datasets generated by oss-fuzz. Fixes https://bugs.chromium.org/p/oss-fuzz/issues/detail?id=5427. Credit to OSS Fuzz        git-svn-id: https://svn.osgeo.org/gdal/trunk@41280 f0d54148-0727-0410-94bb-9a71ac55c965	5427	gdal/ogr/ogrsf_frmts/csv/ogrcsvlayer.cpp	75;126;729
Gdal-20180117-ae217f7447	ae217f7447	f78cd90275	Wed Jan 17 08:15:37 2018 +0000	BSB: avoid excessive memory allocation attempt. Fixes https://bugs.chromium.org/p/oss-fuzz/issues/detail?id=5390. Credit to OSS Fuzz	commit ae217f74475a65895ddfbf279d7c019eddac6222Author: Even Rouault <even.rouault@mines-paris.org>Date:   Wed Jan 17 08:15:37 2018 +0000    BSB: avoid excessive memory allocation attempt. Fixes https://bugs.chromium.org/p/oss-fuzz/issues/detail?id=5390. Credit to OSS Fuzz        git-svn-id: https://svn.osgeo.org/gdal/trunk@41279 f0d54148-0727-0410-94bb-9a71ac55c965	5390	gdal/frmts/bsb/bsb_read.c	449
Gdal-20180115-a4f7bc6700	a4f7bc6700	7b1063e674	Mon Jan 15 15:13:44 2018 +0000	VFK: fix null pointer dereference. Fixes https://bugs.chromium.org/p/oss-fuzz/issues/detail?id=5337. Credit to OSS Fuzz	commit a4f7bc67002d633a4228e17f726e01cc733502dcAuthor: Even Rouault <even.rouault@mines-paris.org>Date:   Mon Jan 15 15:13:44 2018 +0000    VFK: fix null pointer dereference. Fixes https://bugs.chromium.org/p/oss-fuzz/issues/detail?id=5337. Credit to OSS Fuzz        git-svn-id: https://svn.osgeo.org/gdal/trunk@41274 f0d54148-0727-0410-94bb-9a71ac55c965	5337	gdal/ogr/ogrsf_frmts/vfk/vfkdatablocksqlite.cpp	858
Gdal-20180115-7b1063e674	7b1063e674	1d00777992	Mon Jan 15 15:01:07 2018 +0000	ODS: avoid excessive memory allocation attempt. Fixes https://bugs.chromium.org/p/oss-fuzz/issues/detail?id=5309. Credit to OSS Fuzz	commit 7b1063e67488d3efa37e34370397944f00064589Author: Even Rouault <even.rouault@mines-paris.org>Date:   Mon Jan 15 15:01:07 2018 +0000    ODS: avoid excessive memory allocation attempt. Fixes https://bugs.chromium.org/p/oss-fuzz/issues/detail?id=5309. Credit to OSS Fuzz        git-svn-id: https://svn.osgeo.org/gdal/trunk@41273 f0d54148-0727-0410-94bb-9a71ac55c965	5309	gdal/ogr/ogrsf_frmts/ods/ogrodsdatasource.cpp	828
