Gdal-20170627-87ff1cf82f	87ff1cf82f	a8b8efda8f	Tue Jun 27 12:19:41 2017 +0000	libLERC: avoid excessive memory allocation. Fixes https://bugs.chromium.org/p/oss-fuzz/issues/detail?id=2397. Credit to OSS Fuzz	commit 87ff1cf82f04557fb0f5d5a106acb9b1f8812479Author: Even Rouault <even.rouault@mines-paris.org>Date:   Tue Jun 27 12:19:41 2017 +0000    libLERC: avoid excessive memory allocation. Fixes https://bugs.chromium.org/p/oss-fuzz/issues/detail?id=2397. Credit to OSS Fuzz        git-svn-id: https://svn.osgeo.org/gdal/trunk@39316 f0d54148-0727-0410-94bb-9a71ac55c965	2397	gdal/frmts/mrf/libLERC/BitStuffer.cpp;gdal/frmts/mrf/libLERC/BitStuffer.h;gdal/frmts/mrf/libLERC/CntZImage.cpp	129;154;37;1043;1170
Gdal-20170627-a8b8efda8f	a8b8efda8f	d09555f764	Tue Jun 27 12:03:58 2017 +0000	gdal_translate_fuzzer: avoid excessive memory allocation. Fixes https://bugs.chromium.org/p/oss-fuzz/issues/detail?id=2396. Credit to OSS Fuzz	commit a8b8efda8f1aed34e2994fb036f4b3ff4c4e8322Author: Even Rouault <even.rouault@mines-paris.org>Date:   Tue Jun 27 12:03:58 2017 +0000    gdal_translate_fuzzer: avoid excessive memory allocation. Fixes https://bugs.chromium.org/p/oss-fuzz/issues/detail?id=2396. Credit to OSS Fuzz        git-svn-id: https://svn.osgeo.org/gdal/trunk@39315 f0d54148-0727-0410-94bb-9a71ac55c965	2396	gdal/fuzzers/gdal_translate_fuzzer.cpp	60;70;104
Gdal-20170626-9b39cb5227	9b39cb5227	55333724cc	Mon Jun 26 08:15:32 2017 +0000	MBTiles: fix use after free. Fixes https://bugs.chromium.org/p/oss-fuzz/issues/detail?id=2388. Credit to OSS Fuzz	commit 9b39cb5227155090e7f44fd934b0760693d968e1Author: Even Rouault <even.rouault@mines-paris.org>Date:   Mon Jun 26 08:15:32 2017 +0000    MBTiles: fix use after free. Fixes https://bugs.chromium.org/p/oss-fuzz/issues/detail?id=2388. Credit to OSS Fuzz        git-svn-id: https://svn.osgeo.org/gdal/trunk@39302 f0d54148-0727-0410-94bb-9a71ac55c965	2388	gdal/frmts/mbtiles/mbtilesdataset.cpp	1194
Gdal-20170625-d572196b08	d572196b08	6b06b980c7	Sun Jun 25 21:00:00 2017 +0000	libLERC: avoid heap buffer overflow. Fixes https://bugs.chromium.org/p/oss-fuzz/issues/detail?id=2387. Credit to OSS Fuzz	commit d572196b086e5aa18de0a0f37b3b0b14a7ad0f5bAuthor: Even Rouault <even.rouault@mines-paris.org>Date:   Sun Jun 25 21:00:00 2017 +0000    libLERC: avoid heap buffer overflow. Fixes https://bugs.chromium.org/p/oss-fuzz/issues/detail?id=2387. Credit to OSS Fuzz        git-svn-id: https://svn.osgeo.org/gdal/trunk@39290 f0d54148-0727-0410-94bb-9a71ac55c965	2387	gdal/frmts/mrf/libLERC/BitStuffer2.cpp	193
Gdal-20170625-6b06b980c7	6b06b980c7	0d540f7d9d	Sun Jun 25 20:52:35 2017 +0000	GRIB / g2clib: fix int overflow. Fixes https://bugs.chromium.org/p/oss-fuzz/issues/detail?id=2386. Credit to OSS Fuzz	commit 6b06b980c7a4cbe2f485bad6e456b50949bbda25Author: Even Rouault <even.rouault@mines-paris.org>Date:   Sun Jun 25 20:52:35 2017 +0000    GRIB / g2clib: fix int overflow. Fixes https://bugs.chromium.org/p/oss-fuzz/issues/detail?id=2386. Credit to OSS Fuzz        git-svn-id: https://svn.osgeo.org/gdal/trunk@39289 f0d54148-0727-0410-94bb-9a71ac55c965	2386	gdal/frmts/grib/degrib18/g2clib-1.0.4/comunpack.c	1;215;335
Gdal-20170625-2166b9b894	2166b9b894	19bdfbf511	Sun Jun 25 08:05:10 2017 +0000	grib / g2clib: fix int32 overflow. Fixes https://bugs.chromium.org/p/oss-fuzz/issues/detail?id=2383. Credit to OSS Fuzz	commit 2166b9b894e085842f1e6e4ddebf5d791542c67aAuthor: Even Rouault <even.rouault@mines-paris.org>Date:   Sun Jun 25 08:05:10 2017 +0000    grib / g2clib: fix int32 overflow. Fixes https://bugs.chromium.org/p/oss-fuzz/issues/detail?id=2383. Credit to OSS Fuzz        git-svn-id: https://svn.osgeo.org/gdal/trunk@39282 f0d54148-0727-0410-94bb-9a71ac55c965	2383	gdal/frmts/grib/degrib18/g2clib-1.0.4/g2_unpack3.c;gdal/frmts/grib/degrib18/g2clib-1.0.4/gbits.c	163;178;1;36
Gdal-20170624-581f6eaf66	581f6eaf66	486dc3ae5e	Sat Jun 24 13:28:00 2017 +0000	GRIB / degrib: fix undefined left shift. Fixes https://bugs.chromium.org/p/oss-fuzz/issues/detail?id=2373. Credit to OSS Fuzz	commit 581f6eaf661d2cb4c82f0a6a8969169f31c4b890Author: Even Rouault <even.rouault@mines-paris.org>Date:   Sat Jun 24 13:28:00 2017 +0000    GRIB / degrib: fix undefined left shift. Fixes https://bugs.chromium.org/p/oss-fuzz/issues/detail?id=2373. Credit to OSS Fuzz        git-svn-id: https://svn.osgeo.org/gdal/trunk@39276 f0d54148-0727-0410-94bb-9a71ac55c965	2373	gdal/frmts/grib/degrib18/degrib/grib2api.c	1431
Gdal-20170624-c151a628f1	c151a628f1	d9edcd73fc	Sat Jun 24 11:10:27 2017 +0000	libLERC: avoid undefined shift in BitUnStuff(). Fixes https://bugs.chromium.org/p/oss-fuzz/issues/detail?id=2371. Credit to OSS Fuzz	commit c151a628f1643100375e190d7d44b6f65e34013dAuthor: Even Rouault <even.rouault@mines-paris.org>Date:   Sat Jun 24 11:10:27 2017 +0000    libLERC: avoid undefined shift in BitUnStuff(). Fixes https://bugs.chromium.org/p/oss-fuzz/issues/detail?id=2371. Credit to OSS Fuzz        git-svn-id: https://svn.osgeo.org/gdal/trunk@39274 f0d54148-0727-0410-94bb-9a71ac55c965	2371	gdal/frmts/mrf/libLERC/BitStuffer2.cpp	213
Gdal-20170624-d9edcd73fc	d9edcd73fc	8d266b0126	Sat Jun 24 11:05:00 2017 +0000	MRF: avoid write heap buffer overflow. Fixes https://bugs.chromium.org/p/oss-fuzz/issues/detail?id=2369. Credit to OSS Fuzz	commit d9edcd73fce363d291719c61ce5e0d48d15bc866Author: Even Rouault <even.rouault@mines-paris.org>Date:   Sat Jun 24 11:05:00 2017 +0000    MRF: avoid write heap buffer overflow. Fixes https://bugs.chromium.org/p/oss-fuzz/issues/detail?id=2369. Credit to OSS Fuzz        git-svn-id: https://svn.osgeo.org/gdal/trunk@39273 f0d54148-0727-0410-94bb-9a71ac55c965	2369	gdal/frmts/mrf/LERC_band.cpp	160;231;243
Gdal-20170624-8d266b0126	8d266b0126	b585f16786	Sat Jun 24 10:49:47 2017 +0000	NAS: avoid assertion / null ptr deref and possibly other failures on corrupted files. Fixes https://bugs.chromium.org/p/oss-fuzz/issues/detail?id=2366. Credit to OSS Fuzz	commit 8d266b0126212313931990966651d60cf3a33219Author: Even Rouault <even.rouault@mines-paris.org>Date:   Sat Jun 24 10:49:47 2017 +0000    NAS: avoid assertion / null ptr deref and possibly other failures on corrupted files. Fixes https://bugs.chromium.org/p/oss-fuzz/issues/detail?id=2366. Credit to OSS Fuzz        git-svn-id: https://svn.osgeo.org/gdal/trunk@39271 f0d54148-0727-0410-94bb-9a71ac55c965	2366	gdal/ogr/ogrsf_frmts/nas/nashandler.cpp;gdal/ogr/ogrsf_frmts/nas/nasreaderp.h	90;316;376;394;505;539;546;73
Gdal-20170623-777bfd7f8a	777bfd7f8a	45d8154177	Fri Jun 23 21:50:41 2017 +0000	OGR_PDS: avoid int32 overflow. Fixes https://bugs.chromium.org/p/oss-fuzz/issues/detail?id=2362. Credit to OSS Fuzz	commit 777bfd7f8a237379d1855c8629826083b944acdcAuthor: Even Rouault <even.rouault@mines-paris.org>Date:   Fri Jun 23 21:50:41 2017 +0000    OGR_PDS: avoid int32 overflow. Fixes https://bugs.chromium.org/p/oss-fuzz/issues/detail?id=2362. Credit to OSS Fuzz        git-svn-id: https://svn.osgeo.org/gdal/trunk@39253 f0d54148-0727-0410-94bb-9a71ac55c965	2362	gdal/ogr/ogrsf_frmts/pds/ogrpdsdatasource.cpp	190
Gdal-20170623-c58fe8a01a	c58fe8a01a	7de99f8b29	Fri Jun 23 18:48:08 2017 +0000	/vsicurl/: avoid use after free. Fixes https://bugs.chromium.org/p/oss-fuzz/issues/detail?id=2360. Credit to OSS Fuzz. trunk only	commit c58fe8a01a0ad00760746936b6f4220923411466Author: Even Rouault <even.rouault@mines-paris.org>Date:   Fri Jun 23 18:48:08 2017 +0000    /vsicurl/: avoid use after free. Fixes https://bugs.chromium.org/p/oss-fuzz/issues/detail?id=2360. Credit to OSS Fuzz. trunk only        git-svn-id: https://svn.osgeo.org/gdal/trunk@39249 f0d54148-0727-0410-94bb-9a71ac55c965	2360	gdal/port/cpl_http.cpp	877
Gdal-20170623-f0b97e1f78	f0b97e1f78	300b0f845a	Fri Jun 23 14:16:44 2017 +0000	libLERC: fix numerous heap buffer overflows (https://bugs.chromium.org/p/oss-fuzz/issues/detail?id=2295 ,2296, 2321, 2346, 2353 ) and a division by zero/int overflow issue (https://bugs.chromium.org/p/oss-fuzz/issues/detail?id=2308 , 2355). Credit to OSS Fuzz	commit f0b97e1f784f33f40d213cc953c3f7a7ed9869caAuthor: Even Rouault <even.rouault@mines-paris.org>Date:   Fri Jun 23 14:16:44 2017 +0000    libLERC: fix numerous heap buffer overflows (https://bugs.chromium.org/p/oss-fuzz/issues/detail?id=2295 ,2296, 2321, 2346, 2353 ) and a division by zero/int overflow issue (https://bugs.chromium.org/p/oss-fuzz/issues/detail?id=2308 , 2355). Credit to OSS Fuzz        git-svn-id: https://svn.osgeo.org/gdal/trunk@39243 f0d54148-0727-0410-94bb-9a71ac55c965	2295	gdal/frmts/mrf/LERC_band.cpp;gdal/frmts/mrf/libLERC/BitStuffer2.cpp;gdal/frmts/mrf/libLERC/BitStuffer2.h;gdal/frmts/mrf/libLERC/Huffman.cpp;gdal/frmts/mrf/libLERC/Huffman.h;gdal/frmts/mrf/libLERC/Lerc2.cpp;gdal/frmts/mrf/libLERC/Lerc2.h;gdal/frmts/mrf/libLERC/RLE.cpp;gdal/frmts/mrf/libLERC/RLE.h	355;373;454;146;161;170;288;297;354;45;58;106;126;170;199;212;467;483;492;55;135;160;175;182;114;164;189;207;252;262;280;35;93;115;155;165;182;327;359;403;414;578;588;614;631;909;936;949;960;974;1009;1135;1143;1392;1402;1417;1440;1462;228;244;252;270;54
Gdal-20170623-7831660462	7831660462	eff3ca0d65	Fri Jun 23 02:10:39 2017 +0000	BLX: fix heap buffer overflow. Fixes https://bugs.chromium.org/p/oss-fuzz/issues/detail?id=2354. Credit to OSS Fuzz	commit 783166046299490f1ebd9bdb3d277d06a5b04839Author: Even Rouault <even.rouault@mines-paris.org>Date:   Fri Jun 23 02:10:39 2017 +0000    BLX: fix heap buffer overflow. Fixes https://bugs.chromium.org/p/oss-fuzz/issues/detail?id=2354. Credit to OSS Fuzz        git-svn-id: https://svn.osgeo.org/gdal/trunk@39235 f0d54148-0727-0410-94bb-9a71ac55c965	2354	gdal/frmts/blx/blx.c	759
Gdal-20170622-a3913c7b82	a3913c7b82	376d7409af	Thu Jun 22 17:54:23 2017 +0000	WMS: avoid int32 overflow. Fixes https://bugs.chromium.org/p/oss-fuzz/issues/detail?id=2352. Credit to OSS Fuzz	commit a3913c7b82518b0d1c41243b9eb77abd32ad7e87Author: Even Rouault <even.rouault@mines-paris.org>Date:   Thu Jun 22 17:54:23 2017 +0000    WMS: avoid int32 overflow. Fixes https://bugs.chromium.org/p/oss-fuzz/issues/detail?id=2352. Credit to OSS Fuzz        git-svn-id: https://svn.osgeo.org/gdal/trunk@39233 f0d54148-0727-0410-94bb-9a71ac55c965	2352	gdal/frmts/wms/minidriver_tms.cpp	75
Gdal-20170621-f02bc12db6	f02bc12db6	b4e2e06d86	Wed Jun 21 11:54:33 2017 +0000	VICAR: avoid int overflow. Fixes https://bugs.chromium.org/p/oss-fuzz/issues/detail?id=2337. Credit to OSS Fuzz	commit f02bc12db6e092564cb76bb8455b21d66113f449Author: Even Rouault <even.rouault@mines-paris.org>Date:   Wed Jun 21 11:54:33 2017 +0000    VICAR: avoid int overflow. Fixes https://bugs.chromium.org/p/oss-fuzz/issues/detail?id=2337. Credit to OSS Fuzz        git-svn-id: https://svn.osgeo.org/gdal/trunk@39225 f0d54148-0727-0410-94bb-9a71ac55c965	2337	gdal/frmts/pds/vicardataset.cpp	286;587;601
Gdal-20170621-0ba8f16ef6	0ba8f16ef6	108420ccb2	Wed Jun 21 08:18:03 2017 +0000	grib / g2clib: fix heap buffer oveflow. Related to testcase of https://bugs.chromium.org/p/oss-fuzz/issues/detail?id=2330. Credit to OSS Fuzz	commit 0ba8f16ef63493843921b98bd810acfa111762c5Author: Even Rouault <even.rouault@mines-paris.org>Date:   Wed Jun 21 08:18:03 2017 +0000    grib / g2clib: fix heap buffer oveflow. Related to testcase of https://bugs.chromium.org/p/oss-fuzz/issues/detail?id=2330. Credit to OSS Fuzz        git-svn-id: https://svn.osgeo.org/gdal/trunk@39222 f0d54148-0727-0410-94bb-9a71ac55c965	2330	gdal/frmts/grib/degrib18/g2clib-1.0.4/g2_unpack4.c	67;80;113;140
Gdal-20170621-108420ccb2	108420ccb2	b6634f1ef3	Wed Jun 21 08:17:40 2017 +0000	grib / degrib: fix read stack buffer overflow. Fixes https://bugs.chromium.org/p/oss-fuzz/issues/detail?id=2330. Credit to OSS Fuzz	commit 108420ccb26f74aa4020cdec70b163beea0ed6f4Author: Even Rouault <even.rouault@mines-paris.org>Date:   Wed Jun 21 08:17:40 2017 +0000    grib / degrib: fix read stack buffer overflow. Fixes https://bugs.chromium.org/p/oss-fuzz/issues/detail?id=2330. Credit to OSS Fuzz        git-svn-id: https://svn.osgeo.org/gdal/trunk@39221 f0d54148-0727-0410-94bb-9a71ac55c965	2330	gdal/frmts/grib/degrib18/degrib/grib2api.c	1047
Gdal-20170620-b6634f1ef3	b6634f1ef3	45437f8d29	Tue Jun 20 23:33:12 2017 +0000	GRIB / degrib: fix int32 overflow. Fixes https://bugs.chromium.org/p/oss-fuzz/issues/detail?id=2329. Credit to OSS Fuzz	commit b6634f1ef303c5f8ad4ffa31bdf107d9a948c340Author: Even Rouault <even.rouault@mines-paris.org>Date:   Tue Jun 20 23:33:12 2017 +0000    GRIB / degrib: fix int32 overflow. Fixes https://bugs.chromium.org/p/oss-fuzz/issues/detail?id=2329. Credit to OSS Fuzz        git-svn-id: https://svn.osgeo.org/gdal/trunk@39220 f0d54148-0727-0410-94bb-9a71ac55c965	2329	gdal/frmts/grib/degrib18/degrib/grib2api.c	366;393;475;502
Gdal-20170620-cce4fc19bb	cce4fc19bb	0d6fe6915a	Tue Jun 20 17:57:04 2017 +0000	E00GRID: fix index out of bounds access. Fixes https://bugs.chromium.org/p/oss-fuzz/issues/detail?id=2327. Credit to OSS Fuzz	commit cce4fc19bb553db2a40e1bad04a903fc2c4566a6Author: Even Rouault <even.rouault@mines-paris.org>Date:   Tue Jun 20 17:57:04 2017 +0000    E00GRID: fix index out of bounds access. Fixes https://bugs.chromium.org/p/oss-fuzz/issues/detail?id=2327. Credit to OSS Fuzz        git-svn-id: https://svn.osgeo.org/gdal/trunk@39206 f0d54148-0727-0410-94bb-9a71ac55c965	2327	gdal/frmts/e00grid/e00read.c	355;371
Gdal-20170620-0d6fe6915a	0d6fe6915a	2f738f2b74	Tue Jun 20 10:24:12 2017 +0000	BSB: avoid int32 overflow. Fixes https://bugs.chromium.org/p/oss-fuzz/issues/detail?id=2324. Credit to OSS Fuzz	commit 0d6fe6915aa1539196ec998398ba214189b5c776Author: Even Rouault <even.rouault@mines-paris.org>Date:   Tue Jun 20 10:24:12 2017 +0000    BSB: avoid int32 overflow. Fixes https://bugs.chromium.org/p/oss-fuzz/issues/detail?id=2324. Credit to OSS Fuzz        git-svn-id: https://svn.osgeo.org/gdal/trunk@39205 f0d54148-0727-0410-94bb-9a71ac55c965	2324	gdal/frmts/bsb/bsb_read.c	471;489
Gdal-20170620-62971f3973	62971f3973	d39e600856	Tue Jun 20 09:20:44 2017 +0000	ISIS2: avoid int overflow. Fixes https://bugs.chromium.org/p/oss-fuzz/issues/detail?id=2322. Credit to OSS Fuzz	commit 62971f397368c872268d3faceca160bada07f196Author: Even Rouault <even.rouault@mines-paris.org>Date:   Tue Jun 20 09:20:44 2017 +0000    ISIS2: avoid int overflow. Fixes https://bugs.chromium.org/p/oss-fuzz/issues/detail?id=2322. Credit to OSS Fuzz        git-svn-id: https://svn.osgeo.org/gdal/trunk@39203 f0d54148-0727-0410-94bb-9a71ac55c965	2322	gdal/frmts/pds/isis2dataset.cpp	622
Gdal-20170620-d39e600856	d39e600856	4827ead20f	Tue Jun 20 09:02:21 2017 +0000	netCDF: avoid creating variables with too many dimensions in fuzzing compatible mode. Fixes https://bugs.chromium.org/p/oss-fuzz/issues/detail?id=2319. Credit to OSS Fuzz	commit d39e600856efa2fe7f4a9dc049784b92f7957381Author: Even Rouault <even.rouault@mines-paris.org>Date:   Tue Jun 20 09:02:21 2017 +0000    netCDF: avoid creating variables with too many dimensions in fuzzing compatible mode. Fixes https://bugs.chromium.org/p/oss-fuzz/issues/detail?id=2319. Credit to OSS Fuzz        git-svn-id: https://svn.osgeo.org/gdal/trunk@39202 f0d54148-0727-0410-94bb-9a71ac55c965	2319	gdal/frmts/netcdf/netcdfdataset.cpp	5724;5841
Gdal-20170619-e09c5950e4	e09c5950e4	e56d7d15e2	Mon Jun 19 14:20:46 2017 +0000	GTiff: avoid re-opening in strip chop mode if one of the (non-main) directories would involve too much memory allocation. Fixes https://bugs.chromium.org/p/oss-fuzz/issues/detail?id=2317. Credit to OSS Fuzz	commit e09c5950e412ba08955ebdfa7ce21883ef842cc8Author: Even Rouault <even.rouault@mines-paris.org>Date:   Mon Jun 19 14:20:46 2017 +0000    GTiff: avoid re-opening in strip chop mode if one of the (non-main) directories would involve too much memory allocation. Fixes https://bugs.chromium.org/p/oss-fuzz/issues/detail?id=2317. Credit to OSS Fuzz        git-svn-id: https://svn.osgeo.org/gdal/trunk@39194 f0d54148-0727-0410-94bb-9a71ac55c965	2317	gdal/frmts/gtiff/geotiff.cpp	11669;11791
Gdal-20170619-e56d7d15e2	e56d7d15e2	78b178fa5c	Mon Jun 19 13:19:19 2017 +0000	OGR_GreatCircle_ExtendPosition(): avoid division by zero. Fixes https://bugs.chromium.org/p/oss-fuzz/issues/detail?id=2316. Credit to OSS Fuzz	commit e56d7d15e2cbdb2ee087b8a41967b84c51e3ba17Author: Even Rouault <even.rouault@mines-paris.org>Date:   Mon Jun 19 13:19:19 2017 +0000    OGR_GreatCircle_ExtendPosition(): avoid division by zero. Fixes https://bugs.chromium.org/p/oss-fuzz/issues/detail?id=2316. Credit to OSS Fuzz        git-svn-id: https://svn.osgeo.org/gdal/trunk@39193 f0d54148-0727-0410-94bb-9a71ac55c965	2316	gdal/ogr/GNUmakefile;gdal/ogr/ogr_geo_utils.cpp	75;153
Gdal-20170619-78b178fa5c	78b178fa5c	5d4fb5549b	Mon Jun 19 11:03:33 2017 +0000	GTiff: fix potential infinite loop when parsing some 24-bit float denormalized numbers. Fixes https://bugs.chromium.org/p/oss-fuzz/issues/detail?id=2315. Credit to OSS Fuzz	commit 78b178fa5c7861a10b5eadda77c8e9e697f8fef3Author: Even Rouault <even.rouault@mines-paris.org>Date:   Mon Jun 19 11:03:33 2017 +0000    GTiff: fix potential infinite loop when parsing some 24-bit float denormalized numbers. Fixes https://bugs.chromium.org/p/oss-fuzz/issues/detail?id=2315. Credit to OSS Fuzz        git-svn-id: https://svn.osgeo.org/gdal/trunk@39190 f0d54148-0727-0410-94bb-9a71ac55c965	2315	gdal/frmts/gtiff/tif_float.c	149
Gdal-20170619-5d4fb5549b	5d4fb5549b	229984203b	Mon Jun 19 09:05:53 2017 +0000	DIPEX: avoid int oveflow. Fixes https://bugs.chromium.org/p/oss-fuzz/issues/detail?id=2312. Credit to OSS Fuzz	commit 5d4fb5549bf28721a272254fd4ceea0b9a38885aAuthor: Even Rouault <even.rouault@mines-paris.org>Date:   Mon Jun 19 09:05:53 2017 +0000    DIPEX: avoid int oveflow. Fixes https://bugs.chromium.org/p/oss-fuzz/issues/detail?id=2312. Credit to OSS Fuzz        git-svn-id: https://svn.osgeo.org/gdal/trunk@39189 f0d54148-0727-0410-94bb-9a71ac55c965	2312	gdal/frmts/raw/dipxdataset.cpp	230
Gdal-20170619-229984203b	229984203b	7538bb3f31	Mon Jun 19 08:17:38 2017 +0000	E00GRID: avoid int overflow and excessive memory allocation. Fixes https://bugs.chromium.org/p/oss-fuzz/issues/detail?id=2309. Credit to OSS Fuzz	commit 229984203b78e1f7b47c5141c4cf955ebf588c37Author: Even Rouault <even.rouault@mines-paris.org>Date:   Mon Jun 19 08:17:38 2017 +0000    E00GRID: avoid int overflow and excessive memory allocation. Fixes https://bugs.chromium.org/p/oss-fuzz/issues/detail?id=2309. Credit to OSS Fuzz        git-svn-id: https://svn.osgeo.org/gdal/trunk@39188 f0d54148-0727-0410-94bb-9a71ac55c965	2309	gdal/frmts/e00grid/e00griddataset.cpp	567;719
Gdal-20170618-8bcb84e5a6	8bcb84e5a6	4b86d1dcc2	Sun Jun 18 14:08:52 2017 +0000	ISIS3: fix integer overflow. Fixes https://bugs.chromium.org/p/oss-fuzz/issues/detail?id=2304. Credit to OSS Fuzz	commit 8bcb84e5a6ed1c52e12a65b9bb16b6c0db268729Author: Even Rouault <even.rouault@mines-paris.org>Date:   Sun Jun 18 14:08:52 2017 +0000    ISIS3: fix integer overflow. Fixes https://bugs.chromium.org/p/oss-fuzz/issues/detail?id=2304. Credit to OSS Fuzz        git-svn-id: https://svn.osgeo.org/gdal/trunk@39173 f0d54148-0727-0410-94bb-9a71ac55c965	2304	gdal/frmts/pds/isis3dataset.cpp	838;2549
Gdal-20170618-2e2b5d0c69	2e2b5d0c69	639a22a3a5	Sun Jun 18 10:58:57 2017 +0000	netCDF: avoid stack buffer overflow. Fixes https://bugs.chromium.org/p/oss-fuzz/issues/detail?id=2302. Credit to OSS Fuzz	commit 2e2b5d0c691bef77a4188f2418e4425a53c8f70fAuthor: Even Rouault <even.rouault@mines-paris.org>Date:   Sun Jun 18 10:58:57 2017 +0000    netCDF: avoid stack buffer overflow. Fixes https://bugs.chromium.org/p/oss-fuzz/issues/detail?id=2302. Credit to OSS Fuzz        git-svn-id: https://svn.osgeo.org/gdal/trunk@39159 f0d54148-0727-0410-94bb-9a71ac55c965	2302	gdal/frmts/netcdf/netcdfdataset.cpp	2845
Gdal-20170618-639a22a3a5	639a22a3a5	4c3d97a875	Sun Jun 18 10:45:36 2017 +0000	ELAS: avoid int32 overflow. Fixes https://bugs.chromium.org/p/oss-fuzz/issues/detail?id=2301. Credit to OSS Fuzz	commit 639a22a3a5bf7038dd172e8e9e3cc0a3e79b06eaAuthor: Even Rouault <even.rouault@mines-paris.org>Date:   Sun Jun 18 10:45:36 2017 +0000    ELAS: avoid int32 overflow. Fixes https://bugs.chromium.org/p/oss-fuzz/issues/detail?id=2301. Credit to OSS Fuzz        git-svn-id: https://svn.osgeo.org/gdal/trunk@39158 f0d54148-0727-0410-94bb-9a71ac55c965	2301	gdal/frmts/elas/elasdataset.cpp	373
Gdal-20170618-d67ce3edf0	d67ce3edf0	e874600eaf	Sun Jun 18 00:09:28 2017 +0000	GRIB / g2clib: fix heap buffer overflow. Fixes https://bugs.chromium.org/p/oss-fuzz/issues/detail?id=2297. Credit to OSS Fuzz	commit d67ce3edf09a8b2e474faf7dbe4fb9b88f72abeaAuthor: Even Rouault <even.rouault@mines-paris.org>Date:   Sun Jun 18 00:09:28 2017 +0000    GRIB / g2clib: fix heap buffer overflow. Fixes https://bugs.chromium.org/p/oss-fuzz/issues/detail?id=2297. Credit to OSS Fuzz        git-svn-id: https://svn.osgeo.org/gdal/trunk@39154 f0d54148-0727-0410-94bb-9a71ac55c965	2297	gdal/frmts/grib/degrib18/g2clib-1.0.4/g2_unpack3.c	77;93;135;163
Gdal-20170617-e874600eaf	e874600eaf	3263f797fa	Sat Jun 17 14:02:10 2017 +0000	BSB: prevent int32 overflow. Fixes https://bugs.chromium.org/p/oss-fuzz/issues/detail?id=2294. Credit to OSS Fuzz	commit e874600eaf1773b9f2b611713ca493abaf9d5694Author: Even Rouault <even.rouault@mines-paris.org>Date:   Sat Jun 17 14:02:10 2017 +0000    BSB: prevent int32 overflow. Fixes https://bugs.chromium.org/p/oss-fuzz/issues/detail?id=2294. Credit to OSS Fuzz        git-svn-id: https://svn.osgeo.org/gdal/trunk@39153 f0d54148-0727-0410-94bb-9a71ac55c965	2294	gdal/frmts/bsb/bsb_read.c	489
Gdal-20170617-3263f797fa	3263f797fa	ed93f7ea81	Sat Jun 17 13:55:05 2017 +0000	WMTS: avoid division by zero. Fixes https://bugs.chromium.org/p/oss-fuzz/issues/detail?id=2293. Credit to OSS Fuzz	commit 3263f797fa62c15c5768e25a92c3df79184f83f1Author: Even Rouault <even.rouault@mines-paris.org>Date:   Sat Jun 17 13:55:05 2017 +0000    WMTS: avoid division by zero. Fixes https://bugs.chromium.org/p/oss-fuzz/issues/detail?id=2293. Credit to OSS Fuzz        git-svn-id: https://svn.osgeo.org/gdal/trunk@39152 f0d54148-0727-0410-94bb-9a71ac55c965	2293	gdal/frmts/wmts/wmtsdataset.cpp	719
Gdal-20170617-d0f8c74b58	d0f8c74b58	5a401cfdff	Sat Jun 17 07:09:54 2017 +0000	FAST: avoid null pointer dereference. Fixes https://bugs.chromium.org/p/oss-fuzz/issues/detail?id=2290. Credit to OSS Fuzz	commit d0f8c74b586299ebe14af695f8fb6b38d756f28bAuthor: Even Rouault <even.rouault@mines-paris.org>Date:   Sat Jun 17 07:09:54 2017 +0000    FAST: avoid null pointer dereference. Fixes https://bugs.chromium.org/p/oss-fuzz/issues/detail?id=2290. Credit to OSS Fuzz        git-svn-id: https://svn.osgeo.org/gdal/trunk@39147 f0d54148-0727-0410-94bb-9a71ac55c965	2290	gdal/frmts/raw/fastdataset.cpp	990
Gdal-20170616-0b2afe570b	0b2afe570b	ecbcfdb125	Fri Jun 16 21:57:18 2017 +0000	PDS: prevent integer overflows. Fixes https://bugs.chromium.org/p/oss-fuzz/issues/detail?id=2284. Credit to OSS Fuzz	commit 0b2afe570bc91794138f4fbe52ab3d8b4b23c4feAuthor: Even Rouault <even.rouault@mines-paris.org>Date:   Fri Jun 16 21:57:18 2017 +0000    PDS: prevent integer overflows. Fixes https://bugs.chromium.org/p/oss-fuzz/issues/detail?id=2284. Credit to OSS Fuzz        git-svn-id: https://svn.osgeo.org/gdal/trunk@39143 f0d54148-0727-0410-94bb-9a71ac55c965	2284	gdal/frmts/pds/pdsdataset.cpp	780;787
Gdal-20170616-efd4e7f30d	efd4e7f30d	7f7b4ab191	Fri Jun 16 19:08:48 2017 +0000	grib / degrib: avoid integer division by zero. Fixes https://bugs.chromium.org/p/oss-fuzz/issues/detail?id=2283. Credit to OSS Fuzz	commit efd4e7f30d043580ed9c1f0029c82f3fb75bf2daAuthor: Even Rouault <even.rouault@mines-paris.org>Date:   Fri Jun 16 19:08:48 2017 +0000    grib / degrib: avoid integer division by zero. Fixes https://bugs.chromium.org/p/oss-fuzz/issues/detail?id=2283. Credit to OSS Fuzz        git-svn-id: https://svn.osgeo.org/gdal/trunk@39141 f0d54148-0727-0410-94bb-9a71ac55c965	2283	gdal/frmts/grib/degrib18/degrib/grib2api.c	366;471
Gdal-20170616-7f7b4ab191	7f7b4ab191	4264d1bfb4	Fri Jun 16 16:47:41 2017 +0000	WMS: prevent int overflow. Fixes https://bugs.chromium.org/p/oss-fuzz/issues/detail?id=2281. Credit to OSS Fuzz	commit 7f7b4ab19124b309ee3175376f5c11750aa89965Author: Even Rouault <even.rouault@mines-paris.org>Date:   Fri Jun 16 16:47:41 2017 +0000    WMS: prevent int overflow. Fixes https://bugs.chromium.org/p/oss-fuzz/issues/detail?id=2281. Credit to OSS Fuzz        git-svn-id: https://svn.osgeo.org/gdal/trunk@39140 f0d54148-0727-0410-94bb-9a71ac55c965	2281	gdal/frmts/wms/wmsutils.cpp	96
Gdal-20170616-4264d1bfb4	4264d1bfb4	dd2e47ddd9	Fri Jun 16 15:30:04 2017 +0000	CEOS: fix memleak in error code path. Fixes https://bugs.chromium.org/p/oss-fuzz/issues/detail?id=2279. Credit to OSS Fuzz	commit 4264d1bfb45bd70d96f2291d8761e6ae82dba7f9Author: Even Rouault <even.rouault@mines-paris.org>Date:   Fri Jun 16 15:30:04 2017 +0000    CEOS: fix memleak in error code path. Fixes https://bugs.chromium.org/p/oss-fuzz/issues/detail?id=2279. Credit to OSS Fuzz        git-svn-id: https://svn.osgeo.org/gdal/trunk@39138 f0d54148-0727-0410-94bb-9a71ac55c965	2279	gdal/frmts/ceos/ceosopen.c	165;235
Gdal-20170616-dd2e47ddd9	dd2e47ddd9	c2912d9f5b	Fri Jun 16 13:08:44 2017 +0000	WMS: avoid creating overviews with 0 dimension. Fixes https://bugs.chromium.org/p/oss-fuzz/issues/detail?id=2277. Credit to OSS Fuzz	commit dd2e47ddd98177fa0c390b56010a7fc5845c2b30Author: Even Rouault <even.rouault@mines-paris.org>Date:   Fri Jun 16 13:08:44 2017 +0000    WMS: avoid creating overviews with 0 dimension. Fixes https://bugs.chromium.org/p/oss-fuzz/issues/detail?id=2277. Credit to OSS Fuzz        git-svn-id: https://svn.osgeo.org/gdal/trunk@39137 f0d54148-0727-0410-94bb-9a71ac55c965	2277	gdal/frmts/wms/gdalwmsdataset.cpp;gdal/frmts/wms/gdalwmsrasterband.cpp;gdal/frmts/wms/wmsdriver.h	525;300;313;438
