88a757c4	6831187d	Sat Jul 22 12:45:45 2023 +0200	Fix string truncation. (#2056)
6831187d	7a1509bf	Fri Jul 21 12:24:34 2023 -0400	Debian 12 fixes
5267858b	2bbde5ba	Sat Jul 15 22:23:52 2023 +0200	HTTP: fix another memory access error (#2049)
2bbde5ba	890f1778	Sat Jul 15 14:26:51 2023 +0200	Fix compilation in CI jobs (#2048)
890f1778	5811a561	Fri Jul 14 23:20:06 2023 +0200	ndpireader: fix detection of DoH traffic based on packet distributions (#2045)
fea09e82	abee1a2a	Fri Jul 14 19:52:34 2023 +0200	Fixes risk mask exception handling while improving the overall performance
0dd1ee56	bfbbd187	Fri Jul 14 01:33:00 2023 +0200	HTTP: fix extraction of filename (#2046)
33c42f98	1f55dc51	Thu Jul 13 23:26:35 2023 +0200	Cosmetic fixes
bd0fcb2e	0c5a17ac	Thu Jul 13 10:50:59 2023 +0200	HTTP: fix heap-buffer-overflow (#2044)
859d9ea3	72814bed	Fri Jul 7 18:52:06 2023 +0200	Fixed heap-overflow if compiled with `--enable-tls-sigs`. (#2038)
bdd295bc	bb978907	Thu Jul 6 11:13:34 2023 +0200	fix Stack overflow caused by invalid write in ndpi_automa_match_strin\xe2\x80\xa6  (#2035)
bb978907	076ba967	Wed Jul 5 14:37:38 2023 +0200	STUN: fix detection of Google Voip apps (#2031)
076ba967	d51f8929	Wed Jul 5 14:29:55 2023 +0200	fixed numeric truncation error in diameter.c (#2034)
d51f8929	2e5004dd	Wed Jul 5 14:29:44 2023 +0200	fixed numeric truncation error in rtcp.c (#2033)
2e5004dd	7ffd31eb	Wed Jul 5 14:29:32 2023 +0200	fixed numeric truncation error in kerberos.c (#2032)
dff1f251	86e89b4e	Mon Jul 3 17:21:32 2023 +0200	STUN: fix Skype/MsTeams detection and monitoring logic (#2028)
3a1600ff	7ef80f6b	Mon Jun 26 11:41:01 2023 +0200	Thrift: fix heap-buffer-overflow (#2024)
7ef80f6b	7e64d9f6	Fri Jun 23 21:40:55 2023 +0200	Optimizes and fixes possible out0of0boundary write in ndpi_fill_prefix_v4()
15f0e148	aa25c06a	Thu Jun 22 21:36:40 2023 +0200	minor fixes (#2023)
cdc0bb8c	16788882	Thu Jun 22 16:04:14 2023 +0200	Compilation fix
8dbd5910	cc582052	Wed Jun 21 21:26:29 2023 +0200	Waring fix
570c75d6	2ac240ce	Wed Jun 21 10:38:44 2023 +0200	STUN: fix detection over TCP
46aab35a	3608ab01	Wed Jun 21 09:22:07 2023 +0200	Line: fix heap-buffer-overflow error (#2015)
04be3080	ac06ba83	Sat Jun 17 15:46:06 2023 +0200	Fix access to packet/flow information (#2013)
2321c11e	d0609ea6	Thu Jun 15 12:01:11 2023 +0200	Fix compilation (#2011)
8ea0eaa0	96340cce	Mon Jun 12 17:52:52 2023 +0200	Fix missing u_char, u_short and u_int typedefs for some platforms e.g.: (#2009)
7150b40c	3e640a13	Thu Jun 8 17:07:25 2023 +0200	QUIC: fix dissection of packets forcing VN
3e640a13	fd4cb101	Thu Jun 8 17:07:25 2023 +0200	QUIC: fix a memory access error
552c9b3c	efb261a9	Mon May 29 19:34:26 2023 +0200	fixed numeric truncation error in ndpi_main.c:6837 (#1998)
efb261a9	346bb268	Mon May 29 19:24:00 2023 +0200	Fix some memory errors triggered by allocation failures (#1995)
82fa3a09	46ff0691	Mon May 29 16:53:39 2023 +0200	Fix an heap-buffer-overflow (#1994)
334b4357	f692342f	Wed May 24 13:19:06 2023 +0200	Fixed invalid use of ndpi_free(). Sorry, my fault. (#1988)
86b56646	5e8f93c2	Sat May 20 17:23:48 2023 +0200	ndpiReader: fix export of DNS/BitTorrent attributes (#1985)
5e8f93c2	8f718c90	Sat May 20 16:18:52 2023 +0200	Improved missing usage of nDPIs malloc wrapper. Fixes #1978. (#1979)
9004d5c2	1ab5318f	Sat May 20 15:12:14 2023 +0200	ndpiReader: fix export of HTTP attributes (#1982)
dd7198fc	5ca6f0ac	Sat May 20 15:09:51 2023 +0200	fixed numeric truncation error
b1bcf1ff	ace32c9d	Wed May 17 11:26:25 2023 +0200	Fix classification-by-ip in `ndpi_detection_giveup` (#1981)
8c224b46	596a5fd5	Wed May 10 21:00:27 2023 +0200	Fix MS Teams detection with heuristic (#1972)
02a2c804	a11ddd2d	Thu May 4 11:52:48 2023 +0200	ndpiReader: fix print of flow payload (#1960)
c4ba9813	d3e67faf	Mon Apr 24 08:49:11 2023 +0200	Compilation fix on RH7
b6629ba2	85751ba9	Fri Apr 21 12:40:26 2023 +0200	Improved debug output. (#1951)
ba993300	032e778a	Fri Apr 14 11:17:37 2023 +0200	ndpiReader: fix flow stats (#1943)
77ea8086	6da95865	Tue Apr 11 15:39:09 2023 +0200	Improved debug logging.
c7ef3608	c47e9d20	Sun Apr 9 10:16:28 2023 +0200	CI: fix `Performance` job (#1936)
7a627296	b639744c	Thu Apr 6 09:36:11 2023 +0200	Fix LRU/Patricia/Automa stats in `ndpiReader` with multiple threads (#1934)
22cf8b5d	06a63dcb	Thu Apr 6 09:35:27 2023 +0200	configure: add an option to enable debug build, i.e `-g` (#1929)
5c28dbba	25c11119	Thu Apr 6 09:32:57 2023 +0200	H323: fix false positives (#1916)
6e0cd162	9ea8a578	Thu Mar 30 05:12:40 2023 +0200	TLS: fix another interger overflow in certificate processing (#1915)
04a426fe	ddb9aa0f	Sat Mar 25 19:19:51 2023 +0100	ndpiReader: fix VXLAN de-tunneling (#1913)
ddb9aa0f	530d0de4	Wed Mar 22 18:18:36 2023 +0100	TLS: fix parsing of certificate elements (#1910)
9f46d41e	9eff0754	Tue Mar 14 22:16:57 2023 +0100	FreeBSD compilation fix (C) update
d398f232	89cae9dd	Mon Mar 6 17:33:08 2023 +0100	Added fix for better handling exceptions rollback in case of later match
3047e286	22fb8349	Thu Mar 2 14:30:20 2023 +0100	Fix insert of ip addresses into patricia tree(s) (#1895)
27683669	e0ad5b49	Wed Mar 1 20:46:40 2023 +0100	Fixed missing AS_HELP_STRING in configure.ac. (#1893)
9eb96645	127d8d0d	Wed Mar 1 20:34:56 2023 +0100	SoftEther: fix invalid memory access
127d8d0d	21c75501	Mon Feb 27 21:26:41 2023 +0100	Fixed uninitialized variable
96f0f85e	6a2e8c9f	Mon Feb 27 12:20:06 2023 +0100	Indent fix
f2f8f9d0	090ba573	Tue Feb 14 21:30:36 2023 +0100	Fix export/serialization of `flow->risk` (#1885)
f10178f8	200d1d4c	Mon Feb 13 11:32:17 2023 +0100	Fix packet counters (#1884)
200d1d4c	a3a9a72f	Mon Feb 13 11:31:52 2023 +0100	Fix detection of packet direction and NDPI_UNIDIRECTIONAL_TRAFFIC risk (#1883)
a3a9a72f	85bab9e6	Mon Feb 13 11:19:11 2023 +0100	Fix compilation with GCC-7 and latest RoaringBitmap code (#1886)
85bab9e6	bf413afb	Mon Feb 13 01:02:27 2023 +0100	Centos7 fixes
9f27cd56	3e6cadbb	Mon Jan 30 10:59:18 2023 +0100	ndpiReader: fix packet dissection (CAPWAP and TSO) (#1878)
3e6cadbb	6d00a9e0	Fri Jan 27 07:09:34 2023 +0100	ndpireader: fix "Discarded bytes" statistics (#1877)
b2a8b483	34775606	Wed Jan 25 14:49:45 2023 +0100	Fix compilation and CI (#1875)
464269e5	a3d3856c	Wed Jan 25 11:52:46 2023 +0100	CenOS compilation fix
a3d3856c	9fc724de	Wed Jan 25 11:45:35 2023 +0100	Compilation fixes
5e8c1ebb	496b284c	Fri Jan 20 14:27:33 2023 +0100	fuzz: fix memory allocation failure logic (#1867)
496b284c	c4274a4a	Thu Jan 19 22:02:23 2023 +0100	Bittorrent: fix detection over TCP (#1868)
f5c2f928	f95bdaf6	Thu Jan 19 14:13:17 2023 +0100	Fix undefined-behaviour in ahocorasick callback (#1864)
f95bdaf6	edb8165a	Thu Jan 19 14:12:51 2023 +0100	Bittorrent: fix heap-buffer-overflow (#1863)
02f52207	1b98bec0	Wed Jan 18 18:26:54 2023 +0100	Fuzz: fix compilation with nBPF (#1860)
ebb9ebd2	1f7c57de	Tue Jan 17 08:26:42 2023 +0100	Fix classification "by-port" (#1851)
5a5e01a9	663df7e4	Thu Jan 5 16:41:53 2023 +0100	PPSTREAM: fix some heap-buffer overflows (#1846)
663df7e4	9c83f0f3	Tue Jan 3 20:11:24 2023 +0100	Fix missing bracket at ppstream (#1843)
9c83f0f3	cb15d2b3	Tue Jan 3 13:21:54 2023 +0100	Fix some warnings and two errors found while fuzzing (#1844)
e9d5e72f	22821241	Wed Dec 21 10:55:14 2022 +0100	Fix infinite loop when a custom rule has port 65535 (#1833)
22821241	fa67166f	Tue Dec 20 22:50:18 2022 +0100	Fix some errors found by oss-fuzz (#1834)
3c4b12e0	390dc1d1	Fri Dec 16 12:22:07 2022 +0100	README: another try to fix build badge (#1836)
390dc1d1	de289f13	Fri Dec 16 12:04:16 2022 +0100	README: fix build badge link (#1835)
dbff2fba	5704e4c1	Thu Dec 15 19:17:05 2022 +0100	Minor RTP fix
2edbe3c1	88d4a25c	Sun Dec 11 10:24:42 2022 +0100	Centos7 fix
88d4a25c	48a7f6d4	Sun Dec 11 10:21:44 2022 +0100	Rocky9 fix
79931b2e	9dc433f7	Sat Dec 10 18:31:51 2022 +0100	Fix undefined-behavior when setting empty user-agent (#1821)
9f7ef723	6004e55d	Sat Dec 10 09:18:36 2022 +0100	fuzz: fix signed-integer-overflow (#1822)
6004e55d	eacc2b8e	Sat Dec 10 09:13:20 2022 +0100	Build: fix `make install` when `--prefix=` is used in configure script (#1824)
946c3dba	57562b3d	Mon Dec 5 22:33:29 2022 +0100	Fix compilation (#1819)
197a9a6c	e49fe32f	Fri Dec 2 23:26:22 2022 +0100	Extend CodeQL configuration and fix two warnings (#1816)
afb5c3e6	6e6f1e44	Tue Nov 22 18:00:02 2022 +0100	Fix classification "by-port" of QUIC flows (#1785)
6e6f1e44	2b65a4e0	Tue Nov 22 16:44:08 2022 +0100	GitHub Actions: fix a warning (#1807)
388d01a3	b5e8d86d	Tue Nov 15 16:29:10 2022 +0100	DNS: fix an infinite loop, due to an integer overflow (#1804)
52b562c3	9e73d61f	Mon Nov 7 20:36:55 2022 +0100	Fix json export of ipv6 addresses
9e73d61f	41a5ba1b	Mon Oct 31 13:53:23 2022 +0100	Fix supported versions.
f30479b4	a16cd963	Wed Oct 26 16:05:32 2022 +0200	Fix typo
2ed2e5dc	550f3e5b	Tue Oct 25 16:22:40 2022 +0200	Fix memory corruption on TCP flows (#1786)
550f3e5b	e674a8ae	Tue Oct 25 16:16:24 2022 +0200	IRC: fix memory access (#1787)
223a6fb9	3d0c36cf	Mon Oct 17 23:15:07 2022 +0200	Fix a use-of-uninitialized-value error on PCRE code
2d153fba	6c84ce85	Fri Oct 14 18:59:33 2022 +0000	HTTP: fix stack-buffer-overflow (#1768)
6c84ce85	8c4ece94	Fri Oct 14 20:16:47 2022 +0200	ndpiReader: fix help message. There isn\'t a \'J\' option (#1770)
c4fb2a59	3c0021d6	Thu Oct 6 09:25:21 2022 +0000	irc: fix heap-buffer-overflow (#1765)
3c0021d6	fba926d6	Thu Oct 6 09:16:02 2022 +0200	Fixes Stack-buffer-overflow READ {*} \xc2\xb7 check_content_type_and_change_protocol
cca58505	131d5389	Tue Oct 4 22:17:05 2022 +0200	Fix compilation and sync utests results
66a8010e	c83e0b3c	Sun Oct 2 12:48:24 2022 +0200	Fix ndpi_timeval_to_milliseconds/microseconds for platforms with tv_usec is an unsigned int. (#1762)
fbf30d1a	a27538b7	Thu Sep 29 18:15:37 2022 +0200	Fixed invalid unidirectional traffic alert for unidirectional protocols (e.g. sFlow)
ac7a3669	39f9b8ca	Sun Sep 25 13:31:57 2022 +0200	Fix value of `ndpi_protocol->protocol_by_ip`
c6201284	644ad349	Wed Sep 21 20:02:23 2022 +0200	NAT-PMP: fix metadata extraction
3db6413a	50ee6768	Wed Sep 21 18:03:22 2022 +0200	Fixed VS2019 build.
03d217ea	c960bb50	Wed Sep 21 16:49:51 2022 +0200	Fix CI after nBPF integration (#1746)
c960bb50	aef8e53b	Wed Sep 21 10:27:46 2022 +0200	Copilation fix
174cd739	48d00eae	Sun Sep 18 12:40:49 2022 +0200	Fix warnings on OpenWrt CCs, caused by the memcpy builtin. (#1741)
4f584f78	4bb81f76	Mon Sep 12 19:28:41 2022 +0200	Fix `ndpi_do_guess()` (#1731)
e5063f98	0a47f745	Mon Sep 5 23:44:51 2022 +0200	Fix some warnings
01028ee7	378b0c59	Mon Sep 5 11:16:06 2022 +0200	Fix string copy truncation warning. (#1723)
378b0c59	95c1daa8	Mon Sep 5 10:46:02 2022 +0200	Fixed FastCGI memory issue (was not using nDPI\'s malloc wrapper). (#1722)
95c1daa8	b7c10308	Mon Sep 5 10:17:58 2022 +0200	Fix endianess in IP-Port lookup
b7c10308	b9cb3917	Sun Sep 4 19:19:05 2022 +0200	Fix broken ndpi_timeval_to_(milli|micro)seconds (>UINT_MAX). (#1720)
7578d02d	bd29fa46	Thu Sep 1 22:06:57 2022 +0200	Fixes on hw calculation
79653f99	ef99eb67	Tue Aug 30 11:12:00 2022 +0200	Internal gcrypt: fix memory leak
a329730d	8bfb1712	Thu Aug 25 06:44:38 2022 +0200	QUIC: fix heap-buffer-overflow
93a80a1c	93d65ed6	Wed Aug 24 10:49:27 2022 +0200	Fixed serializing bug caused by an unitialized serializer.
93d65ed6	a53f4765	Wed Aug 24 10:49:27 2022 +0200	Support serialization of double-precision floating-point numbers. Fixes #1702.
ac0d7ccb	a53f4765	Mon Aug 22 17:53:52 2022 +0200	HTTP, SoftEther, Florensia: fix some memory corruptions
540848c2	59a9bdeb	Tue Aug 9 18:41:10 2022 +0200	HTTP: fix classification in some corner cases (#1704)
59a9bdeb	2e25c363	Tue Aug 9 18:09:16 2022 +0200	SoftEtehr: fix a heap-buffer overflow (#1705)
2e25c363	52336000	Mon Aug 8 19:04:20 2022 +0200	Add TiVoConnect dissector. Fixes #1697. (#1699)
52336000	120e0156	Sat Aug 6 20:06:56 2022 +0200	HTTP, Bittorrent, Kerberos: fix stopping of extra dissection (#1700)
346e274a	10f283b4	Fri Aug 5 13:43:09 2022 +0200	SoftEther: fix two heap-buffer-overflows (#1695)
10f283b4	9fb11c90	Fri Aug 5 11:17:59 2022 +0200	Fix for systems with no realpath (MacOS)
9fb11c90	bcf7f171	Fri Aug 5 11:17:28 2022 +0200	Win fixes
bcf7f171	ac24b35b	Fri Aug 5 11:17:09 2022 +0200	Win and indentation fixes
63fe4b43	154d6a50	Wed Aug 3 11:12:15 2022 +0200	Compilation fix (not all compilers like restrict) (part 2)
154d6a50	b3e722e5	Wed Aug 3 10:47:31 2022 +0200	Compilation fix (not all compilers like restrict)
2a596c79	8b6a00f8	Sat Jul 30 22:57:20 2022 +0200	HTTP: fix classification (#1692)
8b6a00f8	d54d5083	Sat Jul 30 22:55:46 2022 +0200	SoftEther: fix heap-buffer-overflow (#1691)
d54d5083	8402bd68	Sat Jul 30 12:05:43 2022 +0200	SMTPS, POPS, IMAPS: fix classification and extra dissection (#1685)
40d7354d	9d040f63	Fri Jul 22 21:58:25 2022 +0200	Windows error C2466 fix (array size init with 0).
9d040f63	52005e88	Fri Jul 22 20:14:30 2022 +0200	Windows compilation fix.
ce6f1184	e85d6d7d	Fri Jul 22 12:10:43 2022 +0200	Bittorrent: fix keys in cache code (#1670)
e85d6d7d	00eb2393	Wed Jul 20 21:26:07 2022 +0200	RPM fix
d66aa497	a9204eb9	Wed Jul 20 19:16:18 2022 +0200	DTLS: fix exclusion of DTLS protocol
a9204eb9	e1edb08f	Wed Jul 20 17:23:17 2022 +0200	Rocky fix
e1edb08f	5702c6fb	Wed Jul 20 16:13:55 2022 +0200	SKYPE: fix detection over UDP
b472a492	ac1113b9	Wed Jul 20 13:59:51 2022 +0200	BITTORRENT: fix confidence (#1664)
ac1113b9	be1ac1b4	Wed Jul 20 10:59:17 2022 +0200	ahocorasick: fix char/uchar bug (#1597)
be1ac1b4	b80218a0	Fri Jul 15 14:15:37 2022 +0200	Fix unitialized use of W[16]. (#1662)
40715575	9c235796	Tue Jul 12 18:39:05 2022 +0200	ASN1/BER: fix signed integer overflow (#1660)
2edfaeba	997dce0f	Sun Jul 10 17:07:52 2022 +0200	SNMP: fix detection (#1655)
dfe6557e	51051712	Fri Jul 8 18:39:05 2022 +0200	TFTP: fix memory access (#1653)
c019946f	76459094	Tue Jul 5 17:38:32 2022 +0200	Compilation fix
76459094	52d987b6	Tue Jul 5 17:01:00 2022 +0200	Fix handling of NDPI_UNIDIRECTIONAL_TRAFFIC risk (#1636)
f4a1739f	388dfb8e	Tue Jul 5 16:35:23 2022 +0200	Detect SMTPs w/ STARTTLS as TLS and dissect client/server hello. Fixes #1630. (#1637)
eed47acf	77ac58e5	Sun Jul 3 18:51:16 2022 +0200	Skype_Teams, Mining, SnapchatCall: fix flow category (#1624)
fdb1649a	5fe60876	Sun Jul 3 17:47:58 2022 +0200	Fix category for mail sessions (#1621)
5f6fa6d1	69ccb397	Sun Jul 3 17:43:38 2022 +0200	Fix a compilation warning (#1620)
59b00b00	7c5c811e	Sun Jul 3 11:16:52 2022 +0200	Fix byte-order issue during ndpiReader tcp/udp src/dst port serialization. Fixes #1608. (#1614)
008a1790	bb72aa47	Sat Jul 2 11:49:22 2022 +0200	Fixed SMTP default port 587
5f1caeb5	d393fb96	Tue Jun 28 17:26:11 2022 +0200	Fix after the protocol name update
b2b61011	ab09b8ce	Mon Jun 20 14:27:13 2022 +0200	Fix compilation and sync unit tests results (#1606)
bdf54d72	8dcaa5c0	Tue Jun 14 11:44:32 2022 +0200	Fix invalid memory access (#1596)
8dcaa5c0	defe7d7f	Tue Jun 14 09:29:16 2022 +0200	DNS: fix TTL check and sync unit test results (#1594)
0b3f8ed8	1d492c9e	Sun Jun 5 23:01:56 2022 +0200	Fixed syslog false negatives. (#1582)
1d492c9e	59c084b1	Sun Jun 5 14:45:21 2022 +0200	Fix some debug messages (#1583)
2202365b	b6ae9642	Sun Jun 5 11:19:28 2022 +0200	Fixed invalid DHCP dissection
b6ae9642	7419cfee	Sun Jun 5 11:14:23 2022 +0200	Fixed DHCP dissection bug
7419cfee	338427d7	Sat Jun 4 19:12:53 2022 +0200	Added RSH dissector. Fixes #202. (#1581)
ff8e1e19	09fbe0a6	Sat Jun 4 08:47:47 2022 +0200	Fix syslog heap overflow introduced in 09fbe0a64a11b08a35435f516e9a19f7e0c20d7c. (#1579)
09fbe0a6	6149c0f8	Fri Jun 3 18:21:29 2022 +0200	Fixed syslog false positives. (#1577)
6149c0f8	4ff1bf29	Thu Jun 2 13:07:09 2022 +0200	Fix heap buffer overflow mentioned in #1574. (#1576)
4ff1bf29	eac11030	Thu Jun 2 00:15:52 2022 +0200	TLS: fix use-of-uninitialized-value error (#1573)
9040bc74	354addd6	Tue May 31 10:33:42 2022 +0200	TLS: fix stack-buffer-overflow error (#1567)
ca115774	912b69af	Mon May 30 19:40:47 2022 +0200	TLS: fix use-of-uninitialized-value error (#1566)
c4f50b2c	3b825fca	Mon May 30 14:39:01 2022 +0200	HTTP: fix heap-buffer-overflow error (#1564)
897f8314	1da9f1a3	Mon May 30 01:12:38 2022 +0200	Fixed dispay bug for risk_info
a9d7cc48	9c1a53f3	Sun May 29 22:39:48 2022 +0200	Fix dissection of IPv4 header (#1561)
406ac81a	dfbe863f	Sun May 29 16:40:16 2022 +0200	Compilation fixes for old ggc\'s
1093aafa	6b7b23b0	Sun May 29 16:31:26 2022 +0200	Added detection for WordPress exploits Fixed ndpi_iph_is_valid_and_not_fragmented() that was bugged with non UDP traffic
33f9729e	cfd23e88	Sun May 29 13:12:13 2022 +0200	Added MPEG-DASH dissector. Fixes #1223. (#1555)
cfd23e88	77dc884a	Sat May 28 16:31:35 2022 +0200	Fixed HTTP lower/upper protocol mess for Aimini/IPP. (#1557)
77dc884a	7e3d0614	Sat May 28 16:06:34 2022 +0200	Compilation fixes for old gcc compiler
7e3d0614	6d543808	Fri May 27 17:35:30 2022 +0200	Compilation fixes
6d543808	02ba12b0	Fri May 27 16:58:39 2022 +0200	Version cut fix
02ba12b0	f81f0c5e	Thu May 26 23:34:34 2022 +0200	Fixes compilation issues on RedHat systems
1645fea8	78dfe959	Thu May 26 19:01:13 2022 +0200	Fixed false positives with NATS
7010d17c	83e1ea25	Thu May 26 10:19:57 2022 +0200	Fixed windows-latest build error. (#1552)
dae7986a	3c08a3c8	Mon May 16 16:54:18 2022 +0200	Yet another approach to fix #1499 (basically a copy&pasta from @socketpair).
2e0dedba	434c38c7	Wed May 4 18:43:37 2022 +0200	Fix compilation (if `--enable-debug-messages` is used) (#1539)
5996cf17	81a367f1	Wed May 4 16:07:05 2022 +0200	Fixes bug that prevents triggering alerts for traffic on non-standard ports that have been defined in the custom protocols file
81a367f1	5dcb9c1c	Wed May 4 16:06:50 2022 +0200	Fixes outdated description
d5b922cf	65dd052a	Tue May 3 13:20:44 2022 +0200	Added some Pluralsight Hostnames/SNIs. May fix #1501. (#1538)
c8f72ef7	02d0b5fe	Mon May 2 10:51:08 2022 +0200	Added ndpi_get_flow_error_code() API call Fixed typo
d5005f58	bc2ad340	Mon Apr 25 19:01:11 2022 +0200	Raknet: fix heap-buffer-overflow (#1531)
739dfc54	8b2c9860	Mon Apr 18 20:54:13 2022 +0200	Kerberos: fix Undefined-shift error (#1516)
9c8a3f27	fba75a3c	Fri Apr 15 18:01:34 2022 +0200	Minor fix.
fba75a3c	4775be3d c3df3a12	Fri Apr 15 13:22:25 2022 +0200	Merge pull request #1491 from utoni/fix/windows-msys2
c3df3a12	4775be3d	Thu Apr 14 19:17:48 2022 +0200	Fixed msys2 build warnings and re-activated CI Mingw64 build.
4775be3d	e00997ea	Wed Apr 13 18:10:56 2022 +0200	Kerberos: fix some memory access errors (#1514)
939572c6	06a0abb6	Tue Apr 12 15:34:37 2022 +0200	fix(ndpi_main):Fix memory leak about ndpi_str; (#1513)
06a0abb6	e3faecf9	Sun Apr 10 16:59:34 2022 +0200	TINC: fix invalid memory read (#1512)
e3faecf9	713cdd0b	Sun Apr 10 10:36:10 2022 +0200	Improved ASN.1 parsing for Keberos. Fixes #1492. (#1497)
9537788a	ff993e2f	Thu Apr 7 17:59:11 2022 +0200	Fix JSON-C.
ff993e2f	a6e2f4a1	Thu Apr 7 17:54:41 2022 +0200	Python bindings fix.
e0e23175	8080b3d1	Fri Apr 1 22:01:39 2022 +0200	ndpiReader: fix compilation (#1510)
32a7d424	6eb5bd88	Fri Apr 1 19:07:00 2022 +0200	Fixed incompatibilities due to https://github.com/ntop/nDPI/pull/1509
a75d77b5	61bc9815	Fri Apr 1 17:35:25 2022 +0200	Waring fixes
46dc8b5b	4e199abd	Thu Mar 31 03:21:51 2022 +0200	[autoconf] Fixed .git submodule detection test. (#1507)
ec80f1fb	4896dabb	Sun Mar 27 15:12:39 2022 +0200	Fix CI tests results (#1504)
c7059db8	1207ea11	Tue Mar 22 14:58:22 2022 +0100	Fix typo.
c47d710d	beef4f99	Tue Mar 22 13:40:31 2022 +0100	Fix python bindings CI.
8dd70b70	9e22c88e	Tue Mar 15 19:40:18 2022 +0100	Bug fixing. (#1487)
b83e9f20	7aee856a	Wed Mar 9 22:37:56 2022 +0100	QUIC: fix dissection of draft-34 (#1484)
269be6c7	f9121836	Tue Mar 8 00:21:51 2022 +0100	Some small fixes (#1481)
a1451935	c345b3c7	Tue Mar 8 00:20:56 2022 +0100	Errors fixed (#1482)
c345b3c7	438f0406	Sat Mar 5 15:05:05 2022 +0100	EthernetIP: fix integer conversion on big-endian archs (#1477)
438f0406	a173d3e9	Sat Mar 5 11:44:21 2022 +0100	Fixed a bug for BE architectures (#1478)
a173d3e9	95a3d4ff	Sat Mar 5 11:41:37 2022 +0100	configure: fix usage of libgpg-error with `--with-local-libgcrypt` (#1472)
6f431057	e8559a41	Wed Mar 2 15:14:41 2022 +0100	reader_util: fix parsing of MPLS packets (#1467)
736a80f9	7a7e4ee6	Wed Mar 2 11:03:47 2022 +0100	Fix libgcrypt(-light/-internal) compile error. (#1465)
c390085f	00d9a16b	Mon Feb 28 15:01:00 2022 +0100	Bug fixing. (#1459)
61a3c2eb	8b062295	Sun Feb 27 14:18:23 2022 +0100	reader_util: fix TZSP decapsulation (#1460)
34e020ac	16ed0fd3	Wed Feb 23 21:00:53 2022 +0100	Win fixes
96f8942f	27977906	Tue Feb 22 19:58:17 2022 +0100	reader_util: fix parsing of IPv6 extension headers (#1453)
27977906	fbb97000	Tue Feb 22 19:56:41 2022 +0100	reader_util: fix infinite loop in packet dissection (#1454)
6c1accd2	59993e29	Mon Feb 21 20:30:22 2022 +0100	DTLS: fix access to certificate cache (#1450)
f28a3b29	a2878af1	Sat Feb 19 19:18:02 2022 +0100	Fix compilation and sync unit tests results (#1445)
023618c1	ada7d32c	Thu Feb 10 19:38:11 2022 +0100	Invalid prototupe fix
ada7d32c	1431aa3d	Thu Feb 10 11:46:32 2022 +0100	HSRP: fix dissection over IPv6 (#1443)
f229068f	a6ff0dd0	Wed Feb 9 11:46:39 2022 +0100	Fix memory access in ndpi_strnstr() (#1438)
9838ceb7	be5a29ba	Tue Feb 8 22:17:26 2022 +0100	Added ndpi_serialize_string_string_len() APi call Fixed CSV string serialization
ff38d4b9	79968f32	Mon Feb 7 18:05:12 2022 +0100	TLS: fix parsing of certificate elements (#1435)
9b8679a3	0c70411b	Sat Jan 29 09:18:51 2022 +0100	Fix some race conditions by using atomic operations. (#1420)
c53c82d4	9dcc4a23	Thu Jan 27 15:29:16 2022 +0100	Fixed heap overflow in nDPI realloc wrapper if new size < old size. (#1421)
9dcc4a23	011ee3ec	Thu Jan 27 10:59:35 2022 +0100	Kerberos, TLS, example: fix some memory errors (#1419)
011ee3ec	6d185c05	Wed Jan 26 15:47:38 2022 +0100	Fixed wrong ip tuple comparison. #1386 (#1418)
20b9f01f	a0bb0ab0	Fri Jan 21 17:35:38 2022 +0100	Fix ndpi_serialize_string_int64
e16b6a18	6f336f83	Fri Jan 21 12:40:35 2022 +0100	Fix Grease values parsing (#1416)
d91477b1	771b6606	Wed Jan 19 23:10:10 2022 +0100	Fixed certificate mismatch check
771b6606	9eee257b	Wed Jan 19 10:19:58 2022 +0100	Fixed an issue on CentOS 7 introduced by https://github.com/ntop/nDPI/commit/c2b7d77784beeae5f86f19e33ba3da5ddce55898
9f050fa0	bd036f96	Tue Jan 18 21:52:37 2022 +0100	TLS, H323, examples: fix some memory errors (#1414)
bd036f96	c2b7d777	Tue Jan 18 19:11:01 2022 +0100	Netbios, CSGO: fix two memory errors (#1413)
e4a7990a	d19bd965	Mon Jan 17 19:47:27 2022 +0100	H323: fix a use-after-poison error (#1412)
1ff308af	05734f3d	Sun Jan 16 20:31:48 2022 +0100	TLS: fix a use-of-uninitialized-value error (#1411)
05734f3d	611c753d	Sun Jan 16 19:28:39 2022 +0100	Zattoo: fix Null-dereference READ with ipv6 traffic (#1410)
611c753d	f3af39ee	Sun Jan 16 16:19:00 2022 +0100	XBox, Diameter: fix dissectors initialization (#1405)
e46b508a	eb5d7b07	Sat Jan 15 20:53:36 2022 +0100	Kerberos: fix use-of-uninitialized-value error (#1409)
eb5d7b07	63c44a24	Sat Jan 15 18:47:59 2022 +0100	TLS: fix heap-buffer-overflow error (#1408)
63c44a24	20b5f6d7	Sat Jan 15 17:35:06 2022 +0100	STUN: fix "confidence" value for some classifications (#1407)
533b3ab0	406ac7e8	Thu Jan 13 21:15:21 2022 +0100	FreeBSD fixes
dc60cd09	d59fefd0	Thu Jan 13 17:35:06 2022 +0100	fix ahocorasick on big-endian machines (#1401)
f30fbc32	b080a1c1	Wed Jan 12 20:51:29 2022 +0100	Fix DGA false positive (#1399)
b080a1c1	552d199d	Wed Jan 12 20:24:57 2022 +0100	Fix two use-of-uninitialized-value errors (#1398)
06f3b079	3a087e95	Tue Jan 11 17:57:34 2022 +0100	QUIC: fix an integer overflow (#1396)
bf69321a	4d27001d	Sat Jan 8 20:40:24 2022 +0100	GTP: fix some false positives (#1394)
a16b4aa5	7aad97ff	Sun Dec 19 22:29:25 2021 +0100	Fix a global-buffer-overflow when loading Azure list (#1388)
ec6eea0c	74519f6e	Sat Dec 18 12:03:32 2021 +0100	TLS: fix usage of certificate cache (#1384)
f11b215c	8e512ff5	Fri Dec 17 12:10:34 2021 +0100	QUIC: fix old versions of GQUIC on big-endian machines (#1387)
85b396ca	cefcc25b	Tue Dec 7 14:45:42 2021 +0100	Fixed issue that prevented alt certificate names to be fully detected when ipAddress and rfc822Name were specified in certificates
947896ad	7cba34a1	Sat Dec 4 20:22:05 2021 +0100	Fix configure script (after fb85dac9) (#1381)
fb85dac9	fe2822c6	Sat Dec 4 13:21:57 2021 +0100	Configure improvements Fixed invalid anomaly detection in rrd_anomaly
5e0befd5	4f81cdc1	Tue Nov 30 17:24:42 2021 +0100	Fixed seriealizer unit
fd02e1b3	4c39ed29	Tue Nov 23 10:57:13 2021 +0100	QUIC: fix extra dissection (#1376)
afc2b641	da473577	Mon Nov 15 16:20:57 2021 +0100	Fix writes to `flow->protos` union fields (#1354)
9abf528c	5464bad6	Mon Nov 8 12:42:15 2021 +0100	BitTorrent cache debug
a8a3c6f7	55880e4a	Wed Nov 3 15:40:07 2021 +0100	Fix use-of-uninitialized-value (#1366)
55880e4a	1f6c94e6	Tue Nov 2 22:08:15 2021 +0100	TLS: fix two warnings (#1365)
b11065b2	9f8c1e86	Tue Nov 2 12:06:18 2021 +0100	Fixed certificate mismatch for TLS flows with no client hello observed
a9aa4628	a25d9d87	Thu Oct 28 10:16:33 2021 +0200	Little change in TLS debug traces
5283755a	aaa474a3	Wed Oct 27 22:51:59 2021 +0200	Fixed TLS certificate dissection of subjectAltName
41765efc	5ccc61d1	Tue Oct 26 21:34:01 2021 +0200	Detect invalid characters in text and set a risk. Fixes #1347. (#1363)
5ccc61d1	b6d95365	Mon Oct 25 18:52:27 2021 +0200	Fixed Git protocol dissection (#1355)
b6d95365	333a6d60	Mon Oct 25 15:04:04 2021 +0200	Fixed cleartext protocol assignment (#1357)
333a6d60	c3d1c697	Fri Oct 22 14:57:49 2021 +0200	TLS: fix a heap-buffer-overflow (#1356)
c3d1c697	8db8c8ae	Wed Oct 20 22:07:47 2021 +0200	Fixed heap-buffer-overflow in TLS dissector
8db8c8ae	fea3991a	Tue Oct 19 21:42:55 2021 +0200	Fix QUIC log and remove SoulSeek leftovers after b97dc6ba (#1351)
fea3991a	06f13fd2	Tue Oct 19 12:07:47 2021 +0200	Fix some invalid memory reads (#1350)
ed51987e	7d3c3b23	Mon Oct 18 23:16:32 2021 +0200	Fix broken fuzz_process_packet fuzzer by adding a call to ndpi_finalize_initialization(). (#1334)
